,의안번호,의안명,제안일자,제안자구분,의결일자,의결결과,제안회기,제안이유,소관위원회,제안자,발의자,제안정당,성별,여성의원 수
13,162855,학교급식법중개정법률안,2003-11-03,의원,2004-05-29,임기만료폐기,제16대 (2000~2004) 제243회,"      학교급식은 균형있는 영양공급을 통해 자라나는 청소년들의 성장 발육에 도움을 줌은 물론, 여성에 대한 사회진출의 기반조성, 저소득층 아동에 대한 사회적 배려 등 많은 장점을 가지고 있음. 특히 일부 지방자치단체에서는 학교급식에 우수한 식자재를 공급하기 위하여 조례로 식품비를 지급할 수 있도록 규정하는 등 전폭적인 재정지원에 노력하고 있음.그러나 조례를 통한 자치단체의 학교급식 지원은 일반 자치와 교육자치를 구분한 지방자치법  교육자치에관한법률에 위배되며, 현행 학교급식법 제8조의 해석상 곤란하다는 지적에 따라 중앙부서와 마찰을 빚는 등 여러 가지 문제가 제기되고 있는바, 이를 해결하기 위하여 시?도, 시?군?자치구 등 지방자치단체가 학교급식에 필요한 재료비 등을 지급할 수 있는 근거를 마련하고자 함(안 제8조제2항).  ",교육위원회,"['이주영', '김형오', '박재욱', '박헌기', '안상수', '안택수', '오경훈', '오세훈', '이근진', '이용삼', '이윤성', '이인기', '장성원', '정병국', '조웅규', '황우여']",이주영,한나라당,남성,0
14,162826,정부조직법중개정법률안,2003-10-30,정부,2003-12-30,대안반영폐기,제16대 (2000~2004) 제243회,"   각종 재난에 대한 예방?대응  복구기능을 강화하고 효율적인 안전관리체제를 구축하기 위하여 행정자치부장관 소속하에 소방방재청을 신설하고, 참여정부 국정과제의 효율적 추진을 위하여 행정개혁, 인사관리  영유아(?유아) 보육 업무 등 중앙행정기관의 소관 사무를 일부 조정하는 한편, 법제업무와 보훈업무의 효율적 수행을 위하여 법제처와 국가보훈처를 장관급 기구로 격상하려는 것임. 1. 참여정부의 핵심국정과제인 행정개혁 업무를 보다 종합적?체계적으로 추진하기 위하여 기획예산처에서 수행하여 오던 행정개혁에 관한 사무를 행정자치부로 이관함(안 제23조제1항  제33조제1항).2. 법제업무  보훈업무의 효율적 수행을 위하여 법제처장?차장  국가보훈처장?차장을 각각 정무직으로 함(안 제24조제2항  제25조).3. 인사개혁의 원활한 추진을 위하여 행정자치부에서 수행하던 공무원 인사관리 관련기능을 중앙인사위원회로 이관함에 따라 관련 규정을 정비하고, 전자정부 구현을 촉진하기 위하여 행정자치부의 소관사무에 전자정부에 관한 사무를 추가함(안 제33조제1항).4. 각종 재난관련 기능을 상호 유기적으로 수행할 수 있도록 행정자치부장관소속하에 소방방재청을 신설하고 청장 1인과 차장 1인을 두되, 청장은 정무직으로 하고, 차장은 별정직국가공무원 또는 소방공무원으로 보하도록 함(안 제33조제6항  제7항 신설).5. 보건복지부에서 수행하고 있는 영유아 보육업무를 보다 효율적으로 수행할 수 있도록 여성부로 이관함(안 제39조제1항  제42조).  ",행정자치위원회,[],정부,정부,,0
15,162790,장애인복지법중개정법률안,2003-10-24,의원,2004-05-29,임기만료폐기,제16대 (2000~2004) 제243회,"   국민기초생활보장법에 의한 기초생활수급자인 여성장애인은 국가  지방자치단체로부터 일정액의 출산급여를 지급받고 있으나, 기초생활수급자가 아닌 경우에는 비록 여성장애인이라고 하더라도 국가  지방자치단체로부터 출산급여를 지원받지 못하여 출산  육아에 있어서 경제적인 어려움을 겪고 있는 경우가 많음.따라서 여성장애인의 경제적 어려움을 덜어 주기 위하여 기초생활수급자에 해당하지 아니하는 여성장애인에게 그 경제적 부담능력 등을 감안한 출산보호비를 지급하고, 장애인이 부양하는 취학전 아동의 육아에 대하여도 필요한 비용을 지원하려는 것임. 장애인복지실시기관은 여성장애인의 출산과 장애인이 부양하는 취학전 아동의 육아에 필요한 비용을 지원함(안 제34조의2 신설).  ",보건복지위원회,"['임진출', '김덕규', '김충조', '김형오', '김희선', '민봉기', '박명환', '박원홍', '박재욱', '심재권', '안상수', '안택수', '양정규', '이성헌', '이승철', '이용삼', '이윤성', '이해구', '장성원', '전용원', '정병국', '추미애', '하순봉', '황우여']",임진출,한나라당,여성,3
16,162756,영유아보육법중개정법률안,2003-10-21,의원,2004-02-09,폐기,제16대 (2000~2004) 제243회,"   현행 일정규모 이상의 사업장의 사업주에게만 직장보육시설을 설치하도록 규정하고 있는데, 일정규모 미만의 사업장이더라도 다수의 사업장이 공동으로 보육시설을 설치할 수 있도록 하고, 그 설치  운영에 소요되는 비용은 조세감면 등의 지원을 받도록 함으로써 직장보육시설의 설치를 촉진하려는 것임. 1. 대통령령이 정하는 일정규모 미만의 사업장이더라도 다수의 사업장을 합한 규모가 일정한 기준에 달하는 때에는 각 사업장의 사업주는 공동으로 보육시설을 설치할 수 있음(안 제7조제4항 신설).2. 제7조제4항의 규정에 따른 공동 직장보육시설의 설치  운영에 소요되는 비용에 대하여 조세감면을 함(안 제25조).  ",보건복지위원회,"['엄호성', '권오을', '권태망', '김만제', '김문수', '김원길', '김윤식', '박종희', '박주천', '이낙연', '이성헌', '임진출', '정형근']",엄호성,한나라당,남성,1
17,162739,가정폭력방지및피해자보호등에관한법률중개정법률안,2003-10-14,정부,2003-12-18,대안반영폐기,제16대 (2000~2004) 제243회,      종전에 시·도지사가 관장하던 가정폭력관련상담소  가정폭력피해자보호시설의 관리업무를 시장·군수·구청장의 사무로 이관하려는 것임.  ,여성위원회,[],정부,정부,,0
18,162733,스토킹방지법안,2003-10-13,의원,2004-05-29,임기만료폐기,제16대 (2000~2004) 제243회,   “스토킹”이라는 행위는 대부분 상대방에 대한 관심이나 호의적인 감정으로부터 비롯된 것이어서 외형적으로는 별 문제가 없는 것처럼 보이나 피해자의 입장에서는 그 행위가 갖는 집요성과 지속성으로 인하여 정신적?신체적으로 피해가 큼에도 기존의 형사법 규정에 의하면 경범죄로 처벌할 수밖에 없어 그 실효성을 거두기 어렵기 때문에 행위자에게 특정한 행위를 금지하거나 활동을 제한하는 처분 등을 새로이 도입함으로써 스토킹을 효과적으로 방지하여 개인의 사생활을 보호하고 사회질서를 확립하려는 것임. 1. “스토킹”의 정의를 규정함(안 제2조).2. 사법경찰관은 피해자등의 신청으로 행위자에게 스토킹을 중지할 것과 이를 위반하는 경우에는 금지명령을 받을 수 있다는 것을 경고하도록 함(안 제3조).3. 검사는 직권 또는 사법경찰관?피해자등의 신청에 의하여 금지명령등을 법원에 청구할 수 있음(안 제4조제1항).4. 판사는 결정으로 행위자에게 피해자로부터 100미터 이내의 접근을 금지하는 등의 금지명령등을 할 수 있음(안 제5조제1항).5. 사법경찰관?피해자등은 접근금지등의 처분을 받은 자가 이를 위반한 때에는 검사에게 유치처분 등으로 변경하여 줄 것을 신청할 수 있음(안 제8조제1항).6. 법령위반이 있거나 중대한 사실오인이 있는 때 또는 그 결정이 현저히 부당한 때에는 지방법원본원합의부에 항고할 수 있음(안 제13조).7. 금지명령등을 위반하거나 그 기간이 만료한 후에도 계속 스토킹을 한 행위는 친고죄로 하여 1년 이하의 징역 또는 1천만원 이하의 벌금에 처함(안 제20조).  ,법제사법위원회,"['이강래', '김원웅', '김태홍', '배기운', '설송웅', '송석찬', '신기남', '이낙연', '이희규', '임종석', '임채정', '장재식', '정동영', '정동채', '천용택']",이강래,무소속,남성,0
19,162728,군형법중개정법률안,2003-10-11,의원,2004-05-29,임기만료폐기,제16대 (2000~2004) 제243회,"   군 내부에서 성범죄가 빈번하게 발생하여 군기를 문란하게 할 뿐만 아니라 나아가 군의 사기까지 저하시키고 있으므로 이를 근절하기 위하여 관련규정을 정비하려는 것임.현행 계간, 즉 비역질이라는 용어가 남성간의 동성애 행위만을 규정하고 있는바, 여군과의 관계에서 형평성과 성차별의 논란을 함의하고 있음. 또한 개인의 성적 자기 결정권 측면에서 형법으로 이를 규율하는 것이 타당치 않다고 보여 짐. 동성애 행위에 대해서는 군기문란에 대한 제재로서 행하는 현행의 내부징계의 방법과 현역복무부적합회부 등의 방법으로 행함이 적절함.개정안에서는 현재 군에서 빈번히 행해지는 강제력을 가진 추행행위에 대해서 현행 조문의 법정형이 미약하고 공소기간이 복무기간 중에 완성되는 문제를 해결하려는 취지임.군인의 경우에도 현행 형법이나 성폭력범죄의처벌피해자보호등에관한법률의 규율을 받고 있으므로, 강제추행, 강간 등의 범죄에 대한 대응이 충분히 이루어지고 있음. 그러나 폭행?협박 정도에는 미치지않으나 강제력 행사에 해당하는 경우, 업무상 위력이라 판단되기 어려운 경우의 처벌을 가능하게 하기 위한 조치임.또한 군대 내부 조직의 위계질서 등의 이유로 고소 할 수 없는 현실적 이유에 따라 형법이나 성폭력범죄의처벌피해자보호등에관한법률이 규정하고 있는 친고죄 규정을 고소 없이 공소제기 할 수 있도록 비친고죄로 하도록 함 1. 군대 요새, 진영 또는 군용에 공하는 함선이나 항공기 기타 장소, 설비 또는 건조물에서 위계 또는 위력으로 군인 또는 이에 준하는 자를 추행한 자는 5년 이하의 징역에 처하도록 하며, 이의 미수범을 처벌함(안 제92조)2. 형법, 성폭력범죄처벌피해자보호등에관한법률상의 성범죄가 군대내에서 발생한 경우 친고죄에 대한 특례를 규정하여 비친고죄로서 규정함(안 제92조의1 신설)  ",법제사법위원회,"['이경재', '권기술', '김정부', '박명환', '신경식', '안상수', '이규택', '이상득', '장광근', '장성원', '천용택', '황우여']",이경재,한나라당,남성,0
20,162685,소득세법중개정법률안,2003-09-30,정부,2003-12-18,대안반영폐기,제16대 (2000~2004) 제243회,"   중산·서민층과 근로자 등에 대한 세제지원을 확대하기 위하여 교육비, 의료비, 농가부업소득, 여성의 출산·보육급여, 장기주택자금이자 등과 관련된 지출  소득에 대한 각종 소득공제의 범위를 확대하거나 비과세하도록 하는 등 국민생활 관련 조세지원제도를 대폭 정비하는 한편, 조세의 형평성 제고와 부동산투기 억제를 위하여 단기보유  미등기 부동산에 대한 양도소득세의 세율을 인상하고, 복잡한 금융소득과세제도를 정비하여 간소화하며, 그 밖에 원천징수의무자의 납세편의를 도모하는 방향으로 세무행정을 개선하는 등 현행 규정상 나타난 일부 미비점을 개선·보완하려는 것임. 1. 농어촌지역의 소득증대  지방의 전통주육성을 위하여 일정한 요건을 갖춘 전통주 제조에서 발생하는 소득에 대하여 비과세하도록 하고, 근로자 또는 그 배우자의 출산이나 6세 이하의 자녀보육과 관련하여 지급받는 급여중 일정 부분에 대하여도 비과세하도록 함(안 제12조제3호의2  제4호더목 신설).2. 종전에는 서화·골동품은 그 양도차익에 대하여 종합과세하도록 하였으나, 앞으로는 납세자가 유리한 방법을 선택하여 원천징수 분리과세하거나 원천징수후 종합과세하게 하고 그 납세절차?방법 등을 간편하게 함(안 제14조제3항제4호의2·제127조제1항제4호의3?제129조제1항제5호의2  제144조의3 신설).3. 종전에는 비영업대금의 이익, 상장법인의 대주주가 받는 배당소득 등에 대하여는 무조건 종합소득과세하도록 하는 금융소득 당연종합과세제도를 적용하였으나, 당연종합과세제도는 계산방식이 복잡하고 적용에 어려움이 있어 동 제도를 폐지하되, 앞으로는 금융소득이 4천만원을 초과하는 경우에는 종합과세를 할 경우와 분리과세를 할 경우로만 비교하여 큰 금액으로 과세하도록 하고, 4천만원 이하인 경우에는 이를 분리과세하도록 하는 등 금융소득에 대한 과세제도를 대폭 간소화함(안 제14조제4항  제56조제3항 삭제, 제15조제2호, 제62조).4. 자원봉사활동을 활성화하기 위하여 특별재난지역의 재해?재난의 복구를 위하여 자원봉사하는 경우 당해 기간동안의 용역가액을 전액 공제하고, 기부문화를 활성화하고 산업교육의 진흥과 산학협력을 촉진하기 위하여 산학협력단에 시설비·교육비·장학금 또는 연구비로 지출하는 기부금을 전액 공제하도록 함(안 제34조제2항제3호의2 신설, 제34조제2항제6호)5. 근로자의 부양가족중 직계존속의 공제기준연령을 남?여 모두 55세 이상인 자로 통일하고 계부?계모를 공제대상에 포함시키는 한편, 근로자가 재혼한 경우 그 배우자의 직계비속도 공제대상에 포함하는 등 기본공제제도를 합리적으로 개정하여 남녀평등의 이념과 재혼 등과 관련한 사회현실을 반영함(안 제50조제1항제3호가목  나목).6. 소득공제의 대상이 되는 의료비의 기준을 총급여액의 3퍼센트를 초과하는 금액에서 총급여액의 5퍼센트를 초과하는 금액으로 상향조정하고, 연 500만원인 본인의 의료비에 대한 소득공제 한도를 폐지하여 본인의 의료비 부담을 경감시키며, 대학생교육비에 대한 소득공제한도를 연 500만원에서 700만원으로 상향조정하여 이공계대학의 교육비 수준으로 확대하는 등 특별공제제도를 합리적으로 조정함(안 제52조제1항제3호  제4호).7. 장애인에 대한 특수교육비의 소득공제한도를 폐지하고, 장기주택저당차입금 이자상환액에 대한 소득공제제도와 관련하여 그 대상자 요건을 완화하여 무주택자 세대주에 해당하는 근로자는 모두 혜택을 받을 수 있도록 하며, 일용근로자의 근로소득세액공제한도를 산출세액의 45퍼센트에서 55퍼센트로 확대하는 등 중산?서민층의 세부담을 경감시킴(안 제52조제1항제5호, 동조제3항  제59조제3항).8. 부동산투기로 인한 이득을 세금으로 흡수하여 과세형평을 도모하고 부동산투기를 차단하기 위하여 단기보유  미등기 부동산에 대한 양도소득세의 세율을 인상하여 1년 미만 보유한 경우 36퍼센트에서 50퍼센트로, 1년 이상 2년 미만 보유한 경우 9 내지 36퍼센트이었던 것을 40퍼센트로, 미등기의 경우 60퍼센트에서 70퍼센트로 각각 상향 조정함(안 제104조제1항).9. 원천징수의무자는 원칙적으로 인별지급조서를 전산매체로 작성하여 제출하도록 하고 예외적으로 문서로 작성한 지급조서를 제출하도록 하며, 종전에는 비거주자에게 소득을 지급하고 제출하는 지급조서는 연 2회 제출토록 하였으나 앞으로는 다음해 2월말까지 연 1회 제출하도록 하는 등 원천징수의무자의 납세편의를 도모함(안 제164조제3항  제4항, 제164조의2).  ",재정경제위원회,[],정부,정부,,0
21,162659,청소년보호법중개정법률안,2003-09-20,의원,2004-05-29,임기만료폐기,제16대 (2000~2004) 제243회,   최근 우리사회에서 청소년유해매체물이 범람하고 있음에 따라 특히 학교주변까지 유해매체물의 광고 선전물이 과도하게 살포되고 있지만 실정법에서는 이를 제한하는 규정이 전혀 없어서 청소년의 비행을 조장하고 있으므로 유해매체물의 광고 선전을 제한하는 장소에 유치원ㆍ초등학교ㆍ중학교ㆍ고등학교주변도 포함하려는 것임. 초ㆍ중등교육법에 의한 유치원ㆍ초등학교ㆍ중학교ㆍ고등학교의경계선으로부터 200미터까지의 지역에서 청소년유해매체물의 광고 선전을 금지함(안 제20조제1항제4호 신설).  ,정무위원회,"['임인배', '고흥길', '권오을', '김광원', '김성조', '김용학', '김윤식', '김정숙', '박재욱', '박혁규', '백승홍', '서상섭', '손희정', '송광호', '신영균', '신현태', '안택수', '오세훈', '윤두환', '윤한도', '이규택', '이상배', '이연숙', '이재선', '이해봉', '정갑윤', '조웅규', '최돈웅', '홍준표']",임인배,한나라당,남성,3
22,162629,소득세법중개정법률안,2003-09-08,의원,2003-12-18,대안반영폐기,제16대 (2000~2004) 제243회,"   젊은층의 결혼기피  출산기피로 사회인구의 노령화, 경제활동인구의 축소 등 심각한 사회문제가 예상되고 있으나 국가의 출산지원정책이 영아보육시설의 부족, 영아보육비용 지원정책의 미비 등으로 실효성이 없어 출산율을 높일 수 있는 국가적인 지원이 필요한 실정임.최근 정부에서는 사회의 출산기피와 인구노령화에 대한 대책으로 6세 미만의 직계존비속에 대한 추가공제를 현행 50만원에서 100만원으로 확대하고, 대상자도 여성근로자 또는 배우자가 없는 남성근로자에서 전체 근로자로 확대하는 등 획기적인 대책안을 발표한 바 있으나, 그 동안 추가공제가 지닌 각 대상자간의 형평성을 반영하고 있지 못하여 한건주의적 발표안에 그칠 우려가 있어 이를 보완할 필요성이 있는바, 정부의 발표안처럼 추가공제의 금액을 확대하되, 기존 추가공제에 반영되어 있는 여성의 사회참여확대의 입법취지를 살리고 각 가정에서 반드시 1인 이상의 보호자가 곁에서 보호해야 하는 대상자인 3세 미만의 영아, 1급 이상의 중증장애인을 둔 근로자에 대해서는 추가공제를 확대해 줄 수 있도록 함. 1. 추가공제의 금액을 1인당 50만원에서 100만원으로 확대하고, 장애인을 둔 근로자중 1급 이상의 중증장애인을 둔 근로자와 3세 미만의 영아를 둔 근로소득이 있는 거주자로서 여성 또는 배우자가 없는 남성근로자에 대하여는 150만원을 추가공제함(안 제51조제1항).2. 장애인전용보장성보험에 있어 영유아?취학전아동  유아원아의 특별공제에 대하여 3세 미만의 본인 또는 배우자의 직계비속인 경우의 추가공제, 초?중등교육법 등에 의한 학교, 영유아보육법에 의한 보육시설 또는 학원의설립?운영과외교습에관한법률에 의한 학원 등의 수업료?입학금?보육비용?수강료 등에 대한 특별공제중 선택하여 할 수 있도록 한 것을 동시에 적용할 수 있도록 함(안 제52조제12항).  ",재정경제위원회,"['권영세', '박명환', '박종근', '박진', '심재철', '안상수', '안택수', '양정규', '이근진', '이상득', '이성헌', '이윤성', '이인기', '이재오', '이주영', '정병국', '하순봉']",권영세,한나라당,남성,0
23,162581,청소년기본법중개정법률안,2003-08-29,의원,2004-05-29,임기만료폐기,제16대 (2000~2004) 제242회,"   아동과 청소년을 특별히 배려해야 한다는 유엔 아동권리협약의 이념에 따라 청소년의 복지증진을 위하여 청소년우대 조항의 근거를 마련하는 한편, 2002년말 현재 전체 청소년(9세 이상 24세 이하의 자)중 정규학교에 다니지 않는 청소년이 21.7%를 차지하고 있으나, 이들 비학생 청소년은 정규학교에 다니고 있는 학생들과는 달리 학생증 등 신분을 증명할 수 있는 방법도 없고 사회적으로도 동일한 대우를 받지 못하고 있는 현실을 감안하여 비학생 청소년도 각종 청소년 우대정책의 대상임을 표시할 수 있는 증표인 청소년증 제도를 도입함으로써 전체 청소년이 균형있는 복지혜택을 받을 수 있도록 하려는 것임. 1. 국가 또는 지방자치단체는 청소년에게 공공시설의 이용료를 무료로 하거나 할인하도록 함(안 제46조의2제1항 신설).2. 국가 또는 지방자치단체는 청소년과 관련된 사업자에게도 청소년에 대하여 그 이용요금의 할인을 권유할 수 있도록 함(안 제46조의2제2항 신설).3. 시장·군수·구청장은 청소년에게 청소년증을 발급하도록 함(안 제46조의3 신설).4. 청소년증을 양도 또는 대여한 자  그 상대방, 청소년증과 유사한 명칭 또는 표시를 사용한 자에 대하여는 300만원 이하의 과태료에 처하도록 함(안 제76조제2항제11호  제12호 신설).  ",문화관광위원회,"['서상섭', '강창희', '김경천', '김부겸', '김성조', '김영춘', '김영환', '김용학', '김형오', '김희선', '민봉기', '박명환', '배기선', '심재권', '안상수', '안영근', '오세훈', '유시민', '이경재', '이종걸', '이주영', '이창복', '하순봉']",서상섭,한나라당,남성,2
24,162571,성폭력범죄의처벌및피해자보호등에관한법률중개정법률안,2003-08-27,의원,2004-05-29,임기만료폐기,제16대 (2000~2004) 제242회,"   성폭력범죄의 피해자에게 공판조서열람청구권을 부여하여 가해자에 대한 기소내용과 공판과정을 피해자가 미리 알 수 있도록 함으로써 헌법과 형사소송법에 의해 보장된 피해자 진술권을 확보하려는 것임.헌법이 규정하는 인간존엄성, 사생활비밀보호, 알권리와 정보공개청구권 뿐 아니라 피해자의 재판절차진술권의 실질적 보장을 위한 최소한의 전제조건이며, 형사소송법이 규정하는 피고인의 공판조서열람청구권과의 균형을 맞추기 위함. 성폭력범죄의 피해자 또는 그 대리인은 공판조서의 열람 또는 복사를 청구할 수 있도록 함(안 제22조의5 신설).  ",법제사법위원회,"['이경재', '강인섭', '강창희', '권영세', '권철현', '권태망', '김광원', '김부겸', '김성조', '김성호', '김영선', '김정부', '김정숙', '김종하', '김학송', '김형오', '김희선', '맹형규', '민봉기', '박명환', '박세환', '박승국', '박시균', '박인상', '박주천', '박진', '박창달', '배기운', '서상섭', '심규철', '심재권', '심재철', '안경률', '양정규', '엄호성', '오세훈', '윤한도', '이규택', '이낙연', '이성헌', '이승철', '이윤성', '이재오', '이주영', '이창복', '장광근', '장성원', '정병국', '주진우', '하순봉', '허운나', '허태열']",이경재,한나라당,남성,4
