,의안번호,의안명,제안일자,제안자구분,의결일자,의결결과,제안회기,제안이유,소관위원회,제안자,발의자,제안정당,성별,여성의원 수
49,161646,성매매알선등행위의처벌및방지에관한법률안,2002-07-25,의원,2002-09-11,철회,제16대 (2000~2004) 제232회,"   우리 사회의 성매매행위  성매매알선 등 행위는 현행법에서 금지하고 있음에도 불구하고 계속해서 확산되고 있는 실정임. 이는 성매매목적의 인신매매, 감금, 협박, 성매매행위자의 채무이용 등에 의하여 성매매행위를 강요하거나 성매매행위를 알선, 유인하는 등 성을 파는 행위자를 공급하고 성매매행위를 매개하는 중간 매개체들이 다양화 되고 줄어들지 않고 있기 때문임.따라서 이 법안에서는 성매매행위의 공급자와 중간 매개체를 차단하기 위하여 성매매의 강요· 알선 등 행위에 대한 형량을 형태별로 강화하고, 성매매의 강요·알선 등 행위로 인하여 얻은 금품  재산상의 이익은 몰수·추징하며, 성매매의 강요·알선 등 행위자가 성을 파는 자에 대하여 가지는 일체의 채권을 무효로 함으로써 성매매의 강요·알선 등 행위로 인한 이윤동기가 실현되지 않도록 함. 또한 성매매의 강요·알선 등 행위가 은밀하게 이루어지는 점을 감안하여 성매매행위의 강요·알선 등 행위를 신고한 자에게는 형을 감경하거나 면제하도록 하고 신고된 범죄로부터 몰수·추징된 금원중 일부를 보상금으로 지급하도록 하여 범죄행위를 보다 용이하게 파악할 수 있도록 유도함.성매매행위자중 강요에 의하여 성을 파는 행위를 한 자를 성매매된 자로 구분하여 종전의 윤락행위자를 모두 처벌하는 것과는 달리 성매매된 자를 범죄 피해자로 보아 처벌대상에서 제외하고, 재판의 심리를 비공개로 하거나 신뢰관계에 있는 자가 동석 할 수 있도록 하여 성매매된 자의 사생활 보호와 심리적·법률적 지원을 통한 성매매된 자의 인권보장 규정을 강화하였으며, 성매매행위자에 대해서는 형벌 또는 보호처분을 선택적으로 할 수 있도록 하여 보다 유연하게 사회복귀가 가능하도록 함.성매매행위자의 사회복귀를 돕기 위하여 강제적으로 복지시설에 입소 조치한 기존의 선도보호조치를 폐지하고 성매매행위자의 의사에 따라 지원시설에서 제공하는 의료지원, 취업교육, 법률지원 등을 자유롭게 이용할 수 있도록 하여 원활한 사회복귀와 성매매행위의 재발을 방지하도록 함으로써 우리 사회에 만연되어 있는 성매매행위의 강요·알선 등 행위와 성매매행위를 근절하려는 것임. 1. 성을 파는 행위를 한 자중 인신매매, 감금, 강간, 폭행, 협박, 위계 또는 선불금 등 채무로 인하여 성을 파는 행위를 하는 자, 고용 또는 관리하는 자에 의하여 마약 등에 중독 되어 성을 파는 행위를 하는 자와 청소년, 대통령령이 정하는 장애인  외국인 여성을 성매매된 자로 정의하고, 형사처벌 대상에서 제외함(안 제2조제3호).2. 위계 또는 선불금 기타 채무를 이용하는 등의 방법이나 업무·고용 그 밖의 관계, 장애인, 외국인으로 하여금 성을 파는 행위를 하게 한 자는 3년 이상의 유기징역에 처하도록 함(안 제6조제1항).다. 감금, 강간 등 가혹 행위로 성을 파는 행위를 하게 한 자는 5년이상의 징역에 처하도록 함(안 제6조제2항).3. 영업으로 성매매행위를 알선한 자, 영업으로 성매매행위의 장소를 제공한 자, 성을 파는 행위를 하도록 할 목적으로 고용 또는 관리하는 자는 성매매행위의 발생 여부를 불문하고 5년이상의 징역에 처하도록 함(안 제7조제1항)4. 성매매행위를 한 자는 1년 이하의 징역이나 300만원 이하의 벌금·구류 또는 과료에 처하도록 함.(안 제8조제1항).5. 성을 파는 행위, 나체공연 등 음란행위, 성을 사는 행위를 권유·유인하는 행위를 하게 할 목적으로 종업원 등을 모집하는 광고행위를 한 자는 5년 이하의 징역 또는 5억원 이하의 벌금에 처하도록 함(안 제9조제1항).6. 이 법에 의하여 설치된 지원시설  여성복지상담소의 장 또는 종사자는 지원시설  여성복지상담소의 이용자로부터 제6조 내지 제9조의 죄를 범한 자를 알게 된 때에는 이를 수사기관에 신고하도록 함(안 제12조제2항).7. 제6조 내지 제9조의 범죄를 고소·고발·신고한 자  성매매된 자 등의 사생활보호  신변보호를 위하여 재판의 심리를 비공개로 할 수 있도록 함(안 제14조제1항).8. 제6조 내지 제7조의 범죄를 고소·고발·신고한 자  성매매된 자를 재판의 증인으로 신문하는 경우나 수사기관이 조사하는 경우에는 그들이 신뢰관계에 있는 자로 지정하는 자를 동석하게 할 수 있도록 함(안 제15조).9. 제6조 내지 제7조의 죄를 범한 자가 성을 파는 행위를 한 자에 대하여 가지는 채권은 계약의 종류  형식에 관계없이 이를 무효가 되도록 함(안 제16조제1항).10. 외국인여성이 제6조  제7조의 범죄로 인하여 피해 입은 사실을 고소·고발 또는 신고하여 수사  형사재판이 계속중이거나, 해당 외국인여성이 수사절차의 참고인 또는 형사재판에서의 증인으로 소환된 경우 당해 심급절차에서의 판결이 선고될 때까지 출입국관리법의 규정에 의한 강제퇴거명령  보호처분의 집행을 하지 않도록 함(안 제19조제1항).11. 제6조 내지 제7조의 범죄를 고소 또는 고발한 자는 검사로부터 공소를 제기하지 아니한다는 통지를 받은 때에는 재정을 신청할 수 있도록 하여 성매매사건에 대한 검사의 자의적인 공소권행사를 제한하도록 함(제20조)12. 제6조, 제7조  제9조의 죄를 범한 자가 그 범죄로 인하여 얻은 금품  재산상의 이익은 몰수·추징하고 그 금원 중 3/100 이상 15/100 이하의 범위 이내에서 해당 범죄를 신고한 자에게 보상금으로 지급하도록 함(안 제21조  제22조).13. 성매매행위를 한 자에 대하여 형벌 대신에 보호처분의 결정으로써 성매매행위 등이 발생하는 장소에의 출입  연락금지, 사회봉사·수강명령(성을 사는 행위를 한 자에 한함), 보호관찰, 지원시설에의 교육·상담위탁, 의료기관에의 치료위탁을 할 수 있도록 함(안 제24조 내지 제29조).  ",미확정,"['조배숙', '강신성일', '강운태', '강창성', '곽치영', '김경천', '김광원', '김기배', '김덕규', '김방림', '김성조', '김성호', '김옥두', '김용균', '김운용', '김정숙', '김찬우', '김태홍', '김홍신', '김화중', '김희선', '도종이', '맹형규', '박명환', '박상희', '박세환', '박승국', '박시균', '박인상', '박종웅', '박혁규', '배기운', '백승홍', '서상섭', '손희정', '송석찬', '송영길', '신계륜', '신영국', '신현태', '심규철', '안경률', '안상수', '안영근', '원유철', '윤경식', '윤여준', '이규택', '이미경', '이승철', '이연숙', '이인기', '이인제', '이재오', '이재정', '이종걸', '이주영', '이훈평', '임인배', '임종석', '임진출', '장영달', '전용원', '전용학', '정범구', '정장선', '정철기', '조재환', '최영희', '추미애', '함승희', '허운나', '허태열', '현승일']",조배숙,새천년민주당,여성,13
50,161560,성폭력범죄의처벌및피해자보호등에관한법률중개정법률안,2002-05-03,의원,2003-11-21,수정가결,제16대 (2000~2004) 제230회,"   성폭력피해자에 대한 수사기관의 수사  법원의 심리과정에서 성폭력피해자의 특성을 고려하지 아니함으로써 오히려 피해자의 인권을 침해하는 경우가 발생하고 있는 바, 이의 시정을 통하여 성폭력피해자에 대한 수사  재판과정에서 이들의 인권이 침해받는 일이 없도록 하기 위하여 수사기관이 성폭력피해자의 진술을 청취할 경우 진술과정을 영상물에 의하여 녹화하게 하는 등 현행 제도의 미비점을 보완?개선하고자 함. 1. 수사기관이 피해자로부터 진술을 청취할 때에는 비디오 등 영상물에 의하여 진술상황을 녹화하도록 하되, 피해자가 명시적인 의사에 의하여 이를 원하지 아니할 때에는 녹화하지 아니함(안 제21조의2).2. 법원은 정신과의사?심리학자?사회복지학자 그 밖의 관련 전문가에게 피해자의 정신?심리상태에 대한 진단소견에 관한 의견을 조회할 수 있으며, 법원은 성폭력범죄를 심리함에 있어서 의견조회의 결과를 참작하여야 함(안 제22조의2).3. 수사기관이 피해자를 조사하거나 법원이 피해자를 증인으로 신문하는 경우 피해자의 신청이 있으면 피해자와 신뢰관계에 있는 자를 동석하게 하여야 한다. 다만, 피해자가 13세 미만의 미성년자이거나 장애인인 때에는 반드시 피해자와 신뢰관계에 있는 자를 동석하게 하여야 함(안 제22조의3 제1항 내지 제3항).4. 법원의 증인신문시 13세 미만의 미성년자이거나 장애인에 대하여는 비디오 그 밖의 중계장치에 의하여 신문할 수 있도록 함(안 제22조의4).5. 피해자가 13세 미만의 미성년자나 장애인인 경우 공판기일에 출석하여 진술하는 것이 현저히 곤란한 사정이 있는 것으로 간주함(안 제22조의6제1항 후단). 수사기관이 모든 성폭력사건에 있어서 피해자의 진술과정을 영상물로 촬영하는 것은 비효율적이므로 피해자가 13세 미만이거나 심신장애자인 경우에 한하여 영상물촬영을 의무하도록 그 범위를 제한하고, 당해 영상물의 증거능력과 관련하여서는 공판기일 등에서 피해자 또는 조사과정에 동석하였던 신뢰관계인의 진술에 의하여 성립의 진정함이 인정되는 때에 영상물을 증거로 할 수 있도록 함이 바람직하므로 관련 규정을 수정하며, 신뢰관계인의 동석을 신청할 수 있는 자의 범위에 피해자의 법정대리인이 누락되어 있어 이를 추가하고, 비디오 등 중계장치에 의한 증인신문의 경우에는 굳이 그 적용범위를 13세 미만의 미성년자 등으로 제한하기 보다는 법원이 검사와 피고인 또는 변호인의 의견을 들어 그 필요성 여부를 판단하면 충분하므로 적용범위를 제2조제1항제3호 내지 제5호의 규정에 의한 성폭력범죄의 피해자로 확대하며, 피해자가 13세 미만이거나 심신장애자에 해당하는 경우에는 증거보전의 특례를 보다 용이하게 활용할 수 있도록 할 필요성이 인정되므로 이러한 경우에는 공판기일에 출석하여 증언하는 것이 현저히 곤란한 사정이 있는 것으로 간주하도록 하고, 성폭력피해자에 대한 상담  보호 등과 관련된 업무는 시?도지사 보다는 시장?군수?구청장이 맡아서 처리함이 보다 효율적이므로 업무권한을 이양하며, 그밖에 성폭력피해자의 보호에 만전을 기할 수 있도록 관련 규정을 정비하려는 것임.□ 수정 1. 검사 또는 사법경찰관은 성폭력피해자의 인권보호를 위하여 필요최소한의 범위에서만 조사를 하여야 하며, 피해자가 13세 미만이거나 심신장애인에 해당하는 경우에는 피해자의 진술내용과 조사과정을 비디오 등 영상물 녹화 장치에 의하여 촬영?보존하여야 하고, 당해 영상물에 수록된 피해자의 진술은 공판기일 등에서 피해자 또는 조사과정에 동석하였던 신뢰관계인의 진술에 의하여 성립의 진정함이 인정되는 때에 증거로 할 수 있도록 함(안 제21조의2).2. 법원이 전문가의 의견을 조회할 수 있는 범위를 행위자의 정신?심리상태에까지 확대함(안 제22조의2).3. 신뢰관계인의 동석 신청권자에 피해자의 법정대리인을 추가하고, 수사 또는 재판단계에서 피해자가 13세 미만이거나 심신장애인에 해당하는 경우에는 부득이한 경우가 아닌 한 신뢰관계인을 의무적으로 동석하게 함(안 제22조의3).4. 비디오 등 중계장치에 의하여 증인신문을 할 수 있는 피해자의 범위를 제2조제1항제3호 내지 제5호에 해당하는 경우로 확대함(안 제22조의4제1항).5. 성폭력피해자에 대한 상담?보호와 관련된 업무를 시?도지사에서 시장?군수?구청장에게 이양함(안 제23조제2항, 제25조제2항, 제27조, 제28조제1항, 제29조, 제29조의2, 제33조제1항).  ",법제사법위원회,"['전재희', '강숙자', '권오을', '김경천', '김락기', '김만제', '김부겸', '김정숙', '김홍신', '김희선', '박관용', '박인상', '박창달', '손희정', '심재철', '안택수', '오세훈', '유재건', '이근진', '이연숙', '이재오', '이주영', '정범구', '정병국', '정재문', '최명헌', '한승수', '홍사덕']",전재희,한나라당,여성,7
51,161554,지방공무원법중개정법률안,2002-04-23,정부,2002-11-07,수정가결,제16대 (2000~2004) 제229회,"   지식정보화사회의 변화에 적극 대응하여 지방공무원이 지방자치발전을 이끄는 중추적 역할을 할 수 있도록 하기 위하여, 특별임용시 경쟁의 방법에 의한 임용을 확대하고 민간부문의 경영기법을 행정업무에 활용할 수 있도록 공무원이 민간기업에 임시채용되는 경우 휴직할 수 있게 하는 등 공무원의 전문성  경쟁력을 강화하기 위한 제도적 장치를 마련하는 한편, 여자공무원의 모성보호를 강화하기 위하여 자녀양육 등을 위한 휴직제도를 개선하며, 그밖에 현행 규정의 운영상 나타난 일부 미비점을 개선·보완하려는 것임. 1. 종전에는 열거방식으로 규정하였던 정무직·별정직·계약직공무원의 개념을 당해 공무원의 실질적 특성을 나타내는 개념으로 정의함으로써 공무원의 구분기준을 명확하게 함(안 제2조제3항).2. 공권력을 행사하거나 정책결정  국가보안 등에 관계되는 분야가 아닌 연구·기술·교육 등 특정한 분야의 직위에 대하여 동일한 자격을 갖춘 국민을 채용할 수 없는 경우에는 외국인을 공무원으로 임용할 수 있도록 함(안 제25조의2 신설).3. 공무원의 특별임용시 공정성을 확보하고 전문인력을 적극 유치하기 위하여 대통령령에서 정하는 특별임용의 경우에는 시험을 공고하고 경쟁의 방법에 의하여 채용하도록 함(안 제27조제3항  제35조제1항).4. 민간부문의 경영기법을 습득하고 공무원의 능력개발 등을 도모하기 위하여 공무원이 민간기업 등에 임시로 채용되는 경우에는 3년의 범위내에서 휴직할 수 있도록 함(안 제63조제2항제1호·제3항  제64조제2호).5. 육아휴직 신청기간을 1세 미만의 자녀를 양육하기 위하여 필요한 때에서 3세 미만의 자녀를 양육하기 위하여 필요한 경우까지 확대함으로써 여자공무원의 모성보호를 도모함(안 제63조제2항제4호).6. 명예퇴직수당을 지급받은 자가 재임용되거나 재직중의 사유로 인하여 당연퇴직에 해당하는 금고 이상의 형을 받은 경우 등에는 이미 지급한 명예퇴직수당을 환수할 수 있도록 함(안 제66조의2제3항 신설). 특수경력직공무원에 대하여도 경력직공무원과 동일하게 지방공무원법중 능률에 관련된 규정을 적용하여 재직하는 동안 직무능력을 배양할 수 있도록 하고, 지방공무원의 퇴직사유중 금고이상의 형의 선고유예자를 당연히 퇴직하도록 하고 있는 조항이 2002년 8월 29일 헌법재판소에서 과잉금지원칙에 위반하여 공무담임권을 침해하고 있다는 이유로 위헌결정됨에 따라 동조항  관련조항을 정비하려는 것임.□ 수정 1. 특수경력직공무원에게 법 제10장(능률)의 규정을 적용함(안 제3조제1항).2. 당연 퇴직사유중 금고이상의 형의 선고유예를 받은 경우 그 선고유예기간중에 있는 자는 제외함(안 제61조 단서 신설).3. 재직중의 사유로 인하여 금고이상의 형의 선고유예를 받은 경우에 대해서는 명예퇴직수당을 환수할 수 있는 규정을 삭제함(안 제66조의2제3항제1호).  ",행정자치위원회,[],정부,정부,,0
52,161490,영유아보육법개정법률안,2002-03-08,의원,2004-01-08,대안반영폐기,제16대 (2000~2004) 제228회,"   여성의 사회참여 확대, 가족구조의 변화 등으로 인해 사회적 양육 즉, 보육의 공공성 확보의 중요성이 증대되어 1991년 영유아보육법이 제정되었으나 민간에 의존적인 형태로 보육정책이 추진되어 보육의 공공성 확보가 극히 미흡한 실정임.이에 국공립시설 확충, 보육의 질 향상, 저소득계층자녀의 보육기회 확보, 방과후보육 실시, 정부의 보육비용부담강화 등을 규정하여 보육의 공공성을 확보하고자 함. 1. 영유아보육의 기회제공에 있어 차별을 금하고, 영유아의 이익을 최우선으로 고려하도록 함(안 제3조).2. 영유아보육  교육에 관한 종합정책을 수립하고 관계부처간의 의견을 조정하며, 그 정책의 이행을 감독하고 평가하기 위하여 국무총리 소속하에 영유아보육·교육위원회를 둠(안 제6조).3. 국가  지방자치단체가 보육실태조사를 바탕으로 전국 또는 관할구역별로 보육시설수급계획을 수립·시행하고, 이에 따라 국·공립보육시설을 설치하도록 하되, 저소득층 밀집지역 또는 농어촌지역 등 보육시설이 없거나 부족한 취약지역에 우선적으로 설치하도록 함(안 제10조 내지 제13조).4. 국가 또는 지방자치단체 이외의 자가 보육시설을 설치·운영하고자 할 때는 일정정도의 기준을 갖추고 시장·군수·구청장의 인가를 받도록 함(안 제14조  제16조).5. 보육교사가 되기 위해서는 보육, 유아교육, 아동복지 관련학과를 졸업하거나 보육관련 교과목  학점을 이수하고, 보건복지부장관이 검정·수여하는 보육교사자격증을 받도록 함(안 제22조).6. 보육시설의 장은 보육시설 운영의 자율성을 높이고 지역사회와의 연계를 강화하여 지역실정과 특성에 맞은 보육을 실시할 수 있도록 하기 위하여 당해 보육시설에 보육시설종사자, 보호자 대표  지역사회 인사 등으로 구성된 보육시설운영위원회를 둘 수 있도록 함(안 제27조).7. 국가 또는 지방자치단체와 사회복지법인 그 밖의 비영리법인이 설치한 보육시설과 대통령령이 정하는 보육시설의 장은 영아·장애아 등에 대한 보육을 우선적으로 실시하도록 함(안 제28조).8. 국가 또는 지방자치단체와 사회복지법인 그 밖의 비영리법인이 설치한 보육시설과 대통령령이 정하는 보육시설의 장은 국민기초생활보장법에 의한 수급자와 보건복지부령이 정하는 저소득층의 자녀를 보육시설에 우선적으로 입소시키도록 하고, 우선입소 대상자가 일정비율 이상인 민간보육시설에 대해 비용보조를 할 수 있도록 함(안 제30조  제46조).9. 보건복지부장관은 표준보육과정을 개발·보급하여야 하며, 정기적으로 그 내용을 검토하여 수정·보완하도록 하고, 보건복지부장관  시·도지사는 보육시설의 질적 개선과 보육서비스의 수준 향상을 위하여 보육시설에 대한 지도  평가를 실시하도록 함(안 제31조  제32조).10. 보호자의 근로 또는 질병 등의 사정으로 인하여 방과후 적절히 보호받지 못하는 초등학교 취학아동에게 보육을 제공함으로써 건전하게 성장·발달할 수 있도록 방과후보육을 실시하도록 함(안 제33조 내지 제37조).11. 보육시설의 장은 보육시설의 종사자와 영유아에 대하여 정기적으로 건강진단을 실시하여 종사자나 영유아에 대하여 질병의 치료  예방에 필요한 적절한 조치를 하도록 하고, 영유아에게 질병, 사고 또는 재해로 인한 부상이나 그 밖에 위급상태가 발생한 경우 즉시 의료기관에 이송하도록 함(안 제38조 내지 제40조).12. 보육시설의 장은 영유아에게 보건복지부령이 정하는 바에 의하여 균형있는 급식을 제공하고, 영유아의 안전사고를 예방하기 위하여 보건복지부령이 정하는 바에 따라 실내·외 시설, 장비의 점검  개선 등 필요한 조치를 취하고, 연 2회 이상 안전점검을 정기적으로 실시하고, 종사자를 대상으로 안전관리 교육을 연 1회 이상 정기적으로 실시하도록 함(안 제41조  제42조).13. 국가 또는 지방자치단체는 대통령령이 정하는 바에 따라 보호자의 소득수준과 지역적 여건을 고려하여 영유아의 보육에 필요한 비용의 전부 또는 일부를 부담할 수 있도록 함(안 제43조).14. 저소득층 자녀가 거주하는 지역에 보육시설이 없어 보육을 받지 못하는 경우 보건복지부장관이 정한 보육수당을 매월 지급하도록 함(안 제44조).  ",보건복지위원회,"['김홍신', '권기술', '김명섭', '김부겸', '김성순', '김원웅', '김태홍', '박병석', '신기남', '심재철', '안영근', '오세훈', '원희룡', '이부영', '이완구', '이종걸', '정범구', '정장선', '조한천', '추미애']",김홍신,한나라당,남성,1
53,161479,정치자금에관한법률중개정법률안,2002-02-28,위원장,2002-02-28,원안가결,제16대 (2000~2004) 제227회,"   1. 2002년 1월 23일 제226회국회(임시회)폐회중 제1차위원회에서 정당관계법심사소위원회  법안심사소위원회를 구성함.2. 2002년 2월25일 제227회국회(임시회) 제3차위원회에서 소위원회안을 상정하여 심사한 바 위원회안으로 채택키로 가결함. 공직선거에 있어 지역구시·도의회의원선거의 후보자중 100분의 30이상을 여성후보자로 추천한 정당에 대하여는 국가보조금을 추가 지급할 수 있도록 하고, 국고보조금의 관리  사용을 투명하게 하기 위하여 보조금의 감액 등에 관하여 규정하고 있는 「정당에대한보조금의지급중단감액에관한규정」을 법률로 규정하되, 보조금의 감액지급 요건을 일부 조정하는 등 정치자금제도를 일부 개선·보완하려는 것임. 1. 임기만료에 의한 지역구시·도의회의원선거의 후보자 중 100분의 30이상을 여성으로 추천한 정당에 대하여 국고보조금을 추가로 지급함(안 제17조의2, 신설).2. 제18조의 규정에 의하여 보조금을 지급받은 정당이 보조금에 관한 회계보고를 허위로 한 때에는 허위보고한 금액의 2배에 상당하는 금액을 감액지급할 수 있도록 함(안 제20조제1호).3. 제19조제1항의 용도외의 용도로 사용한 경우에는 그 용도를 위반하여 사용한 보조금의 2배에 상당하는 금액을 감액지급할 수 있도록 함(안 제20조제2호).4. 제19조제2항의 규정에 위반하여 제19조제1항제5호의 용도로 사용한 금액이 지급받은 보조금총액의 100분의 20 미만인 경우 그 차액의 2배에 상당하는 금액을 감액지급할 수 있도록 함(안 제20조제3호, 신설).5. 제24조의 규정에 위반하여 회계보고를 하지 아니한 때에는 중앙당의 경우 지급한 보조금의 100분의 25에 상당하는 금액, 시·도지부  지구당의 경우 중앙당으로부터 지원받은 보조금의 2배에 상당하는 금액을 감액지급할 수 있도록 함.(안 제20조제4호, 신설)  ",정치개혁특별위원회,[],위원장,위원장,,0
