,의안번호,의안명,제안일자,제안자구분,의결일자,의결결과,제안회기,제안이유,소관위원회,제안자,발의자,제안정당,성별,여성의원 수
70,160878,남녀고용평등법개정법률안,2001-07-16,위원장,2001-07-18,원안가결,제16대 (2000~2004) 제223회,"   2000년 6월 29일 김정숙의원이 대표발의한 남녀고용평등법중개정법률안, 동년 11월 25일 한명숙의원이 대표발의한 남녀고용평등법개정법률안과 동년 8월 31일 한명숙의원에 의해 소개된 남녀고용평등법근로기준법개정에관한청원 등 이상 3건을 병합심사한 결과 제222회 국회(임시회) 제5차 환경노동위원회(2001. 6. 26)에서 남녀고용평등법개정법률안에 대한 위원회 대안을 제안키로 하고 위의 2건의 법률안과 1건의 청원은 각각 본회의에부의하지 아니하기로 함 직장과 가정생활의 양립을 지원할 수 있는 육아휴직제도를 개선하고 직장내 성차별  성희롱을 해소하기 위해성희롱 예방교육  구제절차를 강화하며, 남녀고용평등에 관한 분쟁의 예방과 조정을 위해 고용평등상담실의설치·운영  명예고용평등감독관 제도를 도입하는 등 실질적인 모성보호  남녀고용평등을 구현하고자 제반제도를 개선·보완하려는 것임. 1. 목적에서 헌법의 평등이념에 따라 남녀고용평등 실현을 지향하는 법의 취지를 명확히 할 수 있도록 규정함(안 제1조)2. 사업주가 채용 또는 근로의 조건은 동일하게 적용하더라도 그 조건을 충족시킬 수 있는 남성 또는 여성이다른 한 성에 비하여 현저히 적고 그로 인하여 특정 성에게 불리한 결과를 초래하며 그 기준이 정당한 것임을 입증할 수 없는 경우도 이를 차별로 보도록 간접차별 규정을 구체화함 (안 제2조제1항)3. 근로자를 사용하는 모든 사업 또는 사업장으로 이 법의 적용범위를 확대함 (안 제3조)4. 건전한 직장문화를 조성하기 위하여 직장내 성희롱 금지 규정을 마련하고 사업주가 성희롱 행위자인 경우처벌규정을 신설함 (안 제12조  제39조)5. 국가는 사업주가 근로기준법 제72조제1항의 산전후휴가를 부여한 경우 늘어나는 30일에 대하여는 그 기간의 통상임금에 상당하는 금액을 지급할 수 있도록 근거규정을 마련함 (안 제18조)6. 육아휴직 대상 근로자의 범위를 확대하고, 육아휴직 기간중 해고금지 규정 등을 신설함으로써 직장과 가정생활의 양립 지원을 강화함 (안 제19조)7. 사업장의 남녀고용평등 이행을 촉진하기 위하여 명예고용평등감독관 제도를 신설함 (안 제24조)8. 남녀고용평등에 관한 분쟁이 발생한 경우에 분쟁당사자가 직접 고용평등위원회에 조정을 신청할 수 있도록함 (안 제26조)9. 파견근로 관계의 직장내 성희롱 예방교육 의무사업주를 사용사업주로 명시함 (안 제34조)  ",환경노동위원회,[],위원장,위원장,,0
71,160761,공중화장실법안,2001-05-08,의원,2003-12-23,수정가결,제16대 (2000~2004) 제221회,"   공중화장실은 국가문화의 척도이자 국민의 삶을 풍요롭게 하는 가장 기초적인 공간으로서 국민들이 편리하게 이용할 수 있도록 적정수요의 설치와 효과적인 유지?관리가 이루어져야 하나, 현재 우리나라의 공중화장실 관련규정은 24개 법규에 혼재되어 있어 효과적인 유지?관리 등이 어려운 실정임.2002월드컵과 아시안 게임 등 국익선양을 위한 국제적인 행사가 예정되어 있어 많은 외국관광객의 방문이 예견되어 있으나 관광지·교통요지·다중이 붐비는 도심지 등에는 공중화장실의 설치  정비가 제대로 이루어지지 않아 국민들의 불편이 심하며, 특히 우리나라 공중화장실의 여성용은 남성용에 비해 매우 부족하여 여성들이 공중화장실을 이용함에 있어 불편이 심한 형편임.따라서 여러 관련법규에 산재해 있는 화장실 관련 규정을 이 법체계로 정비함과 아울러, 책임 행정기관을 정하고, 화장실의 설치  정비와 국고지원 근거규정을 마련함으로써 우리 사회의 문화척도가 될 수 있는 화장실문화를 개선하고자 이 법을 제정하려는 것임. 1. 공중의 이용에 제공하기 위하여 설치 또는 지정된 화장실을 공중화장실로 정의하고, 다른 법률과의 관계에 있어 이 법의 적용범위를 규정함(안 제2조  제3조).2. 공중화장실의 설치는 이용자의 수에 따라 다르게 설치하되 여성화장실의 대변기 수는 남성화장실의 대·소변기 수의 합 이상이 되게 설치하도록 공중화장실의 설치기준을 정함(안 제7조).3. 공공기관의 장은 보안 또는 안전관리상 필요한 경우를 제외하고는 당해시설에 설치된 화장실을 공중의 이용에 제공하도록 하고, 대통령령으로 정하는 규모 이상의 법인 또는 개인소유 시설물에 설치된 화장실에 대하여도 시장·군수·구청장이 당해 시설물을 소유 또는 관리하는 자와 협의를 거쳐 공중이 이용할 수 있는 개방화장실로 지정할 수 있도록 함(안 제9조).4. 시장·군수·구청장은 관할구역안에서 행사 등으로 다수인이 모이는 경우 당해 행사를 주관하는 자에 대하여 이동화장실의 설치를 명할 수 있도록 함(안 제10조).5. 다중이 붐비는 지역의 공중화장실 설치를 원할하게 하기 위하며 법인 또는 개인은 시장·군수·구청장의 승인을 받아 유료화장실을 설치·운영할 수 있도록 함(안 제11조).6. 시장·군수·구청장은 공중화장실의 유지?관리를 확인하기 위하여 년 1회 정기점검과 필요시 수시점검을 실시하도록 하고 공중화장실의 설치기준 또는 관리기준을 위반하는 경우 시설 개선명령 등을 할 수 있도록 함(안 제12조  제13조).7. 공중화장실의 유지관리를 위하여 공중화장실의 기물을 훼손하는 행위 등에 관한 금지규정을 마련함(안 제14조).8. 시장·군수·구청장은 관할 구역 안에 공중화장실을 설치?관리하는 자에 대하여 예산이 허용하는 범위 안에서 설치·관리비의 일부를 보조할 수 있도록 함(안 제16조).9. 시장·군수·구청장의 승인을 받지 않고 유료화장실을 설 치한 자는 6월 이하의 징역 또는 500만원 이하의 벌금에 처하도록 하고, 공중화장실의 기물훼손 금지규정 등을 위반한 자에 대한 과태료 부과에 관한 사항을 규정함(안 제19조  제20조). 공중화장실등의 체계적 정비  관리를 위하여 지방자치단체는 물론 국가에서도 설치  관리비용 등의 재원을 보조할 수 있도록 관련내용을 수정하려는 것임.□ 수정 1. 법 제명을 화장실의 구분을 설치목적  사용방법에 따라 구분되도록 함으로써 그 의미를 명확히 하기 위하여 공중화장실등에관한법률로 수정함.2. 공공기관의 개념을 국가행정기관 지방자치단체 기타 공공단체중 대통령령이 정하는 기관으로 명확히 함(안 제2조제2항 신설).3. 공중화장실등은 남녀화장실을 구분하여 설치하되 시설 또는 장소의 이용자수에 따라 다르게 설치할 수 있도록 허용하고, 규모가 작은 화장실의 경우에는 예외를 둘 수 있도록 행정자치부령에 위임함(안 제7조제1항).4. 시장·군수 또는 구청장은 공중화장실등의 설치?관리자가 제7조 설치기준 또는 제8조의 관리기준에 위반한다고 인정하는 경우 철거 전에 폐쇄명령을 할 수 있도록 그 권한을 확대함(안 제13조).5. 공중화장실등의 이용자에 대한 금지행위에 시?군 또는 구 조례가 정하는 타인의 위생적 이용을 방해하는 오물을 방치하는 행위 등을 추가함(안 제14조제4호 신설).6. 공중화장실 등의 설치·관리기준의 적용은 법 시행일 이후에 발생하는 것부터 적용함(부칙 제3항 신설).  ",행정자치위원회,"['심재철', '오세훈', '윤경식', '강재섭', '강창성', '고흥길', '권기술', '권오을', '권철현', '권태망', '김광원', '김기배', '김기춘', '김덕룡', '김동욱', '김락기', '김만제', '김무성', '김문수', '김부겸', '김성조', '김영구', '김영일', '김영춘', '김용갑', '김용균', '김용학', '김원웅', '김일윤', '김정숙', '김종하', '김진재', '김찬우', '김태호', '김학송', '김형오', '김호일', '김홍신', '나오연', '남경필', '도종이', '맹형규', '목요상', '민봉기', '박관용', '박근혜', '박명환', '박세환', '박승국', '박시균', '박원홍', '박재욱', '박종근', '박종웅', '박종희', '박주천', '박창달', '박헌기', '박혁규', '박희태', '백승홍', '서상섭', '서정화', '서청원', '손태인', '손학규', '손희정', '신경식', '신영국', '신영균', '신현태', '심규철', '안경률', '안상수', '안영근', '안택수', '엄호성', '원희룡', '유성근', '유흥수', '윤두환', '윤여준', '윤영탁', '윤한도', '이강두', '이규택', '이방호', '이병석', '이부영', '이상득', '이상배', '이상희', '이성헌', '이연숙', '이원창', '이원형', '이윤성', '이인기', '이재오', '이재창', '이주영', '이한구', '이해봉', '이회창', '임인배', '임진출', '임태희', '전용원', '전재희', '정문화', '정병국', '정의화', '정인봉', '정재문', '정창화', '정형근', '조웅규', '조정무', '주진우', '최돈웅', '최병국', '최병렬', '최연희', '하순봉', '허태열', '현경대', '현승일', '홍사덕', '황승민', '황우여']",심재철,한나라당,남성,6
72,160690,여성농업인육성법안,2001-04-02,의원,2001-12-07,수정가결,제16대 (2000~2004) 제220회,"   현재 농업·농촌발전에 중추적 역할을 수행하는 여성농업인의 지위향상·전문인력화  복지증진을 통하여 건강한 농촌가정을 구현하고 살기 좋은 농업·농촌사회를 이룩하여, 핵심 인적자원으로서의 여성농업인의 국내외농업여건 변화에 따른 대응능력을 향상시키고자 국가  지방자치단체의 책무를 구체적으로 정함으로써 여성농업인육성에 관한 효율적이고 체계적인 정책을 펼 수 있도록 함. 1. 여성농업인의 능력개발과 정치·경제·사회·문화의 모든 영역에서의 지위와 삶의 질 향상을 위하여 종합적인 정책을 수립하고 필요한 재원을 확보하도록 국가  지방자치단체에 책무를 부여함(안 제4조).2. 여성농업인은 농업·농촌의 발전주체로서 농업생산활동을 통하여 품질좋고 안전한 농산물을 안정적으로 생산·공급하여 농업·농촌발전에 이바지하고, 국민식량자립기반을 구축하기 위하여 노력하도록 여성농업인의책무를 정함(안 제5조).3. 농림부장관은 여성농업인육성정책에 관한 기본계획을 5년마다 수립하도록 함(안 제7조).4. 여성농업인정책에 관한 농림부장관의 자문에 응하기 위하여 농림부장관 소속하에 여성농업인정책자문회의를 둠(안 제9조).5. 농림부장관으로 하여금 효율적인 여성농업인정책의 수립을 위하여 여성농업인관련 실태에 대하여 정기적으로 조사를 실시하고 이를 기본계획에 반영하도록 함(안 제10조제1항).6. 여성농업인단체의 조직과 활동에 필요한 행정적인 지원은 물론, 필요한 경우 예산의 범위 안에서 경비를 지원할 수 있도록 함(안 제14조).7. 국가  지방자치단체가 여성농업인의 권익  복지증진을 위하여 관련시설을 설치·운영할 수 있도록 함(안 제15조).    1. 여성농어업인에 대한 ""지원""의 법목적을 명확히 하고자 법 제명을 ""여성농업인육성법""을 ""여성농어업인의육성지원에관한법률""로 수정(법 제명)2. 여성농업인의 근로여건 등 타 분야 여성에 대한 특수성을 고려하여 전체 여성을 포괄하는「여성발전기본법」외에 이 법을 별도로 제정하고자 하는 것인 바, 「여성어업인」도 여성농업인과 비슷한 지위에 있으므로 여성농업인과 같이 이 법 시행대상에 포함시킴(안 법 제명  제2조 등).3. 여성농어업인에 대한 권익보호, 지위향상 등을 법문에 명시함으로써 법 목적을 명확히 하고, 법 제2조의 기본이념 규정은 목적규정과 중복되는 등의 문제가 있는 것으로 보아 이를 삭제함(안 제1조  제2조).4. 여성농어업인육성정책 기본계획의 실효성을 강화하기 위하여 농어업경영능력향상 등 4가지 핵심정책과제를이 법에 직접 명시하였고, ""재원의 지원계획""을 동 계획에 포함되도록 관련규정을 정비함(안 제5조)5. 여성농업인육성계획의 효과적인 수립과 집행을 위해서는 농림부장관등이 동 계획을 수립할 때에 여성부 기획예산처 등 관계중앙행정기관의 장과의 협의하도록 하고, 아울러 이 법에 의해 설립되는 여성농어업인정책자문회의의 자문도 거치도록 함(안 제6조제4항 신설).6. 여성농어업인 지위향상 규정의 실효성을 강화하기 위하여 「여성농어업인의 고충상담  문화·교양, 건강등 지역실정에 맞는 프로그램의 운영·지원」근거규정을 신설함(안 제11조제1항).  ",농림해양수산위원회,"['김영진', '강현욱', '김경천', '김원기', '김충조', '김효석', '문석호', '민봉기', '박세환', '박용호', '윤철상', '이낙연', '이미경', '이정일', '장정언', '전갑길', '정세균', '정장선', '정철기', '천정배', '최선영', '최연희']",김영진,새천년민주당,남성,2
73,160666,공중위생관리법중개정법률안,2001-03-12,의원,2002-07-31,대안반영폐기,제16대 (2000~2004) 제219회,"      현행 공중위생관리법은 규제완화  보건위생과 관련한 부패 방지의 차원에서 공중위생영업을 자유업으로 규정하고 있으나, 숙박업 등의 경우 법의 취지와 달리 사회풍속을 해치고 향락산업으로 발전되어 지역의 청소년 교육에 악영향을 끼치고 있으므로, 이의 개선을 위해 주민들의 의사가 반영될 수 있는 공중위생관리위원회를 시·군·구에 설치하고 동 위원회가 선정한 지역의 업종에 대해서는 일부 허가제로 전환함과 아울러,시장·군수·구청장은 동 위원회가 공중위생관리를 위해 필요하다고 인정하는 경우 관련 공무원등으로 구성된 합동단속반을 운영할 수 있는 근거 규정을 마련하려는 것임.  ",보건복지위원회,"['정범구', '김경천', '김덕배', '남궁석', '송영길', '유재규', '이낙연', '이상수', '이종걸', '김명섭', '김민석', '김방림', '김성순', '김성호', '김영배', '김영진', '김영환', '김옥두', '김운용', '김원기', '김원길', '김윤식', '김충조', '김태식', '김태홍', '김택기', '김홍일', '김화중', '김효석', '김희선', '남궁석', '문석호', '문희상', '박광태', '박병석', '박병윤', '박상규', '박상천', '박상희', '박양수', '박용호', '박인상', '박종우', '박주선', '배기운', '설송웅', '설훈', '송훈석', '신계륜', '신기남', '심규섭', '안동선', '원유철', '유삼남', '유용태', '유재건', '윤철상', '이강래', '이근진', '이미경', '이용삼', '이원성', '이윤수', '이인제', '이재정', '이정일', '이창복', '이해찬', '이협', '이호웅', '이훈평', '이희규', '임종석', '임채정', '장성민', '장성원', '장영달', '장영신', '장정언', '장태완', '전갑길', '전용학', '정균환', '정대철', '정동영', '정동채', '정세균', '정장선', '정철기', '조성준', '조순형', '조재환', '조한천', '천용택', '천정배', '최명헌', '최선영', '최영희', '최용규', '최재승', '추미애', '한화갑', '함승희', '허운나', '홍재형']",정범구,새천년민주당,남성,9
74,160603,청소년보호법중개정법률안,2001-01-26,정부,2001-04-26,수정가결,제16대 (2000~2004) 제217회,"   사회통념상 성인으로 간주되는 대학생·근로청소년들이 자유롭게 사회활동을 할 수 있도록 하기 위하여 보호대상 청소년의 연령을 조정하고, 청소년유해업소 업주가 종업원 고용시에 연령을 확인하도록 하여 동 업소에의청소년 고용을 사전에 차단하며, 그밖에 현행 제도의 운영과정에서 나타난 일부 미비점을 개선·보완하려는 것임. 1. 고등학교를 졸업한 후 대학에 진학하였거나 취업한 자 등은 사회통념상 성인으로 간주되고 있으므로 이들이자유롭게 사회활동을 할 수 있도록 하기 위하여 청소년의 연령을 만 19세 미만으로 하되, 만 19세 미만이라도 당해 연도 중에 만 19세가 되는 자는 청소년에서 제외함(안 제2조제1호).2. 청소년유해매체물로부터 청소년을 보호하기 위하여 청소년유해매체물을 판매·대여·배포하거나 시청·관람·이용에 제공하고자 하는 자는 그 상대방의 연령을 확인하도록 하고, 청소년유해업소에서의 청소년 고용을사전에 차단하기 위하여 청소년유해업소의 업주는 종업원 고용시 연령을 확인하도록 함(안 제17조제1항 제24조제1항).3. 청소년보호법 위반행위를 적극적으로 유발시키거나 연령을 속이는 등 그 원인을 제공한 일탈 청소년중 선도·보호조치가 필요한 청소년에 대하여는 관할경찰서장·소속학교장·보호자 등에게 그 사실을 통보하도록하여 효과적인 선도·보호조치가 이루어질 수 있도록 함(안 제44조의2 신설).4. 과징금 부과처분을 받은 자가 자연재해로 재산에 현저한 손실을 입은 경우 등 과징금 전액을 일시에 납부하기가 어려운 때에는 납부기한을 연장하거나 분할납부하게 할 수 있도록 함(안 제49조제4항  제5항 신설).    청소년보호법 위반과징금의 사용주체를 시행령에 위임하는 규정을 수정하여 이를 법률에서 명확하게 규정하고일부 개정안의 자구를 보완하려는 것임.  ",정무위원회,[],정부,정부,,0
75,160585,여성발전기본법중개정법률안,2000-12-27,의원,2002-11-07,대안반영폐기,제16대 (2000~2004) 제216회,"     주요내용정부조직개편에 의해 신설되는 여성부가 여성업무를 전담하는 독립된 하나의 부처이기는 하나 여성관련업무가 모두 이관되지 않고 타부처에서도 집행됨에 따라 다른 부처의 여성정책에 영향을 미치는데 한계가 있는 바, 여성정책을 조정？총괄하는 기능을 수행하기 위한 여성정책조정위원회를 국무총리 소속하에 두며, 국가기관  지방자치단체에 여성관련정책을 기획？조정할 수 있는 권한을 가진 여성정책책임관을 설치하려는 것임.  ",국회운영위원회,"['이연숙', '강숙자', '고진부', '권기술', '김경천', '김근태', '김기배', '김영구', '김용학', '김원웅', '김정숙', '김호일', '박세환', '박승국', '송광호', '심재철', '안상수', '유재건', '윤경식', '이인기', '이정일', '이주영', '전재희', '정병국', '정인봉', '정창화', '한명숙', '한승수', '홍사덕']",이연숙,한나라당,여성,6
76,160515,근로기준법중개정법률안,2000-12-11,의원,2001-07-18,대안반영폐기,제16대 (2000~2004) 제216회,"   현행 근로기준법은 비합리적이고 전근대적인 여성 과보호조항을 둠으로써 여성고용비용을 증가시켜 결국 국내 여성고용 자체를 위축시키는 결과를 초래하고 있음. 특히, 전 세계에서 유일한 유급생리휴가제도는 여성고용비용을 높이고 노사갈등을 유발시키는 등 제도적 역기능이 컸던 것으로 지적되고 있음.따라서 국제적 기준에 맞지 않는 유급생리휴가를 폐지함으로써 비합리적인 여성 과보호조항을 없애고, 산전후휴가기간을 국제적 수준인 12주로 확대함으로써 모성의 실질적인 보호를 꾀하도록 함.■ 주요내용가. 생리휴가를 삭제함(제71조 삭제).나. 산전후휴가기간을 12주로 확대함(안 제72조).  ",환경노동위원회,"['정우택', '김무성', '원유철', '김영배', '김일윤', '김진재', '남경필', '박종근', '박혁규', '신영국', '신현태', '오장섭', '윤영탁', '이강두', '이상득', '이완구', '이정일', '정진석', '정창화', '조부영', '조희욱', '함석재']",정우택,자유민주연합,남성,0
77,160490,국회법중개정법률안,2000-12-07,의원,2002-02-28,대안반영폐기,제16대 (2000~2004) 제215회,"   여성의 복지와 권익향상을 위하여 1994년 상설의 여성특별위원회를 설치하였으나, 상임위원회와는 달리 소관이 없고 법률안 제안권  의결권, 예산결산 예비심사권, 국정감사권이 부여되지 않아 활동에 많은 제약이 있어 왔음.정부조직법의 개정에 의하여 행정부 내에 여성부가 신설될 경우 국회에 이를 소관으로 하는 상임위원회가 필요하므로 현행 여성특별위원회를 폐지하고 위원은 겸임하는 상임위원회로 여성위원회를 설치하여 이러한 문제점을 해결하려는 것임.■ 주요내용가. 현행 여성특별위원회를 폐지함(법 제46조의2 삭제).나. 여성위원회를 신설하고 그 소관은 여성부소관사항  ？여성발전기본법？ 제8조에 규정된 여성정책기본계획의 수립？시행업무에 관한 사항으로 함.(안 제37조제1항제17호 신설)  ",정치개혁특별위원회,"['이연숙', '강숙자', '강신성일', '김경천', '김방림', '김정숙', '김희선', '박근혜', '손희정', '심재철', '유성근', '이미경', '이종걸', '전재희', '정몽준', '정문화', '정병국', '최영희', '한명숙', '허운나']",이연숙,한나라당,여성,13
78,160454,남녀차별금지및구제에관한법률중개정법률안,2000-12-01,의원,2004-05-29,임기만료폐기,제16대 (2000~2004) 제215회,"  제안이유？？？？현행법은 남녀차별사항에 대하여 여성특별위원회가 시정신청을 접수하고 지체없이 그 사실에 대하여 필요한 조사를 한 후 필요에 따라서 신청인과 피신청인에 대하여 합의, 조정, 시정조치의 권고  의견표명을 할 수 있도록 규정하고 있음. 그러나 현행법은 시정조치에 관하여 권고만을 규정하고 있어 남녀차별사항에 대한 시정조치의 실효성을 확보하기 어려운 실정임. 따라서 남녀차별사항이 실질적으로 시정조치되도록 하기 위하여 시정명령권한을 신설하려는 것임. ？？？？가. 여성특별위원회(이하 “위원회”라 한다)가 남녀차별사항의 시정신청을 접수하여 그 사실에 관하여 필요한 조사를 실시한 결과 남녀차별사항에 해당한다고 인정할 만한 상당한 이유가 있는 때에는 남녀차별임을 결정하고 당해 공공기관의 장에게는 시정을 위하여 필요한 조치를 권고하도록 하고, 사용자에게는 필요한 조치를 명할 수 있도록 함(안 제28조제1항).나. 위원회의 시정조치명령에 따르지 아니한 자에 대하여 2년 이하의 징역 또는 1천만원 이하의 벌금에 처하도록 함(안 제38조제2호).  ",국회운영위원회,"['엄호성', '권기술', '권오을', '김덕규', '김락기', '김문수', '김부겸', '김용갑', '김용학', '김일윤', '김정숙', '김홍신', '민봉기', '박세환', '서상섭', '손태인', '손희정', '신영국', '신현태', '심규철', '안영근', '원희룡', '유삼남', '유성근', '윤경식', '이강두', '이성헌', '이재창', '이한구', '임인배', '임태희', '전재희', '정의화', '정철기', '정형근', '함승희']",엄호성,한나라당,남성,3
