,의안번호,의안명,제안일자,제안자구분,의결일자,의결결과,제안회기,제안이유,소관위원회,제안자,발의자,제안정당,성별,여성의원 수
0,163169,정당법중개정법률안,2004-03-02,위원장,2004-03-09,원안가결,제16대 (2000~2004) 제245회,"   가. 제244회 국회(임시회) 제6차 본회의(2004. 1. 8)에서 정치개혁특별위원회가 구성되고, 제244회 국회(임시회) 폐회중 제1차 정치개혁특별위원회(2004. 1. 13)에서 정당법소위원회가 구성됨.나. 제244회 국회(임시회) 폐회중 제1차·제2차 정당법소위원회(2004. 1. 15, 1. 27)에서 범국민정치개혁협의회의 합의내용과 의원발의 법률안 4건등을 종합하여 심사한 결과 그 내용을 통합·보완한 정당법중개정법률안을 심규철의원, 정의화의원, 김성순의원, 김성호의원의 서면동의로 정치개혁특별위원회안으로 제안하기로 함.다. 제245회 국회(임시회) 제3차 정치개혁특별위원회(2004. 2. 9)는 정당법소위원회의 심사결과를 받아들여 정당법중개정법률안을 위원회안으로 심사ㆍ의결함. 고비용 저효율의 정당구조를 개선하기 위하여 지구당제도를 완전 폐지하도록 하고, 보다 많은 여성들의 원내 진출이 이루어지도록 제도를 개선·보완하는 등 새로운 정치풍토를 조성함으로써 우리 정치문화의 선진화를 이루려는 것임. 가. 법정지구당을 폐지하고, 정당의 구성은 중앙당과 시·도당으로 하도록 함(안 제3조).나. 현행 서면에 의한 입·탈당 방법 외에 전자서명이 있는 전자문서를 통하여도 입?탈당을 할 수 있도록 허용하고, 대의기관의 결의를 전자서명을 통하여도 의결할 수 있도록 함(안 제20조, 제23조  제29조의2).다. 중앙당은 정당의 예산과 결산  회계검사를 확인·검사하기 위하여 예산결산위원회를 의무적으로 설치토록 함(안 제29조제2항).라. 국고보조금의 배분대상이 되는 정당은 중앙당에 정책연구소를 별도법인으로 설립하도록 함(안 제29조의3 신설).마. 유급사무직원수를 중앙당은 100인 이내로, 시·도당은 5인 이내로 축소 변경함(안 제30조의2제1항).바. 정당은 공직후보자를 추천하기 위한 당내경선을 실시할 수 있도록 하고, 당내경선의 후보자로 등재된 자로서 후보자로 선출되지 아니한 경우에는 후보자등록을 할 수 없도록 함(안 제31조제2항  제3항).사. 비례대표국회의원후보자중 100분의 50이상을 여성으로 추천하도록 하고, 지역구국회의원후보자중 100분의 30이상을 여성으로 추천하는 경우에는 보조금을 추가 지급할 수 있도록 함(안 제31조제4항  제6항).아. 보조금의 배분대상이 되는 정당은 당내경선사무중 투·개표사무등을 선거관리위원회에 위탁할 수 있도록 함(안 제31조의4 신설).자. 당내경선을 수탁관리하는 선거관리위원회의 위원·직원은 이 법을 위반한 혐의가 있다고 인정되는 경우에는 질문·조사할 수 있도록 함(안 제31조의6 신설).차. 당내경선을 관리하는 선거관리위원회의 위원?직원 등을 폭행하거나 경선사무와 관련한 시설등을 훼손한 경우, 당내경선의 후보자등을 폭행?협박하거나 부정한 방법으로 당내경선등의 자유를 방해한 경우  당내경선등과 관련하여 연설?방송등의 방법으로 허위의 사실을 공표하게 한 경우 이를 처벌할 수 있도록 함(안 제45조의2, 제45조의3  제45조의6 신설).카. 당내경선의 위탁관리와 관련한 범죄의 조사를 위한 출석요구를 정당한 사유없이 불응한 경우  현행범으로서 동행요구에 응하지 아니한 경우에는 100만원 이하의 과태료에 처하도록 함(안 제56조 신설).  ",정치개혁특별위원회,[],위원장,위원장,,0
1,163156,성매매알선등행위의처벌에관한법률안,2004-02-26,위원장,2004-03-02,원안가결,제16대 (2000~2004) 제245회,"   가. 2002년 9월 11일 조배숙의원외 85인이 발의한 성매매알선등행위의처벌방지에관한법률안, 2001년 11. 27일 조배숙의원외 2인이 소개한 성매매알선등범죄의처벌방지에관한법률제정청원을 각각 제234회 국회(정기회) 제9차 법제사법위원회(2002. 11. 1)에 상정하여 심사한 후 법안심사제1소위원회에 회부함.나. 법안심사제1소위원회는 동 법률안과 동 청원을 제238회 국회(정기회) 제1차(2003. 4. 24), 제243회 국회(정기회) 제3차(2003. 11. 19)·제4차(2003. 12. 24)  제245회 국회(임시회) 제1차(2004. 2. 26) 법안심사제1소위원회에서 전문위원  정부관계자를 참석시킨 가운데 심도 있는 심사를 한 결과, 동 법률안과 동 청원을 각각 폐기하고 하나의 법률안으로 입안하여 위원회 대안으로 제안하기로 함.다. 제245회 국회(임시회) 제9차 법제사법위원회(2004. 2.26)는 법안심사 제1소위원장의 심사보고를 듣고 법안심사제1소위원회가 제안한 대안을 우리 위원회안으로 받아들여 동 법률안과 동 청원을 본회의에 부의하지 아니하고 위원회대안을 제안하기로 함. 우리사회의 성매매  성매매알선등행위는 현행법에서 금지하고 있음에도 불구하고 계속해서 확산되고 있는 실정임. 이는 성매매를 강요하거나 성매매를 알선·유인하는 등 성매매의 공급  중간 매개체들이 다양화 되고 있기 때문임.따라서 성매매 공급자와 중간매개체를 차단하기 위하여 성매매 목적의 인신매매를 처벌하고, 벌칙에 있어서 성매매 강요·알선 등 행위에 대하여 형태별로 다양화하여 형량을 강화하며, 성매매알선등행위로부터 취득한 금품 그 밖의 재산상 이익은 몰수·추징하고, 성매매알선등행위를 신고한 자에 대한 보상금을 지급하며, 성매매 강요·알선 등 행위자가 성을 파는 자에 가지는 채권을 무효화 하고,성을 파는 행위를 한 자를 보호하기 위하여 성매매피해자 성매매의 형사처벌 제외, 수사·재판과정에서 신뢰관계 있는 자의 동석, 신고자등에 대한 법정심리의 비공개를 규정함으로써 우리 사회에 만연되어 있는 성매매알선등행위와 성매매를 근절하려는 것임. 가. 성매매알선등행위, 성매매 목적의 인신매매 , 성매매피해자의 개념을 도임함(안 제2조).나. 성매매피해자의 성매매 불처벌과 신고한 자 또는 성매매피해자를 조사하거나 증인으로 심문하는 경우 특정범죄신고자등보호법의 규정을 준용 하도록 함(안 제6조).다. 신고자등을 법원에서 증인으로 신문하거나 수사기관이 조사하는 경우 신뢰관계 있는 자의 동석이 가능하도록 하고, 청소년 등의 경우 특별한 사유가 없는 한 동석을 허용하도록 함(안 제8조).라. 법원은 신고자등의 사생활 보호 또는 신변보호 등을 위하여 결정으로 심리를 공개하지 아니할 수 있도록 함(안 제9조).마. 성매매알선등 행위를 한 자가 성을 파는 행위를 하였거나 할 자에게 가지는 채권은 계약의 형식이나 명목에 관계없이 무효로 하고, 그 채권을 양도하거나 그 채무를 인수 한 경우에도 이를 무효로 하며, 검사 또는 사법경찰관은 성을 파는 자의 채무불이행사건을 수사할 때 당해 채권이 불법원인채권이지 여부를 확인하여 수사에 참작하도록 함(안 제10조).바. 외국인 여성이 이 법에 규정된 범죄를 신고하거나 외국인 여성을 성매매피해자로 수사하는 때에는 당해 사건을 불기소 처분하거나 공소를 제기할 때까지 출입국법상의 강제퇴거명령이나 보호의 집행을 유예 하도록 함(안 제11조).사. 성매매를 한 자에 대하여 보호처분을 할 수 있도록 하며, 보호처분기간은 6월, 사회봉사·수강명령은 100시간을 초과하지 못하도록 함(안 제12조  제15조).아. 상매매의 강요·알선·광고 등 행위태양에 따라 벌칙을 세분화하고 강화함(안 제18 내지 제21조).자. 성매매강요죄 또는 성매매알선등행위죄를 범할 목적으로 단체 또는 집단을 구성하는 경우는 폭력행위등처벌에관한법률 제4조(단체등의 구성·활동)의 예에 의하여 처벌 하도록 함(안 제22조).차. 이 법에 규정된 범죄를 범한 자가 수사기관에 신고하거나 자수한 때에 는 형을 감경 또는 면제하며, 범죄단체 구성성원이 성매매 강요죄를 범한 경우 이를 신고한 자에게 보상금을 지급할 수 있도록 함(안 제26 조  제28조).  ",법제사법위원회,[],위원장,위원장,,0
2,163106,정부조직법중개정법률안,2004-01-20,정부,2004-03-02,대안반영폐기,제16대 (2000~2004) 제245회,"   각종 재난에 대한 예방·대응  복구기능을 강화하고 효율적인 안전관리체제를 구축하기 위하여 행정자치부장관 소속하에 소방방재청을 신설하고, 국정과제의 효율적 추진을 위하여 행정개혁, 인사관리  영유아(영유아) 보육업무 등 중앙행정기관의 소관사무를 일부 조정하는 한편, 법제업무와 보훈업무의 효율적 수행을 위하여 법제처와 국가보훈처를 장관급 기구로 격상하려는 것임. 1. 행정개혁 업무를 보다 종합적·체계적으로 추진하기 위하여 기획예산처에서 수행하여 오던 행정개혁에 관한 사무를 행정자치부로 이관함(안 제23조제1항  제33조제1항).2. 법제업무  보훈업무의 효율적 수행을 위하여 법제처와 국가보훈처를 장관급 기구로 격상하고 법제처장·차장  국가보훈처장·차장을 각각 정무직으로 하며, 군인보험법이 폐지됨에 따라 국가보훈처의 군인보험에 관한 사무를 삭제함(안 제24조제2항  제25조).3. 인사개혁의 원활한 추진을 위하여 행정자치부에서 수행하던 공무원 인사관리 관련기능을 중앙인사위원회로 이관함에 따라 관련 규정을 정비하고, 전자정부 구현을 촉진하기 위하여 행정자치부의 소관사무에 전자정부에 관한 사무를 추가함(안 제33조제1항).4. 각종 재난관련 기능을 상호 유기적으로 수행할 수 있도록 행정자치부장관 소속하에 소방방재청을 신설하고 청장 1인과 차장 1인을 두되, 청장은 정무직 또는 소방공무원으로, 차장은 별정직국가공무원 또는 소방공무원으로 보하도록 함(안 제33조제6항  제7항 신설).5. 보건복지부에서 수행하고 있는 영유아 보육업무를 보다 효율적으로 수행할 수 있도록 여성부로 이관함(안 제39조제1항  제42조).  ",행정자치위원회,[],정부,정부,,0
3,163094,영유아보육법개정법률안,2003-12-27,위원장,2004-01-08,수정가결,제16대 (2000~2004) 제244회,"   1. 제229회국회(임시회) 제1차 위원회(2002. 4. 15)  제238회국회(임시회)제6차 위원회(2003. 4. 28)는 2001년 3월 16일 조웅규 의원 외 8인이 발의하고 124인이 찬성한 영유아보육법중개정법률안, 2001년 4월 16일 이원형 의원 외 24인이 발의한 동법중개정법률안, 2002년 3월 8일 김홍신 의원 외 19인이 발의한 동법개정법률안, 2003년 2월 18일 심재철 의원 외 10인이 발의한 동법중개정법률안  2001년 6월 27일 김성순?김홍신?김태홍 의원이 소개한 영유아보육법중개정에관한청원을 각각 상정하여 심사한 후 법안심사소위원회에 회부하는 한편 제238회국회(임시회) 제5차 위원회(2003. 4. 25)에서 관계전문가로부터 동 법안에 대한 의견을 청취함.2. 제243회국회(정기회) 제11차 위원회(2003. 12. 9)는 법안심사소위원회에서 마련한 안을 위원회 대안으로 제안하기로 하고 동 5건의 개정법률안과 청원은 본회의에 부의하지 아니하기로 하였음. 여성의 사회참여 확대, 가족구조의 변화 등으로 인해 사회적 양육 이 필요하므로 보육의 공공성을 확보하는 한편 영유아보육과 관련된 여건변화를 전반적으로 반영하고자 함. 1. 보육은 영유아의 이익을 최우선으로 고려하여 제공하도록 하고, 보육에 있어서의 차별을 금함(안 제3조).2. 보육정책에 관한 관계부처간의 의견을 조정하기 위하여 국무총리 소속하에 보육정책조정위원회를 두는 한편 보육에 관한 각종 정책·사업·보육지도 등을 심의하기 위하여 보건복지부에 중앙보육정책위원회를, 시·도  시·군·구에 지방보육정책위원회를 둠(안 제5조  제6조).3. 현행 민간보육시설을 사회복지법인이 설치·운영하는 법인보육시설과 국가 또는 지방자치단체 이외의 자가 설치·운영하는 민간보육시설로 구분하고 부모협동보육시설을 새로이 둠(안 제10조).4. 보건복지부장관, 시?도지사  시장·군수·구청장은 보육시설 수급계획을 포함한 보육계획을 수립·시행하도록 함(안 제11조).5. 국·공립보육시설 외의 보육시설을 설치·운영하고자 하는 자는 시장?군수?구청장의 인가를 받도록 함(안 제13조).6. 보육시설을 설치·운영하고자 하는 자는 보건복지부령이 정하는 설치기준을 갖추도록 함(안 제15조).7. 보육시설의 장의 자격은 대통령령으로 정하도록 하고 보육교사는 안 제21조제2항 각호에서 정하는 자로서 보건복지부장관이 검정·수여하는 자격증을 받은 자로 하며 그 등급은 1·2·3급으로 함(안 제21조).8. 국가 또는 지방자치단체와 사회복지법인 그 밖의 비영리법인이 설치한 보육시설과 대통령령이 정하는 보육시설의 장은 영아·장애아 등에 대한 보육을 우선적으로 실시하도록 함(안 제26조).9. 국가 또는 지방자치단체와 사회복지법인 그 밖의 비영리법인이 설치한 보육시설과 대통령령이 정하는 보육시설의 장은 국민기초생활보장법에 의한 수급자와 보건복지부령이 정하는 저소득층의 자녀가 우선적으로 보육시설을 이용할 수 있도록 함(안 제28조).10. 보육시설의 장은 영유아와 보육시설의 종사자에 대하여 정기적으로 건강진단을 실시하고 치료  예방에 필요한 조치를 하여야 하며 보건복지부령이 정하는 바에 의하여 균형있고 위생적이며 안전한 급식을 하여야 함(제31조 내지 제33조).11. 초등학교 취학 직전 1년의 유아  장애아에 대한 보육은 무상으로 하되 대통령령이 정하는 바에 의하여 순차적으로 실시하도록 하고 그 비용은 국가  지방자치단체가 부담 또는 보조하도록 함(안 제35조).12. 인가된 보육시설을 폐지 또는 휴지하거나 그 운영을 재개하고자 하는 자는 보건복지부령이 정하는 바에 의하여 미리 시장·군수·구청장에게 신고하도록 함(안 제43조).13. 보건복지부장관, 시·도지사  시장·군수·구청장은 보육시설을 설치·운영하는 자가 안 제45조제1항 각호에 해당하는 때에는 1년 이내의 시설운영정지를 명하거나 폐쇄를 명할 수 있도록 함(안 제45조).14. 보건복지부장관 또는 시?도지사는 보육시설의 장 또는 보육교사가 안 제46조  제47조 각호에 해당하는 때에는 자격을 정지시킬 수 있도록 하는 한편 안 제48조 각호에 해당하는 때에는 자격을 취소할 수 있도록 함(안 제46조 내지 48조).■ 본회의 수정사항 영유아보육법개정법률안(대안)이 2003년 12월 11일 제244회국회(임시회) 제1차 교육위원회가 대안으로 마련한 유아교육법안(제정)과 비교하여 형평성차원에서 맞지 아니하므로 영유아보육에 있어서 유아교육과 마찬가지로 사회·경제적 활동이 원활하게 이루어질 수 있도록 지원함으로써 유아교육법안과 조화를 꾀함과 동시에 보육시설에 대한 재정지원을 강화함으로써 보육의 내실을 기하려는 것임.□ 수정 1. 보육시설의 장으로 하여금 영유아의 발달 등을 종합적으로 관찰·평가하여 영유아의 생활지도  초등학교 교육과의 연계지도에 활용할 수 있도록 하기 위하여 생활기록부를 작성·관리하도록 함(안 제29조의2 신설).2. 국가 또는 지방자치단체가 전부 또는 일부를 보조하는 전체 보육시설(국공립·법인·직장·가정·부모협동·민간)비용에 보육교사의 인건비  초과보육 경비를 추가함(안 제36조).3. 보육시설을 설치·운영하는 자는 당해 보육시설의 소재지를 관할하는 시·도지사가 정하는 범위안에서 그 시설을 이용하는 자로부터 보육료외의 필요경비 등을 수납할 수 있도록 추가함(안 제38조).4. 직장보육시설외 보육시설의 운영비에 대하여도 조세특례제한법이 정하는 바에 의하여 조세감면을 하도록 함(안 제39조제2항 신설)  ",보건복지위원회,[],위원장,위원장,,0
4,163077,건강가정기본법안,2003-12-26,위원장,2003-12-29,원안가결,제16대 (2000~2004) 제244회,"   1. 제242회국회(임시회) 제1차 위원회(2003. 8. 25)  제243회국회(정기회) 제9차 위원회(2003. 11. 11)는 2003년 7월 21일 박종웅 의원 외 9인이 발의한 건강가정육성기본법안  2003년 8월 22일 김홍신 의원이 대표발의한 가족지원기본법안을 각각 상정하여 심사한 후 법안심사소위원회에 회부하는 한편 제243회국회(정기회) 제9차 위원회(2003. 11.11)에서 관계전문가로부터 동 법안들에 대한 의견을 청취함.2. 제243회국회(정기회) 제11차 위원회(2003. 12. 9)는 법안심사소위원회에서 마련한 안을 위원회 대안으로 제안하기로 하고 동 개정법률안과 청원은 본회의에 부의하지 아니하기로 하였음. 급변하는 현대사회에서 제기되고 있는 다양한 가족문제를 예방  해결하기 위하여 가정문제를 효율적으로 해결하고 건강한 가정을 구현하기 위하여 가정중심의 통합적 복지서비스 체계를 확립할 수 있는 행정적?제도적 기틀을 마련하고자 함. 1. 국가와 지방자치단체는 건강한 가정을 위하여 필요한 제도와 여건을 조성하고 이를 위한 시책을 강구하여 추진하도록 함(안 제5조).2. 매년 5월을 가정의 달로 하고, 5월 15일을 가정의 날로 함(안 제12조).3. 건강가정에 관한 주요시책을 심의하기 위하여 중앙건강가정정책위원회를 국무총리 소속하에 두도록 함(안 제13조).4. 보건복지부장관은 5년마다 건강가정기본계획을 수립하고 매년 시행계획을 수립·시행하여야 하며, 관계중앙행정기관의 장  시·도지사는 기본계획의 연도별 시행계획을 수립·추진하여야 함(안 제15조 내지 제17조).5. 국가와 지방자치단체는 개인과 가족의 생활실태를 파악하고 건강가정 구현  가정문제 예방 등을 위한 서비스의 욕구와 수요를 파악하기 위하여 5년마다 가족실태조사를 실시하고 그 결과를 발표하도록 함(안 제20조).6. 국가와 지방자치단체는 가정이 원활한 기능을 수행하도록 지원하여야 함(안 제21조).7. 가정을 방문하여 가사, 육아, 산후조리, 간병 등을 돕기 위하여 가정봉사원을 지원할 수 있도록 함(안 제30조).8. 국가와 지방자치단체는 건강가정 교육을 실시하도록 함(안 제32조).9. 국가와 지방자치단체는 가정문제의 예방, 상담  치료, 건강가정의 유지를 위한 프로그램의 개발 등을 위하여 중앙, 시·도  시·군·구에 건강가정지원센터를 두도록 함(안 제35조제1항).10. 건강가정지원센터에는 건강가정사업을 수행하기 위하여 관련분야에 대한 학식과 경험을 가진 전문가로서 건강가정사를 두도록 함(안 제35조제2항).  ",보건복지위원회,[],위원장,위원장,,0
5,163023,정부조직법중개정법률안,2003-12-16,위원장,2003-12-23,부결,제16대 (2000~2004) 제244회,"   1. 제232회국회(임시회) 제1차위원회(2002. 7. 19)에서 법안심사소위원회를 구성함.2. 제243회국회(정기회) 제2차 법안심사소위원회(2003.11.18)에서 재난관리기구 신설을 내용으로 하는 2001년5월16일 민봉기의원이 대표발의한 정부조직법중개정법률안, 2001년6월25일 김성조의원이 대표발의한 정부조직법중개정법률안, 2001년10월18일 김충조의원이 대표발의한 정부조직법중개정법률안, 2003년4월15일 이재창의원이 대표발의한 정부조직법중개정법률안, 2003년5월24일 권태망의원이 대표발의한 정부조직법중개정법률안과 2003년3월15일 고흥길의원이 대표발의한 정부조직법중개정법률안  2003년10월30일 정부가 제출한 정부조직법중개정법률안을 심사한 결과 각 법률안은 본회의에 부의하지 않기로 하고 그 내용을 통합·보완하여 위원회대안으로 제안하기로 함3. 2003년 11월 19일 제243회국회(정기회) 제12차 행정자치위원회에서 법안심사소위원회의 의견을 받아들여 위원회 대안을 의결함. 각종 재난에 대한 예방·대응  복구기능을 강화하고 효율적인 안전관리체제를 구축하기 위하여 행정자치부장관 소속하에 소방방재청을 신설하고, 국정과제의 효율적 추진을 위하여 행정개혁, 인사관리  영유아(?유아) 보육 업무 등 중앙행정기관의 소관 사무를 일부 조정하는 한편, 법제업무와 보훈업무의 효율적 수행을 위하여 법제처와 국가보훈처를 장관급 기구로 격상하고, 문화재의 보존·관리  활용에 관한 사무를 효율적으로 수행할 수 있도록 문화재청을 차관급 기구로 격상하며, 정무직공무원을 행정부에서 자의적으로 증원하는 것을 방지하기 위하여 대통령비서실 소속 정무직공무원을 제외한 정무직공무원의 배치는 법률의 규정에 의하도록 하려는 것임. 1. 정무직공무원을 행정부에서 자의적으로 증원하는 것을 방지하기 위하여 대통령비서실 소속 공무원을 제외한 정무직공무원의 배치는 법률의 규정에 의하도록 함(안 제8조제1항).2. 행정개혁 업무를 보다 종합적?체계적으로 추진하기 위하여 기획예산처에서 수행하여 오던 행정개혁에 관한 사무를 행정자치부로 이관함(안 제23조제1항, 제33조제1항).3. 법제업무  보훈업무의 효율적 수행을 위하여 법제처와 국가보훈처를 장관급 기구로 격상하고 법제처장·차장  국가보훈처장·차장을 정무직으로 하며, 군인보험법이 폐지됨에 따라 국가보훈처의 군인보험에 관한 사무를 삭제함(안 제24조제2항, 제25조).4. 인사개혁의 원활한 추진을 위하여 행정자치부에서 수행하던 공무원 인사관리 관련기능을 중앙인사위원회로 이관함에 따라 관련 규정을 정비하고, 전자정부 구현을 촉진하기 위하여 행정자치부의 소관사무에 전자정부에 관한 사무를 추가함(안 제33조제1항).5. 각종 재난관련 기능을 상호 유기적으로 수행할 수 있도록 행정자치부장관소속하에 소방방재청을 신설하고 청장 1인과 차장 1인을 두되, 청장은 정무직으로 하고, 차장은 별정직국가공무원 또는 소방공무원으로 보하도록 함(안 제33조제6항  제7항 신설).6. 문화재의 보존?관리  활용에 관한 사무를 효율적으로 수행할 수 있도록 문화재청을 차관급 기구로 격상하고, 문화재청에 청장 1인과 차장 1인을 두되, 청장은 정무직으로 하고, 차장은 별정직국가공무원으로 보하도록 함(안 제35조제4항).7. 보건복지부에서 수행하고 있는 영유아 보육업무를 보다 효율적으로 수행할 수 있도록 여성부로 이관함(안 제39조제1항, 제42조).  ",행정자치위원회,[],위원장,위원장,,0
