,의안번호,의안명,제안일자,제안자구분,의결일자,의결결과,제안회기,제안이유,소관위원회,제안자,발의자,제안정당,성별,여성의원 수
605,1806665,전통공연예술진흥법안,2009-11-23,의원,2012-05-29,임기만료폐기,제18대 (2008~2012) 제284회,"  ◎  오늘날 전통음악, 전통무용, 전통연희(演戱) 등 우리의 전통공연예술은 급격한 서구문화의 유입과 더불어 서양공연예술에 그 자리를 내어주고, ‘국악’이라는 분야로 한정된 채, 국민의 일상으로부터 멀어지고 있으며, 겨우 그 명맥만을 유지하고 있는 실정임.이에 전통공연예술의 보전과 발전을 통해 국가의 문화적 정체성 확립과 세계문화 발전에 기여하고, 전통공연예술의 대중화와 생활화를 통하여 국민의 문화향수권을 신장하며, 전통공연예술의 산업화와 세계화를 통해 국가경쟁력을 강화하기 위한 법적 근거를 마련하고자 함.또한, 전통공연예술진흥원과 국악방송의 법적 근거를 마련하여 전통공연예술의 진흥을 위한 사업과 활동을 효율적으로 지원하고, 이를 대중화 및 생활화하기 위한 사업을 추진토록 하려는 것임.◎  가. 민족의 문화자산인 전통공연예술의 보전 및 계승과 진흥을 위한 사업과 활동을 지원함으로써 국민의 문화향수권 신장과 민족문화의 창달에 이바지함을 목적으로 함(안 제1조).나. 문화체육관광부장관은 전통공연예술의 체계적인 보전, 계승 및 진흥을 위하여 5년마다 기본계획을 수립하여야 하며, 이에 따라 매년 시행계획을 수립·시행하도록 함(안 제6조).다. 문화체육관광부에 전통공연예술의 보전 및 진흥을 위하여 전통공연예술보전·진흥 정책방향의 설정, 기본계획 및 시행계획에 관한 사항을 심의하는 전통공연예술위원회를 두도록 함(안 제7조).라. 국가와 지방자치단체는 전통공연예술에 관한 자료 및 정보를 체계적으로 수집·관리하여야 하며, 이를 전통공연예술에 관한 조사·연구에 활용할 수 있도록 함(안 제9조).마. 국가와 지방자치단체는 전통공연예술 전문인력을 양성하여야 하며, 전통공연예술을 주로 하는 공연장 등을 전통예술공연장 등으로 지정하여 필요한 비용의 전부 또는 일부를 지원할 수 있도록 함(안 제10조 및 제11조).바. 국가 및 지방자치단체는 영유아 보육시설과 초·중등 및 평생 교육과정에 전통공연예술에 관한 교육과정이 포함되도록 노력하여야 하며, 전통공연예술 명가 또는 명소를 지정하여 그 활동비, 시설비 및 운영비를 지원할 수 있도록 함(안 제12조 및 제13조).사. 국가와 지방자치단체는 전통공연예술의 육성 및 진흥을 위하여 국제교류 활성화를 도모하고, 관광상품의 연계와 우수 전통공연예술 상품의 산업화 및 전통악기의 품질인증 등의 사업을 수행하여야 함(안 제14조).아. 전통공연예술 진흥 및 육성사업을 효율적으로 추진하기 위하여 전통공연예술진흥원을 두며, 방송을 통한 전통공연예술의 대중보급과 생활화를 위하여 국악방송을 설립하도록 함(안 제21조 및 제22조).자. 문화체육관광부장관은 전통공연예술의 보전 및 진흥을 위하여 필요하다고 인정되는 때에는 이 법에 따라 지원을 받는 전통예술관련 기관 등에 대하여 업무·회계 및 재산에 관한 보고 또는 서류제출을 요구할 수 있는 등 필요한 조치를 할 수 있도록 하며, 이에 따른 권한은 소속기관의 장 또는 시·도지사 등에게 위임하거나 위탁할 수 있도록 함(안 제23조 및 제24조).  ",문화체육관광방송통신위원회,"['김을동', '김영진', '김우남', '손숙미', '신상진', '유기준', '이명수', '이한성', '정수성', '정의화', '정하균', '홍사덕']",김을동,새누리당,여성,2
606,1806637,일제하 일본군위안부 피해자에 대한 생활안정지원 및 기념사업 등에 관한 법률 일부개정법률안,2009-11-19,의원,2012-05-29,임기만료폐기,제18대 (2008~2012) 제284회,"   현행법은 일본군위안부 피해자들에 대하여 생계급여, 의료급여, 생활안정지원금 지급, 간병인 지원 등 생활안정지원에 관련된 내용을 규정하고 있음. 그러나 일본군위안부 피해자들을 보호하기 위한 시설을 지원하는 구체적인 규정이 없어 이들이 실질적인 지원을 받지 못하는 경우가 많은 실정임. 따라서 일본군위안부 피해자들이 모여 살고 있는 보호시설이 일본군위안부 피해자들을 위하여 기존의 시설을 개선하거나 필요한 시설을 신축하고자 할 경우, 국가가 이를 지원할 근거를 법률에 규정하고자 함. 아울러 일본군위안부 피해자들의 육체적, 정신적 치료와 재활을 위하여 국가가 필요한 조치를 취하여야 한다는 내용을 규정하여 일본군위안부 피해자들의 생활안정과 복지증진에 기여하려는 것임. 가. 국가는 무의탁 일본군위안부 피해자들을 우선적으로 지원하고, 일본군위안부 피해자들이 노인의료복지시설의 서비스를 받아 재활과 건강회복을 할 수 있도록 필요한 조치를 강구하여야 함(안 제2조의2).나. 국가는 일본군위안부 피해자(시설에 수용되지 않은 일본군위안부 피해자를 포함)가 거주지 인근 노인의료복지시설에서 치료 및 재활서비스 등을 받을 수 있도록 시설이용 서비스를 지원함(안 제5조의2 신설).다. 국가는 일본군위안부 피해자의 명예회복 및 보상을 위하여 적절한 조치를 취하고, 이를 위하여 활동하는 단체에 필요한 지원을 함(안 제10조의2 신설).라. 피해관련 증언과 증거물을 수집·보관·전시하는 사업을 기념사업에 추가함(안 제11조제1항제6호 신설).마. 국가는 일본군위안부 피해자들을 보호하고 있는 사설보호시설이 일본군위안부 피해자들을 위하여 기존의 시설을 개선하거나 필요한 시설을 신축하고자 할 경우 이를 지원하도록 함(안 제12조의2 신설).  ",여성가족위원회,"['김영선', '김태원', '안효대', '유승민', '윤상현', '이성헌', '이시종', '이종혁', '이한성', '이해봉']",김영선,새누리당,여성,1
607,1806589,소득세법 일부개정법률안,2009-11-16,의원,2012-03-05,폐기,제18대 (2008~2012) 제284회,"  ◎  저출산 고령화 사회에서 출산율 제고를 위해 출산 여성에 대한 혜택을 도모할 필요가 있으며, 이를 위해 출산여성과 출산가구에 대한 소득세 일부를 경감함으로써 출산에 따른 경제적 부담을 완화할 필요가 있음◎  출산한 여성 또는 출산한 여성의 배우자에 대하여는 출산 후 1년간 소득공제를 함(안 제52조제12항 신설).  ",기획재정위원회,"['박병석', '김부겸', '김성곤', '김성순', '김영록', '김재윤', '박선숙', '백재현', '서종표', '안규백', '양승조', '우제창', '이성남']",박병석,민주통합당,남성,2
608,1806569,남녀고용평등과 일·가정 양립 지원에 관한 법률 일부개정법률안,2009-11-13,의원,2009-12-30,대안반영폐기,제18대 (2008~2012) 제284회,    및  현행법상 사업주 등 국민은 각종 법률상의 정부시책에 따른 지원을 받기위해서는 증빙서류를 보존하여야 하는 의무가 있음.그러나 이러한 서류보존의무로 인해 산업현장의 사업주 등 국민은 서류보존을 위한 사무실을 따로 마련해야하는 등 실질적으로 부담을 느끼고 있는 실정임.이에 지식정보화의 진전 등을 고려하여 기존에 종이형태로 보존하여야 했던 법상 각종 증빙서류를 전자적 형태로도 보존할 수 있도록 하여 국민의 부담을 경감하려는 것임(안 제33조).  ,환경노동위원회,"['조원진', '강성천', '박종근', '박준선', '유정현', '이두아', '이명규', '이사철', '이화수', '정병국', '조문환', '허태열']",조원진,새누리당,남성,1
609,1806559,청소년의 성보호에 관한 법률 일부개정법률안,2009-11-12,의원,2010-03-31,대안반영폐기,제18대 (2008~2012) 제284회,"  ■  경찰청 범죄통계에 따르면 13세 미만 성폭력 피해자는 2005년 738명, 2006년 980명, 2007년 1,081명, 2008년 1,220명 등으로 꾸준히 늘었으나 아동대상 성범죄의 신고율은 10%에 불과하며, 신고된 사건도 가해자가 기소되어 유죄판결을 받기까지 대부분이 증거불충분과 합의로 법망을 피해가고 있음. 성폭력범죄의 특성상 낮은 신고율을 감안한다면 밖으로 드러나지 않은 아동대상 성범죄는 훨씬 많을 것임.그러나 성폭력범죄에 대한 사법당국의 인식이 부족하여 아동대상 성범죄에 대한 형사사법제도의 운영이 국민의 법감정을 못따라가고 있는 것이 현실임.이 때문에 피해아동에게 치명적 신체적, 정신적 피해를 주었으면서도 가해자에게 상대적으로 관대한 사법당국의 법집행이 이루어져 왔고 사후관리대책이 허술하여 범죄예방이 어려웠음. 반면, 피해자는 범죄발생시 뿐 아니라 수사·재판단계 및 사후조치에 이르기까지 마땅히 보장받아야 할 인권이 유린된 채 2차, 3차 피해를 겪고 있음.이에 따라 아동·청소년대상 성폭력범죄에 대한 양형기준의 조정을 통해 처벌수준을 강화하는 한편, 성폭력범죄 예방을 위해 성범죄자 신상정보 등록·공개 및 취업제한 제도의 실효성을 확보하는 한편, 가해자의 피해 아동·청소년에 대한 접근제한 조치를 도입하고 반의사불벌죄 조항을 삭제함으로써 성범죄 피해자에 대한 실질적인 보호·지원체계를 구축하고자 함. 가. 아동·청소년대상 성폭력범죄의 처벌을 강화함(안 제7조).나. 강간, 강제추행의 객체를 ‘여자 아동·청소년’에서 ‘아동·청소년’으로 변경함(안 제7조).다. 아동·청소년대상 성범죄사건의 가해자에게 피해자 및 가정구성원 등에게 직접 접근하거나 전화, 이메일 등의 통신수단을 이용한 접근 및 아동·청소년 관련 교육기관 등 주변지역에의 접근행위를 금지함(안 제15조제2항 신설).라. 피해자의 의사 없이도 아동·청소년 대상 성폭력범죄에 대하여 공소를 제기할 수 있도록 함(안 제16조).마. 아동·청소년대상 성범죄자 신상 등록정보 보존·관리기간을 10년에서 20년으로 연장함(안 제36조).바. 성범죄자 신상 등록정보의 활용범위를 지방자치단체 및 아동·청소년 관련 교육기관 등도 활용할 수 있도록 함(안 제37조).사. 신상정보가 공개되는 범죄의 범위를 모든 아동·청소년 대상 성폭력범죄를 저지른 자로 확대함(안 제38조).아. 공개되는 신상정보의 범위를 실제 거주지, 소유차량 등록번호 및 직장 소재지 등으로 확대함(안 제38조제3항).자. 신상정보 등록대상자에 대한 아동·청소년의 성보호에 필요한 교육 실시를 의무화함(안 제41조제1항).차. 아동·청소년 대상 성범죄자의 아동·청소년 관련 교육기관 등에의 취업제한 기한을 20년으로 연장함(안 제44조제1항). 이 법률안은 진수희의원이 대표발의한 「성폭력범죄의 처벌 및 피해자보호 등에 관한 법률 일부개정법률안」(의안번호 제6558호)의 의결을 전제로 하는 것이므로 같은 법률안이 의결되지 아니하거나 수정의결 되는 경우에는 이에 맞추어 조정되어야 할 것임.  ",보건복지위원회,"['진수희', '권성동', '권택기', '김효재', '심재철', '안경률', '원유철', '유정현', '이두아', '이애주', '정병국', '차명진']",진수희,새누리당,여성,3
610,1806558,성폭력범죄의 처벌 및 피해자보호 등에 관한 법률 일부개정법률안,2009-11-12,의원,2010-03-31,대안반영폐기,제18대 (2008~2012) 제284회,"   흔히 ‘영혼의 학살’이라 일컬어지는 성폭력은 성을 매개로 이루어지는 모든 신체적, 언어적, 정신적 폭력으로서 피해자는 물론 그 가족들도 육체적, 정신적 고통과 후유증을 평생 멍에처럼 짊어지게 하는 범죄로 그 해악성은 이루 말할 수 없음.특히 경찰청 범죄통계에 따르면 13세 미만 성폭력 피해자는 2005년 738명, 2006년 980명, 2007년 1,081명, 2008년 1,220명 등으로 꾸준히 늘었으나 아동대상 성범죄의 신고율은 10%에 불과하며, 신고된 사건도 가해자가 기소되어 유죄판결을 받기까지 대부분이 증거불충분과 합의로 법망을 피해가고 있음. 성폭력범죄의 특성상 낮은 신고율을 감안한다면 밖으로 드러나지 않은 아동대상 성범죄는 훨씬 많을 것임.그러나 성폭력범죄에 대한 사법당국의 인식이 부족하여 아동대상 성범죄에 대한 형사사법제도의 운영이 국민의 법감정을 못따라가고 있는 것이 현실임.이 때문에 피해아동에게 치명적 신체적, 정신적 피해를 주었으면서도 가해자에게 상대적으로 관대한 사법당국의 법집행이 이루어져 왔고 사후관리대책이 허술하여 범죄예방이 어려웠음. 반면, 피해자는 범죄발생시뿐만 아니라 수사·재판단계 및 사후조치에 이르기까지 마땅히 보장받아야 할 인권이 유린된 채 2차, 3차 피해를 겪고 있음.따라서 이와 같은 아동대상 성폭력범죄 가해자에 대해 사법당국이 단호히 대처함과 동시에 피해자의 인권을 보호하기 위해 각각 아동 성폭력범죄의 사전 예방 - 피해자 신고와 가해자 처벌 - 재발 방지 프로그램 가동 - 피해자 보호와 지원의 각 단계에서 국가의 사법체계와 사회안전망이 원활하게 작동되어야 할 것임.이에 따라 13세 미만 미성년자 및 장애인을 대상으로 한 성폭력범죄에 대한 양형기준의 조정을 통해 처벌수준을 강화하고, 미성년 대상 성범죄의 경우 피해자가 성년이 될 때까지 공소시효를 정지하는 한편, 형법상 감경사유를 제한함으로써 사법당국의 엄정한 법집행이 이루어지도록 함.또한 성폭력범죄 전담재판부를 지정하고 재판부는 성폭력피해자에 대하여 관련전문가의 의견조회를 의무화하는 한편, 성폭력 피해 진단 및 치료, 상담, 법률, 피해자 조사업무 등을 종합적으로 수행하는 전문기구를 설치·운영함으로써 성폭력범죄 피해자에 대한 실질적인 보호·지원체계를 구축하고자 함. 가. 친족관계에 의한 강간, 강제추행 등 범죄에 관하여 처벌을 강화하고 처벌대상이 되는 친족의 범위를 4촌이내의 인척까지 확대함(안 제7조제1항, 제2항, 제4항).나. 신체, 정신상의 장애로 항거가 불가능하거나 곤란한 상태에 있는 사람에 대한 강간, 강제추행 등 범죄에 관하여 13세 미만의 미성년자에 대한 성폭력범죄에 준하는 처벌로 강화함(안 제8조 및 제9조제1항).다. 강간, 강제추행의 객체를 ‘여자’에서 ‘사람’으로 변경함(안 제8조 및 제8조의2).라. 13세 미만의 미성년자에 대한 성폭력범죄의 처벌을 강화함(안 제8조의2).마. 13세 미만 미성년자에 대한 성폭력범죄에 관하여는 피해자가 성년에 이를 때까지 공소시효를 정지함(안 제19조의2 신설).바. 장애인, 13세 미만 미성년자에 대한 성폭력범죄에 관하여는 형의 감경, 선고유예 및 집행유예 등 「형법」상 규정을 적용하지 아니함(안 제19조의3제1항 및 제3항 신설).사. 음주 및 약물의 영향으로 성폭력범죄를 범했을 때 그 형을 가중처벌함(안 제19조의3제2항 신설).아. 증인에 대한 신변안전조치 등을 청구할 수 있는 특정강력범죄로 보는 성폭력범죄의 범위에 친족에 의한 강간, 장애인에 대한 간음 및 13세 미만의 미성년자에 대한 성폭력범죄를 추가함(안 제20조제2항).자. 성폭력범죄 전담 재판부 지정 및 성폭력범죄 수사 및 재판업무 종사자들에 대한 성폭력사건 관련 교육 실시를 의무화함(안 제21조의2제3항, 제4항 신설).차. 성폭력피해자의 진술내용과 조사과정을 영상촬영·보존하여 별도의 진술조서를 작성하지 않고 영상조서로 대체하며, 수사기관이 진술녹화 후 ‘진술녹화 요약서’를 작성함(안 제21조의3제3항, 제5항).카. 법원의 16세 미만 등 성폭력피해자에 대하여 전문가 진단소견 및 피해자 진술내용에 관한 의견 조회를 의무화하고, 성폭력 피해 및 행위사실에 관한 진술타당성 분석 및 진술 증거능력 강화를 위해 진술행동분석 전문가 제도를 도입함(안 제22조의2제1항, 제2항).타. 국가와 지방자치단체는 성폭력 피해 진단 및 치료, 상담, 법률,피해자 조사업무를 종합적으로 수행하는 전문기구를 설치·운영할 수 있도록 함(안 제22조의7 신설).파. 성폭력상담소 등의 업무 가운데 가해자에 대한 민·형사상 소송 및 범죄피해자 구조금 수령지원 등 사법처리절차에 대해 관계기관에 협조, 지원 요청할 수 있도록 함(안 제24조제3호).하. 성폭력피해자 지원을 위한 의료기관의 치료·검사 거부, 기피 행위에 대해 과태료를 부과함(안 제33조제3항 및 제36조제1항제3호 신설).  ",법제사법위원회,"['진수희', '공성진', '권성동', '권택기', '김효재', '심재철', '안경률', '원유철', '유정현', '이두아', '이애주', '장광근', '정병국', '차명진']",진수희,새누리당,여성,3
611,1806554,청소년의 성보호에 관한 법률 일부개정법률안,2009-11-12,의원,2010-03-31,대안반영폐기,제18대 (2008~2012) 제284회,"    및  「아동ㆍ청소년의 성보호에 관한 법률」 제16조는 과거 친고죄로 규정되어 있었으나 친고죄의 경우 피고인이 고소취소를 받아내면 수사조차도 하지 않게 되어 이를 시정하고자 2008. 2. 29. 반의사불벌죄로 개정하였음.그러나 반의사불벌죄는 통상 ‘피해자의 명시한 의사에 반하여 처벌할 수 없다’고 규정하고 있어, 실제 적용상 피해자가 미성년자인 경우에도 문언의 의미상 미성년자인 피해자만 처벌불원의 의사를 표시하면 처벌하지 않게 된다는 의미로 해석됨.이는 청소년에 대한 성범죄를 엄격히 처벌하려는 본래의 입법취지에 반하는 결과를 초래하는 것이므로 이를 미성년인 피해자 뿐만 아니라 그 법정대리인의 처벌불원의사가 있어야 처벌할 수 없도록 하려는 것임(안 제16조).  ",보건복지위원회,"['이두아', '강용석', '서상기', '신지호', '이종혁', '장광근', '정영희', '조원진', '조전혁', '진성호', '홍일표']",이두아,새누리당,여성,2
612,1806548,의료급여법 일부개정법률안,2009-11-12,의원,2012-05-29,임기만료폐기,제18대 (2008~2012) 제284회,"   2009년 6월을 기준으로 한국 거주 이주여성은 약 50만 명(전체 체류자의 43%)으로 이들 국내 체류 외국여성들은 유입과정과 일의 성격에 따라 여성근로자, 여성결혼이민자, 기타 이주여성 등으로 나뉘며, 이 가운데 미등록 이주여성은 약 7만명으로 전체이주여성의 13%가량을 차지하고 있음.미등록 이주여성의 임신과 출산은 증가하고 있으나 제도적인 의료혜택을 받지 못하고 있어, 임신과 출산을 앞두고 산모와 유아의 건강권이 심각하게 침해될 소지가 있음.특히 미등록 이주 여성 중에는 자녀를 출산하지 않은 국적 취득이전의 결혼 이주 여성도 포함돼 있음.따라서 이주여성의 건강하고 안전한 임신과 출산을 위해 최소한의 의료서비스를 제공받을 수 있도록 국가가 의료급여수급권을 부여하여 임신 중인 이주여성의 등록, 미등록 여부에 관계없이 이들이 인간으로서의 기본적인 존엄성을 지니고 생활할 수 있도록 하려는 것임. 「출입국관리법」 제46조에 따른 강제퇴거대상자 중에서 임신·출산 중인 이주 여성은 의료급여수급권자로 보도록 함(안 제3조의3 신설).  ",보건복지위원회,"['홍일표', '김효재', '박순자', '송영선', '유성엽', '이두아', '정동영', '조승수', '최규식', '홍정욱']",홍일표,새누리당,남성,3
613,1806532,성매매방지 및 피해자보호 등에 관한 법률 일부개정법률안,2009-11-11,의원,2009-12-29,수정가결,제18대 (2008~2012) 제284회,"   현행법은 성매매 피해자의 보호와 자립을 지원하기 위하여 국가와 지방자치단체에 지원시설과 상담소를 설치·운영하고, 이에 사용되는 비용을 보조하도록 하고 있음.그러나 시설 및 상담소의 설치 이후, 평가 및 보수교육 등 서비스 수준의 유지 및 향상을 위한 조치가 부족한 상황임.따라서 여성부장관으로 하여금 해당 시설의 운영실적을 3년마다 평가하여, 지원시설과 상담소에서 수행하는 성매매 피해자의 보호 및 지원과 관련된 업무의 개선을 도모하고, 서비스의 질을 향상시키도록 하려는 것임.또한 성매매방지중앙지원센터에서 실시하는 상담원의 교육 업무를 교육의 목적에 따라 기본교육과 보수교육으로 구분하여 실시하도록 함으로써 교육의 효과를 극대화 하고자 함. 가. 성매매방지중앙지원센터에서 실시하는 상담원의 교육 업무를 교육의 목적에 따라 기본교육과 보수교육으로 구분하여 실시하도록 함(안 제11조의2제2항제8호).나. 여성부장관은 지원시설과 상담소의 운영실적을 3년마다 평가하도록 함(안 제15조의2 신설).수정이유 및 수정 개정안은 성매매 방지 상담원에 대하여 보수교육의 근거를 마련하고, 여성부장관이 성매매 피해자 지원시설과 상담소의 운영실적을 3년마다 평가하도록 시설 평가의 근거 규정을 신설하려는 내용으로서, 보수교육 실시와 관련된 조항을 별도로 신설하고(안 제11조의3 신설) 일부 자구를 수정함.  ",여성위원회,"['김금래', '김상희', '김성태', '손범규', '신낙균', '안홍준', '안효대', '윤석용', '이애주', '이한성', '이해봉', '정동영', '한선교']",김금래,새누리당,여성,4
614,1806518,가정폭력방지 및 피해자보호 등에 관한 법률 일부개정법률안,2009-11-11,의원,2009-12-29,수정가결,제18대 (2008~2012) 제284회,"   가정폭력피해자들은 거의 맨몸으로 집을 나오는 등 폭력 경험 이전의 생활정도와는 무관하게 경제적 어려움에 처해 있는바, 특히 학령기 성장아동을 동반한 경우에는 아동의 성장에 따른 양육비, 학비 등 최소한의 생활여건을 갖추기도 어려움.가정폭력피해자 보호시설에서는 입소 피해자들에게 상담, 치료, 법률지원 등을 제공하고 있지만 생계비는 기초생활수급자가 아닐 경우 별도의 지원이 없으며, 특히 동반 아동의 보육비, 학비, 급식비 등은 지원의 사각지대에 있는 상태로 이에 대한 국가의 지원 근거를 마련하여 동반 아동의 정상적인 성장·교육을 지원하는 등 피해자에 대한 지원서비스를 강화하려는 것임. 보호시설의 장이 피해자의 생계비나 동반 아동의 아동교육지원비 등 보호비용을 지방자치단체에 신청할 수 있도록 하고, 국가나 지자체에서 이를 지원할 수 있는 법적 근거를 마련함(안 제8조제4항 및 제13조제3항ㆍ제4항 신설).수정이유 및 수정 개정안은 국가 또는 지방자치단체가 가정폭력 피해자 보호시설에 대하여 입소 피해자의 생계비 및 동반 가정 구성원의 교육지원비 등 보호비용을 지원할 수 있도록 하려는 것으로서보호비용 지원과 관련된 조항을 별도로 신설하도록 규정 방식을 수정하고(안 제7조의5 신설), 피해자의 동반 가정 구성원에 대하여 학업을 지속할 수 있는 비용과 양육에 필요한 비용을 각각 지원하기 위하여 보호비용의 내용 중 아동교육지원비 외에 아동양육비를 추가로 규정함.  ",여성위원회,"['김상희', '곽정숙', '김금래', '김재윤', '김춘진', '박은수', '신낙균', '양승조', '원혜영', '이미경', '최영희', '추미애']",김상희,민주통합당,여성,7
