,의안번호,의안명,제안일자,제안자구분,의결일자,의결결과,제안회기,제안이유,소관위원회,제안자,발의자,제안정당,성별,여성의원 수
185,1811648,영유아보육법 일부개정법률안,2011-04-28,위원장,2011-04-29,원안가결,제18대 (2008~2012) 제299회,"  ■ 대안의 제안경위건 명 의안번호 발의자 회부일자 상정일자영유아보육법 일부개정법률안 제1800113호 오제세의원’08.8.29제285회 국회(임시회) 제1차 회의(’09.12.28)〃 제1800850호 이애주의원’08.9.8〃제1802705호이명수의원’09.9.22제284회 국회(정기회) 제9차 회의(’09.11.20)〃 제1802977호 양승조의원’08.12.15제281회 국회(임시회) 제2차 회의(’09.2.20)〃 제1803920호 손범규의원’09.2.26제287회 국회(임시회) 제1차 회의(’10.2.19)〃 제1805403호 원희목의원’09.7.8제285회 국회(임시회) 제1차 회의(’09.12.28)〃 제1805461호 양승조의원’09.7.15제287회 국회(임시회) 제1차 회의(’10.2.19)〃 제1805714호 정 부 안’09.8.19〃 제1805715호 손숙미의원’09.8.19〃 제1805786호 오제세의원’09.8.28제294회 국회(정기회) 제8차 회의(’10.12.2)〃 제1808582호 신상진의원’10.6.11〃 제1809617호 신상진의원’10.10.21위 12건의 법률안을 심사한 결과, 제298회 국회(임시회) 제3차 보건복지위원회(2011. 3. 9)에서 손범규의원안(의안번호 3920)과, 양승조의원안(의안번호5461)을 제외한 10건의 개정안은 본회의에 부의하지 아니하기로 하고, 손범규의원안(의안번호 3920)과 양승조의원안(의안번호 5461)안은 폐기하지 아니하고 계속 심사하기로 함. 「국회법」 제51조에 따라 위원회 대안으로 제안하기로 의결함.제299회 국회(임시회) 제1차 보건복지위원회(2011. 4. 12)에서 신상진위원의 번안동의로 제15조의2제2항을 신설하는 내용으로 번안 의결함.■ 대안의  현재 「영유아보육법」에서 사용되고 있는 보육시설, 보육시설의 장 및 보육시설 종사자의 명칭을 각각 어린이집, 어린이집의 원장 및 보육교직원으로 변경하여 국민들에게 밝고 긍정적인 이미지를 심어주어 관련 보육교사 등의 위상을 제고하고,5년을 주기로 실시하고 있는 보육실태조사의 주기를 3년으로 단축하여 정책 환경의 변화를 보다 즉각적으로 파악할 수 있도록 하면서,「영유아보육법」시행규칙 등에서 정하고 있는 어린이집 놀이터 설치에 관련된 사항을 법으로 상향 조정하여 규정함으로써 국민의 예측가능성을 제고하며,어린이집의 원장과 보육교사의 자격검정 및 자격증 교부 업무를 공공 또는 민간 기관·단체에 위탁하여 실시할 수 있도록 하면서, 업무 위탁에 소요되는 비용을 보조할 수 있도록 하고, 업무 수탁기관에서 자격검정 및 자격증 교부 수수료를 해당 업무에 필요한 경비에 직접 충당할 수 있도록 하여 업무의 안정적인 운영을 지원하려는 것임또한 「다문화가족지원법」에 따른 다문화가족의 자녀에게 국공립어린이집의 입소 우선순위 제공 및 무상보육 특례를 부여함으로써 다문화가족의 자녀가 우리사회에 보다 수월하게 적응할 수 있도록 하고,어린이집의 설치·운영자에 의한 보조금 횡령 또는 유용시에 어린이집 운영정지처분을 갈음하는 과징금처분을 도입함으로써 해당 어린이집에서 보육하는 영유아와 그 보호자의 불편을 최소화하려는 것임.■ 대안의  가. 보육시설 및 보육시설종사자 등의 명칭을 각각 어린이집 및 보육교직원으로 변경함(안 제2조제2항 내지 제5항).나. 보육실태조사의 실시 주기를 3년으로 함(안 제9조).다. 어린이집의 설치·운영자는 놀이터를 설치하도록 하되, 보육정원 50인 미만인 경우와 100미터 이내에 보건복지부령으로 정하는 기준을 충족하는 놀이터가 설치되어 있는 경우에는 놀이터를 설치하지 않도록 함(안 제15조후단 및 제15조의2 신설).라. 어린이집의 원장 또는 보육교사의 자격검정 및 자격증 교부에 관한 업무를 공공 또는 민간 기관·단체에 위탁할 수 있도록 하고, 업무 위탁에 따른 비용을 보조할 수 있도록 하면서, 업무를 위탁받은 공공 또는 민간 기관·단체에서 납부받은 자격증 교부 수수료를 해당 업무의 경비에 직접 충당할 수 있도록 함(안 제22조제2항 내지 제5항 신설)마. 다문화가족의 자녀에게 국공립어린이집 등을 우선 이용할 수 있도록 하고, 무상보육의 특례를 부여함(안 제28조제1항제5호 신설 및 제35조제1항)바. 보육료 및 양육수당의 지원이 확정된 자에 대하여 비용 지원대상 자격확인을 위하여 필요하다고 인정하는 경우 인적사항을 기재한 문서로 금융기관등의 장에게 금융정보등을 제공하도록 요청할 수 있음(안 제34조의6 제2항 신설)사. 보호자가 거짓이나 부정한 방법으로 보육료 및 양육수당을 지원받은 경우에는 그 비용의 전부 또는 일부를 환수할 수 있도록 함(안 제40조의2 신설)아. 어린이집 설치·운영자가 보조금 횡령 또는 유용을 하여 어린이집 운영정지를 명하여야 하는 경우에 이를 갈음하여 3천만원 이하의 과징금을 부과할 수 있도록 함(안 제45조의2 신설)  ",보건복지위원회,[],위원장,위원장,,0
186,1811619,지방공무원법 일부개정법률안,2011-04-27,위원장,2011-04-29,원안가결,제18대 (2008~2012) 제299회,"  ■ 대안의 제안경위가. 2010년 3월 26일 조정식의원이 대표발의한 지방공무원법 일부개정법률안, 2010년 4월 7일 이명수의원이 대표발의한 지방공무원법 일부개정법률안, 2010년 7월 14일 정부가 제출한 지방공무원법 일부개정법률안, 2010년 7월 22일 이주영의원이 대표발의한 지방공무원법 일부개정법률안, 2010년 8월 20일 이명수의원이 대표발의한 지방공무원법 일부개정법률안, 2010년 9월 15일 안효대의원이 대표발의한 지방공무원법 일부개정법률안, 2010년 11월 12일 정의화의원이 대표발의한 지방공무원법 일부개정법률안, 이상 7건의 개정법률안을 각각 제291회 국회(임시회) 제3차 행정안전위원회(2010. 6.23), 제294회 국회(정기회) 제7차 행정안전위원회(2010.11.23), 제298회 국회(임시회) 제3차 행정안전위원회(2011. 3. 4)에 상정하여 제안설명 및 검토보고와 대체토론을 거쳐 법안심사소위원회에 회부함.나. 제298회 국회(임시회) 제2차 행정안전위원회 법안심사소위원회(2011. 3. 9)에서 이상 7건의 법률안에 대해 심사한 결과 각각 본회의에 부의하지 아니하고 이를 통합·조정한 위원회 대안을 제안하기로 함.다. 제298회 국회(임시회) 제4차 행정안전위원회(2011. 3.10)에서 법안심사소위원회가 심사보고 한대로 지방공무원법 일부개정법률안(대안)을 심사·의결함.■ 대안의  기능직공무원들이 전문기능인으로서 자긍심을 가질 수 있도록 기능직공무원의 계급을 기능1급부터 기능9급까지로 구분하고, 소청심사위원회 위원의 기피ㆍ회피 근거를 마련하며,「국적법」의 개정(법률 제10275호, 2010. 5. 4. 공포, 2011. 1. 1. 시행)에 따라 새로이 인정되는 복수국적자의 공무원 임용 분야를 제한하도록 하고, 공개경쟁임용 외의 공무원 신규임용의 명칭을 “특별임용”에서 “경력경쟁임용”으로 변경하며,육아휴직이 가능한 자녀의 연령을 만 8세 이하로 개정하고, 별정직공무원과 계약직공무원의 휴직 사유를 확대하는 등 현행 제도의 운영상 나타난 미비점을 개선ㆍ보완하려는 것임.■ 대안의  가. 기능직공무원의 계급을 기능1급부터 기능9급까지로 구분함(안 제4조제1항).나. 현행 「지방공무원법」에 규정된 제척과 함께, 기피ㆍ회피근거를 법률에 일괄적으로 규정하여 소청심사위원회 위원의 기피·회피의 근거를 마련하고, 위원의 제척ㆍ기피ㆍ회피로 인하여 의결에 참여할 수 있는 위원의 수가 3명 미만이 될 경우 임시위원을 임명할 수 있는 근거를 마련함.(안 제19조, 안 제19조의2 신설).다. 「국적법」의 개정으로 일정한 경우 복수국적이 허용됨에 따라 국가안보 및 보안ㆍ기밀, 외교 등 복수국적자의 임용이 부적합한 분야에 대하여 복수국적자의 공무원 임용을 제한함(안 제25조의2제2항 신설).라. 공개경쟁임용 외의 공무원 신규임용의 명칭을 “특별임용”에서 “경력경쟁임용”으로 변경함(안 제27조, 안 제32조, 안 제35조제1항, 안 제80조).마. 육아휴직을 출산휴가와 연계하여 사용하는 경우 출산휴가일부터 후임자를 보충할 수 있도록 하여 업무공백을 방지하고, 출산휴가를 사용하는 여성공무원의 심리적 부담을 해소할 수 있도록 함(안 제41조제1항).바. 육아휴직이 가능한 자녀의 연령을 만 8세 이하로 개정함(안 제63조제2항제4호)사. 별정직공무원에게 질병 휴직, 소재불명 휴직, 간병 휴직을 허용하고, 계약직공무원에게 질병 휴직을 허용하며, 가임기 계약직공무원의 출산을 장려하기 위하여 육아휴직 신청 요건을 계약기간 만료 1년 이전에서 계약기간 만료 6개월 이전으로 완화함(안 제65조의2).  ",행정안전위원회,[],위원장,위원장,,0
187,1811617,국가공무원법 일부개정법률안,2011-04-27,위원장,2011-04-29,원안가결,제18대 (2008~2012) 제299회,"  ■ 대안의 제안경위가. 2009년 12월 30일 조정식의원이 대표발의한 국가공무원법 일부개정법률안, 2010년 4월 7일 이명수의원이 대표발의한 국가공무원법 일부개정법률안, 2010년 7월 14일 정부가 제출한 국가공무원법 일부개정법률안, 2010년 7월 22일 이주영의원이 대표발의한 국가공무원법 일부개정법률안, 2010년 8월 20일 이명수의원이 대표발의한 국가공무원법 일부개정법률안, 2010년 9월 15일 안효대의원이 대표발의한 국가공무원법 일부개정법률안, 2010년 10월 18일 김태원의원이 대표발의한 국가공무원법 일부개정법률안, 2010년 11월 12일 정의화의원이 대표발의한 국가공무원법 일부개정법률안, 이상 8건의 개정법률안을 각각 제287회 국회(임시회) 제1차 행정안전위원회(2010. 2.16), 제291회 국회(임시회) 제3차 행정안전위원회(2010. 6.23), 제294회 국회(정기회) 제7차 행정안전위원회(2010.11.23), 제298회 국회(임시회) 제3차 행정안전위원회(2011. 3. 4)에 상정하여 제안설명 및 검토보고와 대체토론을 거쳐 법안심사소위원회에 회부함.나. 제298회 국회(임시회) 제2차 행정안전위원회 법안심사소위원회(2011. 3. 9)에서 이상 8건의 법률안에 대해 심사한 결과 각각 본회의에 부의하지 아니하고 이를 통합·조정한 위원회 대안을 제안하기로 함.다. 제298회 국회(임시회) 제4차 행정안전위원회(2011. 3.10)에서 법안심사소위원회가 심사보고 한대로 국가공무원법 일부개정법률안(대안)을 심사·의결함.■ 대안의  기능직공무원들이 전문기능인으로서 자긍심을 가질 수 있도록 기능직공무원의 계급을 기능1급부터 기능9급까지로 구분하여 기능10급을 폐지하고,「국적법」의 개정(법률 제10275호, 2010. 5. 4. 공포, 2011. 1. 1. 시행)에 따라 새로이 인정되는 복수국적자의 공무원 임용 분야를 제한하도록 하며, 공개경쟁채용 외의 공무원 채용의 명칭을 “특별채용”에서 “경력경쟁채용”으로 변경하고,육아휴직이 가능한 자녀의 연령을 만 8세 이하로 개정하며, 별정직공무원과 계약직공무원의 휴직 사유를 확대하는 등 현행 제도의 운영상 나타난 미비점을 개선ㆍ보완하려는 것임.■ 대안의  가. 기능직공무원의 계급을 기능1급부터 기능9급까지로 구분함(안 제4조제1항).나. 소청심사위원회 소청심사의 객관성 및 공정성을 제고하기 위해 행정안전부에 설치된 소청심사위원회에 비상임위원 약간을 둘 수 있게 규정되어 있던 것을 상임위원 수의 2분의 1 이상에 해당하는 수만큼 두도록 하고, 비상임위원은 모두 민간위원으로 구성하게 함(안 제9조제3항 및 제10조제1항).다. 「국적법」 개정으로 일정한 경우 복수국적이 허용됨에 따라 국가안보 및 보안ㆍ기밀, 외교 등 복수국적자의 임용이 부적합한 분야에 대하여 복수국적자의 공무원 임용을 제한함(안 제26조의3제2항 신설).라. 공개경쟁채용 외의 공무원 채용의 명칭을 “특별채용”에서 “경력경쟁채용”으로 변경함(안 제28조, 안 제37조제1항).마. 육아휴직을 출산휴가와 연계하여 사용하는 경우 출산휴가일부터 후임자를 보충할 수 있도록 하여 업무공백을 방지하고, 출산휴가를 사용하는 여성공무원의 심리적 부담을 해소할 수 있도록 함(안 제43조제1항).바. 육아휴직이 가능한 자녀의 연령을 만 8세 이하로 개정함(안 제71조제2항제4호)사. 별정직공무원에게 질병 휴직, 소재불명 휴직, 간병 휴직을 허용하고, 계약직공무원에게 질병 휴직을 허용하며, 가임기 계약직공무원의 출산을 장려하기 위하여 계약직공무원의 육아휴직 신청 요건을 계약기간 만료 1년 이전에서 계약기간 만료 6개월 이전으로 완화함(안 제73조의2).  ",행정안전위원회,[],위원장,위원장,,0
188,1811602,교육공무원법 일부개정법률안,2011-04-27,위원장,2011-04-29,원안가결,제18대 (2008~2012) 제299회,"  ■ 대안의 제안경위가. 2008년 11월 21일 임해규의원이 대표발의한 「교육공무원법 일부개정법률안」과 2009년 6월 3일 권영진의원이 대표발의한 「교육공무원법 일부개정법률안」이 제293회 국회(임시회) 제4차 교육과학기술위원회(2010. 8. 25)에 상정되어 검토보고와 대체토론을 거쳐 법안심사소위원회에 회부됨.나. 제294회 국회(정기회) 제1차 법안심사소위원회(2010. 9. 7)는 2건의 법률안을 심사한 결과, 2건의 법률안을 통합한 위원회 대안을 마련하기로 함.다. 2010년 11월 12일 정의화의원이 대표발의한 「교육공무원법 일부개정법률안」이 제298회 국회(임시회) 제2차 교육과학기술위원회(2011. 3. 4) 및 제3차 교육과학기술위원회(2011. 3. 7)에 상정되어 검토보고 및 대체토론을 거쳐 법안심사소위원회에 회부됨.라. 제298회 국회(임시회) 제1차 법안심사소위원회(2011. 3. 8)는 정의화의원이 대표발의한 「교육공무원법 일부개정법률안」을 심사한 후, 제294회 국회(정기회) 제1차 법안심사소위원회(2010. 9. 7)에서 심사한 2건의 「교육공무원법 일부개정법률안」과 통합하여 위원회 대안을 마련하기로 함.마. 제298회 국회(임시회) 제4차 교육과학기술위원회(2011. 3. 11)는 3건의 「교육공무원법 일부개정법률안」을 각각 본회의에 부의하지 아니하기로 하고, 「교육공무원법 일부개정법률안」을 우리 위원회 대안으로 제안하기로 함.■ 대안의  현행 「교육공무원법」에 따라, 국·공·사립학교 교원으로 재직 중 미성년자에 대한 성폭력 범죄행위·금품수수행위·학생성적 관련 비위 행위 및 학생에 대한 신체적 폭력 행위로 인하여 파면·해임된 자에 대해서는 원칙적으로 고등학교 이하 각급 학교의 교원으로 신규채용 또는 특별채용을 할 수 없음.그러나, 미성년자에 대한 성폭력 범죄행위 등을 저지른 교원이 비위사실이 확인되기 전에 의원면직하는 경우에는 파면·해임 등의 징계가 원천적으로 불가능할 뿐만 아니라 금고 이상의 형을 선고받더라도 일정기간이 지나면 다시 교육공무원으로 채용될 수 있어, 의원면직되지 않고 파면·해임의 징계를 받아 채용제한 조치를 받은 교원과의 형평성에 문제가 발생하고 있음.이에 파면·해임등의 징계를 받지 않더라도 미성년자에 대한 성폭력 범죄행위 등으로 인하여 금고 이상의 형을 선고받은 자(집행유예의 형을 선고받은 후 그 집행유예기간이 경과한 자를 포함)에 대해서는 교육공무원으로 신규채용되거나 특별채용될 수 없도록 하려는 것임.아울러 현행 법률에는 신규채용 및 특별채용 제한의 대상에 기간제교원 및 「유아교육법」·「초·중등교육법」에 따른 교사·강사·산학겸임교사·명예교사 등 계약제교원 경력자가 포함돼 있지 않을 뿐만 아니라 기간제교원의 임용에 있어서는 임용 제한 규정이 적용되지 않고 있으므로, 이들에 대해서도 동일하게 적용하고자 하는 것임.또한, 육아휴직 가능 시기를 만 8세 이하의 자녀로 확대하여 자녀가 초등학교에 입학하여 학교생활에 순조롭게 적응할 수 있는 나이까지 교육공무원이 자녀양육을 위해서 휴직할 수 있도록 하려는 것임.아울러, 「국가공무원법」에서 정하는 ‘공무상 질병 또는 부상으로 인한 휴직기간(3년 이내), 여자 공무원의 육아휴직기간(3년 이내), 육아휴직으로 인한 결원 보충 요건(대통령령으로 정하는 경우에 한하여 3개월 이상 휴직하는 경우)’이 「교육공무원법」과 달라 이를 「교육공무원법」에 동일하게 규정함으로써 국가공무원법과 균형을 유지하고 교육공무원의 사기를 제고하고자 함.■ 대안의  가. 재직 중에 행한 미성년자에 대한 성폭력 범죄행위·금품수수 행위·학생성적 관련 비위 행위 및 신체적 폭력 행위로 인하여 금고 이상의 형을 선고받은 국·공·사립 교원 및 계약제교원은 고등학교 이하 각급 학교의 교원으로 신규채용 또는 특별채용할 수 없도록 함(안 제10조의3제1항).나. 기간제교원에 대해서도 교원의 임용 제한 규정을 준용하도록 함(안 제32조제4항 신설).다. 육아휴직 대상을 현행 만 6세 이하의 초등학교 취학 전 자녀에서 만 8세 이하(취학 중인 경우에는 초등학교 2학년 이하)의 자녀로 변경함(안 제44조제1항제7호).라. 교육공무원의 공무상 질병이나 부상으로 인한 휴직의 경우에 국가공무원과 동일하게 그 휴직기간을 현행 1년 이내에서 3년 이내로 확대함(안 제45조제1항제1호).마. 여자 교육공무원의 자녀 1인에 대한 육아휴직기간을 현행 1년 이내(2년의 범위 내 연장 가능)에서 3년 이내로 변경하고, 분할하여 휴직할 수 있도록 함(안 제45조제1항제6호).바. 육아휴직 교육공무원의 결원 보충 요건을 6개월 이상 휴직하는 경우에서 대통령령으로 정하는 경우에 한하여 3개월 이상 휴직하는 경우로 변경함(안 제53조제2항 후단 신설).  ",교육과학기술위원회,[],위원장,위원장,,0
189,1811595,군인연금법 일부개정법률안,2011-04-26,위원장,2011-04-29,원안가결,제18대 (2008~2012) 제299회,"  ■ 대안의 제안경위가. 제289회 국회(임시회) 제2차 국방위원회(2010. 4. 19)에서 2010년 3월 26일 조정식의원이 대표발의한 「군인연금법 일부개정법률안」을 상정하여 제안설명 및 검토보고와 대체토론을 거쳐 법률안심사소위원회에 회부함.나. 제294회 국회(정기회) 제6차 국방위원회(2010. 11. 30)에서 2010년 7월 1일 박주선의원이 대표발의한 「군인연금법 일부개정법률안」 및 2010년 8월 3일 유정현의원이 대표발의한 「군인연금법 일부개정법률안」등 이상 2건의 법률안을 상정하여 제안설명 및 검토보고와 대체토론을 거쳐 법률안심사소위원회에 회부함.다. 제298회 국회(임시회) 제1차 법률안심사소위원회(2011. 3. 8)에서 이상 3건의 개정안에 대해 종합·심사한 결과, 이상 3건의 법률안은 본회의에 부의하지 아니하기로 하고, 그 내용을 통합·조정한 위원회 대안을 제안하기로 함.라. 제298회 국회(임시회) 제3차 국방위원회(2011. 3. 9)에서 법률안심사소위원회의 심사결과를 받아들여 위원회 대안을 제안하기로 의결함.■ 대안의  「군인연금법」 제23조제1항에 대한 헌법불합치 판결(2010. 6. 24. 2008헌바128 전원재판부)의 결정사항을 반영하여, ‘퇴직 전’의 질병 또는 부상으로 폐질상태가 확정된 사람에게만 지급되는 상이연금을 퇴직이후에 폐질상태가 확정된 군인에 대해서도 지급할 수 있도록 하여 불합리한 차별을 해소하고, 법률 표준화 원칙에 따라 법문표현의 ‘여자’를 ‘여성’으로 바꾸려는 것임.■ 대안의  가. ‘여자군인’ 표현을 ‘여성군인’으로 바꿈(안 제16조제11항제2호의2).나. 군인이 퇴직 후에 공무상 질병 또는 부상으로 인하여 폐질상태로 된 경우에도 상이연금 지급대상자에 포함시키도록 하며, 「군인연금법」 제19조제2항에 따라 기존에 수령한 퇴직일시금, 퇴역연금일시금, 퇴역연금공제일시금(연금인 급여는 반납하지 아니한다)을 반납조치 하도록 함(안 제23조제1항, 안 제24조제6항 및 제7항).  ",국방위원회,[],위원장,위원장,,0
