,의안번호,의안명,제안일자,제안자구분,의결일자,의결결과,제안회기,제안이유,소관위원회,제안자,발의자,제안정당,성별,여성의원 수
371,1809143,한부모가족지원법 일부개정법률안,2010-08-20,의원,2011-03-11,대안반영폐기,제18대 (2008~2012) 제293회,"    및  한부모가족의 복지 증진을 위해 도입된 한부모가족지원법은 소득이 낮은 한부모가족에게 생계비, 아동교육지원비, 직업훈련비 및 훈련기간 중 생계비, 아동양육비, 그 밖에 대통령령으로 정하는 비용을 지급할 수 있도록 하고 있음. 특히 5세 이하의 아동을 양육하는 저소득층 미혼모·미혼부의 경우에는 예산의 범위에서 아동양육비를 추가지원 할 수 있도록 함.그러나 정부는 그 동안 예산 부족을 이유로 위에 열거된 복지급여 중 아동교육지원비와 아동양육비만을 지원해 한부모가족에 대한 충분한 지원이 이뤄지지 않고 있는 실정임.한국보건사회연구원에 따르면, 18세 미만의 자녀를 둔 한부모가족의 79.8%는 양부모가족이 얻는 수입의 절반밖에 되지 않는 182만7490원 이하의 수입을 얻고 있어 경제적 어려움을 겪고 있는 것으로 나타남.또한 입양 대신 아동의 직접 양육을 결정한 미혼모에게도 가장 필요한 도움이 경제적 지원인 것으로 여성가족부 조사결과 나타났음. 입양을 선택한 미혼모 중 37.7%는 경제적 지원이 이루어진다면 아이를 양육할 의사가 있다고 밝힌 것으로 조사됨.이에 본 개정안에서는 현행 재량적인 복지급여 실시를 의무화하여 그 동안 지급되지 않았던 한부모가족에 대한 생계비의 지급이 안정적으로 이루어질 수 있도록 하고,미혼모 · 미혼부에 대한 추가 아동양육비의 지급 역시 의무화하여 경제적 어려움으로 인해 입양을 선택할 수밖에 없었던 미혼모 · 미혼부와 그 자녀들이 우리 사회의 건강한 구성원으로 자리 잡을 수 있도록 지원하고자 함.다만 제12조제1항의3호에 해당하는 직업훈련비 및 훈련기간 중 생계비의 경우 제12조제1항1호의 생계비와 중첩되고, 이에 대한 신청자가 전체 복지급여 신청자의 0.2%로 미미한 만큼, 지급을 의무화하지 않고 제12조제3항을 신설하여 예산상황을 고려하여 재량적으로 지급할 수 있도록 함(안 제12조).  ",여성가족위원회,"['이성남', '강성종', '김재윤', '박선숙', '박영선', '백재현', '송민순', '양승조', '이낙연', '조영택', '최문순', '최영희', '홍재형']",이성남,민주통합당,여성,4
372,1809131,아동·청소년의 성보호에 관한 법률 일부개정법률안,2010-08-18,의원,2011-08-23,대안반영폐기,제18대 (2008~2012) 제293회," "" 최근 잇달아 발생하고 있는 아동·청소년 대상 성폭행 사건을 계기로 성폭력 범죄의 법정형 상향과 공소시효 연장, 성폭력범에 대한 위치추적 전자장치(전자발찌) 부착, 신상정보의 공개 등 대응책이 마련되었으나, 아동·청소년 대상 성폭력 범죄는 현재에도 끊임없이 발생하는 등 우리 사회의 형사사법체계는 국민의 생명과 안전을 보호하는 데 부족함을 드러내고 있음.아동·청소년 대상 성폭력 범죄는 자라나는 새싹들의 ‘영혼을 파괴하는 범죄 로서 피해자와 가족들에게 평생 동안 고통을 안겨주는 점에서 흉포한 성폭력 범죄자들로부터 우리 아이들을 보호하기 위한 형사사법체계를 세우는 일은 헌법 제10조에서 규정하는 국가의 기본권 보호의무가 요구하는 바에 따라 국민의 대표기관인 국회가 해결하여야 할 할 절실한 과제임. 민주화 이후 우리나라 형사사법체계는 범죄자의 인권보장에 치중하여 「사회보호법」을 폐지하는 등 혁명적으로 변화하여 왔지만, 아동·청소년 대상 성폭력 범죄 경력자 등 전과자에 대한 관리가 미흡하여 사실상 이들의 재범을 막을 효과적인 방법이 없는 실정임.특히 아동·청소년 대상 성폭력 범죄는 특성상 재범율이 50% 이상으로 매우 높다는 것이 여러 연구를 통하여 밝혀지고 있고, 실제로도 사회적으로 문제가 되었던 2008년 일산 초등학생 납치미수 사건, 2009년 조두순 사건, 2010년 김수철 사건 등 대다수의 아동·청소년 대상 성폭력 범죄가 과거 아동·청소년 대상 성폭력 전과가 있는 사람들이 저지른 것이 밝혀지면서 아동·청소년 대상 성폭력범의 형 집행 이후에도 사회를 방위하고, 범죄자를 재사회화하기 위한 보호관찰 제도를 도입할 필요성이 대두되고 있음.그러나 현행 형사법 체계에 따르면 보호관찰 제도는 주로 집행유예, 가석방의 조건으로 활용될 수밖에 없어서, 재범의 위험성이 아무리 높은 자라 하더라도 형기만료로 석방되면 더 이상 국가가 강제적으로 그에게 개입하여 재범의 위험성을 방지할 수 있는 방법이 없음. 범죄가 중대하여 집행유예를 받을 수 없는 흉포한 범죄를 저지르고, 형 집행 중에도 행형(行刑) 성적이 좋지 않거나 재범의 위험성도 높아서 가석방도 받을 수 없었던 범죄경력자가 형기만료로 출소한 경우, 재범의 위험성은 명백함에도 현행 형사법 체계는 이에 대한 적절한 사회 방위 및 범죄자 재사회화 기능을 할 수 없는 것임. 특히, 최근 미국, 독일, 스위스 등 다른 나라에서도 아동·청소년에 대한 끔직한 성폭력 살인 사건을 계기로 성폭력 범죄자 등 위험한 범죄경력자들의 형기 종료 후 보안처분을 강화하고 있는 추세를 감안하면, 아동·청소년 대상 성폭력범의 형기 종료 후라도 적절한 보호관찰을 하는 것이 세계적 추세에도 부합한다고 할 것임. 가. 아동·청소년 대상 성범죄 판결 집행 종료 후 보호관찰제 도입아동·청소년 대상 성범죄를 범하여 금고(禁錮) 이상의 실형(實刑)을 선고받은 사람은 그 형의 집행이 종료한 때부터 「보호관찰 등에 관한 법률」에 따른 보호관찰을 받도록 함(안 제48조제1항).나. 보호관찰 기간보호관찰 대상자가 집행유예자 또는 가석방 대상자보다 재범의 위험성이 높은 경우인 점을 고려하여 보호관찰의 기간은 ‘2년 이상 5년 이하의 범위에서 법원이 정하는 기간’으로 함. 다만, 법원이 부과하는 준수사항을 위반하는 경우는 재범의 위험성이 뚜렷한 경우이므로 보호관찰소의 장의 신청에 따른 검사의 보호관찰 연장 청구에 따라 법원이 5년을 초과하는 보호관찰을 명할 수 있도록 함(안 제48조제2항).다. 보호관찰 대상자의 준수사항법원은 판결을 선고할 때 범죄의 내용과 종류 및 보호관찰 대상자의 특성 등을 고려하여 보호관찰 대상자가 보호관찰 기간 동안 지켜야 할 준수사항을 따로 부과할 수 있고, 보호관찰 기간 중 준수사항을 위반하는 등 재범의 위험성이 증대한 경우 법원은 보호관찰소의 장의 신청에 따른 검사의 보호관찰 연장 청구에 따라 준수사항의 전부 또는 일부를 추가하거나 변경할 수 있도록 함(안 제49조).라. 보호관찰 대상자의 신고의무보호관찰 대상자는 출소 전과 출소 후 10일 이내에 거주지, 직업 등 보호관찰을 위하여 필요한 사항으로서 대통령령이 정하는 사항을 보호관찰소의 장에게 신고하도록 함(안 제50조).마. 보호관찰의 종료원칙적으로 법원이 정한 보호관찰 기간이 기간의 연장 없이 끝나면 보호관찰이 끝나도록 하되, 보호관찰 심사위원회가 보호관찰 대상자의 관찰 성적이 양호하여 재범의 위험성이 없다고 판단하는 경우 보호관찰 기간이 끝나기 전이라도 보호관찰의 종료를 결정할 수 있도록 함(안 제51조).바. 준수사항을 위반하는 경우의 벌칙집행유예 또는 가석방의 조건이 되는 보호관찰과 달리 형 집행 종료 후 부과되는 보호관찰의 경우 준수사항을 담보할 별도의 수단이 필요하므로 보호관찰 대상자가 보호관찰 기간 중에 정당한 이유 없이 준수사항을 위반하는 경우 형사처벌을 받도록 함(안 제53조)"" ",여성가족위원회,"['김상희', '강기정', '강성종', '김재윤', '김춘진', '문학진', '안민석', '이미경', '이용섭', '장세환', '전혜숙']",김상희,민주통합당,여성,3
373,1809125,전기통신사업법 일부개정법률안,2010-08-18,의원,2011-04-29,대안반영폐기,제18대 (2008~2012) 제293회,"    및  우리나라의 문화콘텐츠산업은 2008년 기준 매출액이 58조 9,511억원에 이르고, 수출액도 전년 대비 20.6% 증가한 18억 8,441달러로 연평균 15.1%씩 크게 성장하는 미래 신성장동력 산업임.이러한 성장 추세를 조기에 구축할 수 있었던 것은 그동안 음원 및 영화를 중심으로 온라인상 불법복제물에 의한 침해에 대해 정부와 국회에서는 관련법과 제도를 개선하고, 관련업계에서는 불법음원근절운동과 굿다운로더 캠페인 등 적극적인 대국민 인식개선에 나선 결과임.그럼에도 불구하고 2009년 기준 문화콘텐츠의 온라인상 불법복제물에 의한 침해 규모는 약 1조 4,251억원에 달하고 있고, 최근까지도 웹하드, P2P 등 인터넷을 통한 자료공유를 전문으로 하는 온라인서비스제공업체가 계속 증가하면서 이중 일부 업체들이 저작물에 해당하는 콘텐츠를 불법적으로 유통하는 사례가 근절되지 못하고 있음.또, 불법 유통 콘텐츠 중 90%에 달하고 있는 음란물의 경우에는 웹하드가 불법적으로 재생산ㆍ유통되는 메인 통로로 자리잡으면서 건전한 온라인상 콘텐츠 유통 환경 정착에 큰 걸림돌이 되고 있는데, 지난 6월 발생한 초등생 납치 성폭행범의 경우에는 범행 전날 52편의 음란물을 웹하드에서 불법다운로드 받은 사실이 밝혀지는가 하면, 2007년 12월 발생한 안양 초등생 납치 성폭행 사건의 범인 컴퓨터에서도 700여편의 불법 유통된 음란물이 저장되어 있는 등 각종 성범죄를 부추기는 온상이 되고 있는 실정임.하지만 이들 웹하드업체들은 간단한 신고 절차만으로 사업이 가능할 뿐만 아니라 자본금 1억원 이하인 소규모 업체들은 신고절차마저 면제됨에 따라 정부의 단속에도 불구하고 유사한 웹사이트의 폐쇄와 개설을 반복하면서 단기간 내에 불법 콘텐츠 유통을 통하여 불법 수익을 올리고 있어 온라인상의 불법유통을 근본적으로 막을 수 있는 강력한 대책의 필요성이 제기되고 있음.이에 지난 2008년 인터넷상에서 상습적으로 불법복제물을 유포하는 사용자에 대해서 불법복제물의 삭제 및 운영 정지 또는 계정 삭제 명령 등을 규정한「저작권법」 및 「정보통신망법」 개정에 이은 세 번째 제도 개선책으로 부가통신사업을 경영하려는 자 중에서 「저작권법」에 따른 ‘특수한 유형의 온라인서비스제공자’는 문화부의 등록 절차를 거치도록 의무화하고, 이를 위반한 경우 벌칙을 부과하여 저작권 침해에 따른 피해를 방지함은 물론 음란물의 불법 유통 근절을 통한 건전한 유통환경을 개선함으로서 국가의 신성장동력으로서의 경쟁력 강화에 나서려는 것임(안 제22조제2항 및 제95조제3호의2 신설).  ",문화체육관광방송통신위원회,"['진성호', '강승규', '권영진', '김성동', '김성태', '남경필', '손숙미', '원희목', '유정현', '장제원', '허원제']",진성호,무소속,남성,1
374,1809103,가정폭력범죄의 처벌 등에 관한 특례법 일부개정법률안,2010-08-16,의원,2011-12-29,대안반영폐기,제18대 (2008~2012) 제293회,"  ■   및  가족구성원에 의한 성범죄가 가정폭력범죄로 규정되어 있지 않아, 피해자가 본 법은 물론 「가정폭력방지 및 피해자보호 등에 관한 법률」에 의한 보호와 지원을 받는데 어려움을 겪거나 배제되는 일이 발생하고 있어, 이를 개선하기 위해 가족 구성원에 의한 성범죄를 가정폭력범죄로 규정하려 하는 것임.(안 제2조제3호 마목 신설).  ",법제사법위원회,"['이정선', '김혜성', '손범규', '신상진', '안홍준', '유성엽', '이명수', '임동규', '정양석', '홍영표', '황우여']",이정선,새누리당,여성,2
375,1809100,비혼 자녀의 양육비 지급에 관한 법률안,2010-08-13,의원,2012-05-29,임기만료폐기,제18대 (2008~2012) 제293회,"  ■  현행 「민법」은 혼인 관계에 있지 않은 남녀 간에 자녀가 출생하면 인지에 의하여 친자 관계가 형성되고, 자녀를 직접 양육하지 않는 부 또는 모가 양육비 지급의무자가 되어 양육비를 지급하도록 하고 있음. 그러나 양육비 지급의무자가 이를 이행하지 아니하거나 양육비 지급의무자의 행방불명 또는 양육비 지급기간에 재산이나 소득이 없는 경우(현재 미혼모 아기 친부의 평균 연령은 23.98세, 교육수준은 고등학교 이하가 64.6%임) 양육비를 확보하기가 어려움.이러한 경우에 국가가 비혼 자녀의 복리를 위하여 양육비 지급의무자를 대신하여 양육비를 지급하고 이를 양육비 지급의무자에게 구상하도록 하여 비혼 자녀의 복리를 증진하고 양육비 지급이행 확보에 국가가 조력하는 제도를 마련하려는 것임. 가. 혼인 관계에 있지 않은 남녀 사이에서 태어난 자녀를 양육하지 않는 부모가 양육비를 지급할 의무를 이행하지 아니하는 경우에 국가로부터 양육비를 우선 지급받아 사용하게 함으로써 그 자녀가 경제적 어려움 없이 안정적으로 성장할 수 있도록 하는 것을 목적으로 함(안 제1조).나. 양육비 지급의무자가 양육비 지급채무를 이행하지 아니하는 경우 양육비 지급신청권자는 법무부장관에게 양육비를 대지급할 것을 신청할 수 있음(안 제3조).다. 법무부장관은 양육비 대지급의 신청을 받은 경우 양육비 지급의무자를 대신하여 양육비를 지급하도록 함(안 제4조).라. 양육비를 대지급한 경우에 법무부장관은 양육비 지급의무자에 대하여 구상권을 행사할 수 있음(안 제7조).  ",여성가족위원회,"['이낙연', '김춘진', '김충환', '박은수', '신낙균', '신학용', '유성엽', '임영호', '주승용', '현경병']",이낙연,민주통합당,남성,1
376,1809099,다문화가족지원법 일부개정법률안,2010-08-13,의원,2011-03-11,대안반영폐기,제18대 (2008~2012) 제293회,"    및  최근 농촌에서 국제결혼을 통한 다문화가족이 급격히 증가하면서 이에 관한 사회적 관심이 높아지고 있음. 실례로 2009년에 혼인하여 농어업에 종사하는 한국남자 5,640명 중 35.2퍼센트에 해당하는 1,987명이 외국여성과 결혼하였음.젊은 여성들의 농촌 기피현상으로 다문화가족은 고령화된 우리 농촌에 새로운 활력을 불어 넣는 중요한 역할을 수행하고 있으며, 앞으로 우리나라 농업 및 농촌을 이끌어 갈 주역으로 성장할 전망임. 그러나 농어촌 다문화가족의 78.8퍼센트가 6,000평 미만의 농지를 소유한 영세 농업인이기 때문에 결혼이민자는 의사소통의 제한과 문화적 차이뿐만 아니라 생활비의 부족 등으로 농어촌 생활에 적응하는 데에 많은 어려움을 겪고 있음.따라서 국가와 지방자치단체로 하여금 결혼이민자가 문화적 자산이나 음식문화 등을 활용하여 소득을 창출할 수 있도록 경제활동 지원방안을 제공하고, 전문농업인력으로 발전할 수 있도록 영농기술교육을 실시함으로써 다문화가족이 안정적으로 농어촌 생활에 적응할 수 있도록 하려는 것임(안 제9조의2 신설).  ",여성가족위원회,"['정희수', '권영진', '김혜성', '김효재', '유기준', '윤영', '이낙연', '이명수', '이정선', '이종혁', '임영호', '정양석', '정해걸', '홍영표']",정희수,새누리당,남성,2
377,1809098,여성발전기본법 일부개정법률안,2010-08-13,의원,2012-05-29,임기만료폐기,제18대 (2008~2012) 제293회,"   최근 국회의원 등 사회 지도층의 성희롱 발언은 우리 사회의 전반적인 성(性) 윤리인식에 심각한 문제가 있는 것을 나타나고 있으며, 잇따른 사회지도층의 성희롱 관련 문제는 공직에 대한 신뢰까지 저하시키고 있음.이 법에 따르면 국가기관등의 장과 사업주에 대하여는 성희롱 예방교육을 의무적으로 실시하고 그 결과를 공표하도록 규정하고 있으나, 국회의원 등 선출직공직에 대해서는 해당 규정이 없음. 또한 공공기관장이 성희롱 예방교육을 실시하더라도, 국회의원 등 선출직 공직자의 경우 교육 대상에서 제외되어 왔음.이에 국가기관은 물론 선출직 공직 당선인에게도 임기 시작 전에 성매매 예방교육을 받도록 그 대상을 확대함으로써 우리 사회의 성 윤리의식을 함양하고 성희롱 예방에 이바지하려는 것임. 여성가족부장관은 성희롱 방지조치에 대한 점검을 대통령령으로 정하는 바에 따라 실시하고, 모든 선출직공직의 당선인에 대하여는 임기개시일 10일 전까지 실시하도록 확대함(안 제17조의2제2항 단서 신설).  ",여성가족위원회,"['박선영', '권영길', '김성곤', '김영진', '김용구', '김정', '김춘진', '김혜성', '류근찬', '이상민', '정동영']",박선영,자유선진당,여성,3
378,1809093,장애인·노인·임산부등의편의증진보장에관한법률 일부개정법률안,2010-08-13,의원,2012-05-29,임기만료폐기,제18대 (2008~2012) 제293회,"    및  모유수유는 엄마와 아기의 사망률과 이환율을 감소시키는 가장 효과적인 건강증진행위로서 세계보건기구(WHO)와 국제연합아동기구(UNICEF)는 전세계적인 모유수유율의 감소에 대응하여 1980년대부터 모유수유 캠페인 등 모유수유증진정책을 각국 정부와 함께 추진해오고 있음.그러나 우리나라의 경우 2006년 기준 모유수유율(15개월 미만 모유수유율로 완전모유수유와 모유 이유식 포함)이 24.2퍼센트로서 경제협력개발기구(OECD) 가입국 중 가장 낮은 수치를 보이고 있음. 특히 현행법상 모유수유시설은 의무적으로 설치하는 것이 아니기 때문에 우리나라 전체 직장 내 모유수유시설의 설치율이 18.3퍼센트로서 그 중 중앙정부기관이나 지방자치단체 같은 공공기관도 78퍼센트에 그치고 있어, 여성의 사회활동이 증가함에도 불구하고 모유수유를 하기 위한 환경여건이 열악하여 수유부(授乳婦)들이 화장실 등에서 수유를 하거나 수유자체를 포기하고 있는 실정임.따라서 국가 및 지방자치단체의 청사 등 대통령령으로 정하는 시설에는 임산부 등을 위한 휴게시설을 의무적으로 설치하도록 함으로써 모유수유를 촉진하고 영유아와 산모의 건강을 증진하려는 것임(안 제8조의2 신설).  ",보건복지위원회,"['강명순', '고승덕', '공성진', '권영진', '권택기', '김소남', '김태원', '김효재', '박상은', '배영식', '손숙미', '신상진', '심재철', '안형환', '유기준', '이명수', '이범래', '이애주', '이해봉', '임영호', '임해규', '정미경', '정해걸', '진수희']",강명순,새누리당,여성,6
379,1809092,모자보건법 일부개정법률안,2010-08-13,의원,2012-05-29,임기만료폐기,제18대 (2008~2012) 제293회,"    및  모유수유는 엄마와 아기의 사망률과 이환율을 감소시키는 가장 효과적인 건강증진행위로서 세계보건기구(WHO)와 국제연합아동기구(UNICEF)는 전세계적인 모유수유율의 감소에 대응하여 1980년대부터 모유수유 캠페인 등 모유수유증진정책을 각국 정부와 함께 추진해오고 있음.그러나 우리나라의 경우 2006년 기준 모유수유율(15개월 미만 모유수유율로 완전모유수유와 모유 이유식 포함)이 24.2퍼센트로서 경제협력개발기구(OECD) 가입국 중 가장 낮은 수치를 보이고 있음. 특히 현행법상 모유수유시설은 의무적으로 설치하는 것이 아니기 때문에 우리나라 전체 직장내 모유수유시설의 설치율이 18.3퍼센트로서 그 중 중앙정부기관이나 지방자치단체 같은 공공기관도 78퍼센트에 그치고 있어, 여성의 사회활동이 증가함에도 불구하고 모유수유를 하기 위한 환경여건이 열악하여 수유부(授乳婦)들이 화장실 등에서 수유를 하거나 수유자체를 포기하고 있는 실정임.따라서 국가 및 지방자치단체는 모유수유시설을 의무적으로 설치하도록 함으로써 공공기관이 솔선수범하여 모유수유를 촉진하고 영유아와 산모의 건강을 증진하려는 것임(안 제10조의3제3항).  ",보건복지위원회,"['강명순', '고승덕', '공성진', '권영진', '권택기', '김소남', '김태원', '김효재', '박상은', '배영식', '손숙미', '신상진', '심재철', '안형환', '유기준', '이명수', '이범래', '이애주', '이해봉', '임영호', '임해규', '정미경', '정옥임', '정해걸', '진수희']",강명순,새누리당,여성,7
380,1809090,성폭력방지 및 피해자보호 등에 관한 법률 일부개정법률안,2010-08-12,의원,2012-05-29,임기만료폐기,제18대 (2008~2012) 제293회,"   한국성폭력상담소의 2009년도 성폭력 상담 건수 1,338건 중 15.1퍼센트가 가정 내에서 발생한 성폭력에 해당하여 친족 내의 성폭력 사건의 비중이 적지 않은 것으로 나타나고 있음.또한 친족에 의한 성폭력 사건은 그 피해가 지속적ㆍ장기적이며, 사건이 외부로 노출되기 어려운 특징이 있으므로, 이러한 사건의 발생을 막고 피해자를 보호하기 위해는 형사사법 절차뿐만 아니라 피해자의 보호 및 지원 체계에서 제도의 보완이 필요함.따라서 친족내의 성폭력 사건 피해자의 경우 보호시설 입소 여부와 관계없이 피해자와 피해자를 보호하는 가족 등에게 주거와 생활비 등을 지원하는 등 피해자를 적극적으로 보호할 수 있는 환경을 조성하려는 것임. 가. 국가 또는 지방자치단체는 친족에 의한 피해자등의 보호를 위하여 주거 지원, 생계비 등 비용 지원, 직업훈련 및 직업알선 등의 지원을 하도록 하되, 보호시설에 입소하였거나 「국민기초생활 보장법」 등 다른 법령에 따라 보호를 받고 있는 경우에는 그 범위에서 이 법에 따른 지원을 하지 아니하도록 함(안 제7조의2 신설).  ",여성가족위원회,"['정범구', '김상희', '김세연', '김영록', '김우남', '김재윤', '김춘진', '노철래', '박영선', '박주선', '송민순', '오제세', '최규성']",정범구,민주통합당,남성,2
381,1809089,아동·청소년의 성보호에 관한 법률 일부개정법률안,2010-08-12,의원,2011-08-23,대안반영폐기,제18대 (2008~2012) 제293회,"   끊임없이 발생하는 아동·청소년대상 성범죄를 예방하기 위해서는 성범죄가 발생하지 않도록 사회환경을 정비하고, 사회구성원 모두가 아동·청소년을 보호·선도·교육하는 데에 최선을 다하여야 할 것임.현행법은 아동·청소년이 많이 이용하는 기관·시설 또는 단체에 근무하는 신고의무자에게는 아동·청소년대상 성범죄를 알게 된 경우 즉시 수사기관에 신고하도록 신고의무를 부과하고 이를 위반하는 경우 과태료를 부과할 수 있도록 사회적 책임을 규정하고 있으나, 일부 신고의무자 자신이 아동·청소년대상 성범죄를 일으키는 문제가 발생하고 있어 이에 관한 대책을 마련할 필요가 있음.- - 이에 신고의무자가 아동·청소년대상 성범죄를 범하는 경우에는 다른 사람보다 가중처벌하도록 함으로써 신고의무자에게 사회적 책임을 강화하고, 경각심을 높여 성범죄를 예방하려는 것임(안 제12조의2 신설).  ",여성가족위원회,"['정범구', '김상희', '김세연', '김영록', '김우남', '김재윤', '김춘진', '박영선', '박주선', '송민순', '최규성']",정범구,민주통합당,남성,2
