의안번호,의안명,제안일자,제안자구분,의결일자,의결결과,제안회기,제안이유,소관위원회,제안자
160512,  방문판매등에관한법률개정법률안(김부겸의원등 11인 외 21인),2000-12-08,의원,2001-04-18,철회,제16대 (2000~2004) 제215회,"['■ 제안이유현행 방문판매등에관한법률에서 통신판매의 일종으로 규율하고 있는 전자거래 관련 분야의 소비자 보호를 강화할 필요성이 증가하여, 동 법률 중 통신판매 관련 규정을 보완하여 ""전자거래및통신판매에관한법률""을 입법하게 됨에 따라, 현행 방문판매등에관한법률의 규정을 방문판매 및 다단계판매 관련 부분을 중심으로 개편하려는것임한편, 소비자 피해가 빈발하는 ""전화권유판매"" 및 ""계속공급""을 새로이 법 적용 대상으로 포함하고 다단계판매에 대하여는 소비자피해보상보험등의 가입을 의무화함으로써 국민생활과 밀접하고 소비자 피해가 다발하는 특수판매분야에서의 소비자 보호기능을 보완하고 시장경제질서 확립을 도모하려는 것임.■ 주요골자1. 법 적용대상 사업자의 범위에 ""전화권유판매자"" 및 ""계속공급업자""도 포함하여 소비자 권익 보호를 강화함(안 제2조).2. 판매원의 단계를 기준으로 구분되고 있는 방문판매 및 다단계판매의 범위를 판매방법 및 판매원 관리방법에따라 구체적으로 정할 수 있도록 하기 위한 근거를 마련하고, 세부사항은 하위규정에서 정하도록 위임(안제2조제2호 내지 제5호).3. 재화 또는 용역의 성질상 법적용이 곤란한 경우 등을 제외하고는 모두 이 법의 적용 대상인 ""재화등""으로포함함으로써 소비자 보호기능을 강화함(안 제3조).4. 현행 방문판매등에관한법률의 규정상 통신판매에 속하도록 되어 있는 ""전화권유판매""를 판매원의 적극적 접근성을 감안하여 방문판매에 준하도록 규정함(안 제4조 내지 제11조).5. 방문판매 전화권유판매 및 다단계판매에 있어서 조건 없는 청약철회의 기간을 14일로 통일하여 규정함(안제7조 및 제16조).6. 다단계판매원 모집시 다단계판매업체에 관한 중요정보를 공개하도록 함으로써 허위 과장광고에 속아 다단계판매원으로 가입하는 경우가 발생하지 않도록 함(안 제14조 및 제20조)7. 일정기간 계속해서 재화등을 공급하는 계약(계속공급계약)의 경우 일회성 판매와는 다른 특성이 있음을 감안하여, 이 법 적용 대상으로 포함(안 제27조 내지 제31조)8. 방문판매자, 전화권유판매자, 다단계판매자 및 계속공급업자의 표시 광고의 기준, 표준적 거래절차 및 기준약관 제정의 근거를 마련함(안 제32조 및 제33조)9. 소비자의 피해를 신속히 구제하기 위하여 비점포판매에 있어서 소비자 분쟁해결 및 피해구제를 담당할 전문기관의 지정 또는 설치 근거를 마련함(안 제35조)10. 판매업자 또는 판매원의 위법행위로 인하여 피해가 다발하는 다단계판매에 있어서 소비자의 피해를 신속하고 효율적으로 구제하기 위한 수단으로서 다단계판매업자의 소비자피해보상보험 등의 가입을 의무화함(안제36조 및 제37조)11. 방문판매업자, 전화권유판매업자, 다단계판매업자 및 계속공급업자 등으로 하여금 소비자 피해보상을 위한공제사업을 할 수 있도록 하고, 공정거래위원회의 인가를 받아 공제조합을 설립할 수 있도록 함(안 제38조)12. 각종 위법행위를 공정거래위원회에서 직접 조사 제재할 수 있도록 하기 위하여 직권조사 시정명령 과징금제도를 도입하고, 시 도지사의 처분에 대한 불복 절차를 공정거래위원회의 관할로 이관(안 제39조, 제44조내지 제46조)13. 방문판매업자등의 소비자 보호와 관련된 평가 인증 등의 업무를 수행하는 기관 및 단체(자율규제기관)에대하여는 공정거래위원회에 등록하도록 하고, 그 평가 및 인증에 관한 기준 또는 방법 등을 공시하도록 하는 등 자율규제의 공정화를 도모함(안 제41조)']",정무위원회,"['김부겸', '김민석', '김원길', '박주선', '엄호성', '이강두', '이성헌', '이종걸', '이훈평', '장영달', '조재환', '장영신', '장태완', '전갑길', '정장선', '정진석', '최영희', '최용규', '추미애', '한승수', '함승희']"
160510,  국민건강보험법중개정법률안(대안),2000-12-08,위원장,2000-12-08,원안가결,제16대 (2000~2004) 제215회,"['■ 제안경위1. 2000년 6월 29일 김정숙의원 등 29인이 발의하고 104인이 찬성한 국민건강보험법중개정법률안이 다음 날 우리 위원회에 회부되어 왔고, 2000년 11월 15일 윤여준의원 등 42인이 발의한 국민건강보험법중개정법률안도다음 날 우리 위원회에 회부되어 왔음.2. 2000년 11월 22일 김홍신의원의 소개로 제출된 국민건강보험법개정에관한청원이 다음 날 우리 위원회에 회부되어 왔고, 2000년 11월 28일 박인상의원의 소개로 제출된 국민건강보험법개정에관한청원도 다음 날 우리위원회에 회부되어 왔음.3. 우리 위원회에 회부된 이상 2건의 개정법률안과 2건의 청원을 2000년 12월 4일 제215회 국회(정기회) 제7차위원회에 상정하여 제안설명과 전문위원의 검토보고를 듣고 대체토론을 거쳐 법안심사소위원회에 회부하여심사토록 함.4. 2000년 12월 5일 제215회 국회(정기회) 제2차 법안심사소위원회에서는 이상 2건의 개정법률안과 2건의 청원에 대하여 정부관계관 등을 참석시킨 가운데 심도있는 심사를 거쳐 이를 통합·조정한 단일안을 마련하고,2000년 12월 5일 제215회 국회(정기회) 제8차 보건복지위원회에서는 소위원회에서 보고한 단일안을 위원회대안으로 제안하기로 하고, 2건의 개정법률안과 2건의 청원은 본회의에 부의하지 아니하기로 의결함.■ 제안이유현행 국민건강보험법은 직장가입자 규모를 상시 5인 이상 근로자를 사용하는 사업장으로 규정함으로써 5인 미만 사업장 근로자들은 동일한 임금근로자임에도 불구하고, 지역가입자로 편입되어 본인이 보험료를 전액 부담하고 있는 바, 이들을 직장가입자로 편입시켜 보험료 부담의 형평을 기하고 영세사업장에 고용된 근로자의 복지를 확대하고자 함.또한, 5인 미만 사업장 근로자들이 임금근로자임에도 불구하고 소득이 없는 가족구성원만 가입하도록 되어 있는 직장가입자 피부양자로 가입됨으로써 다른 임금 근로자의 보험료 부담을 가중시키고, 자영업자만 가입하도록 되어 있는 지역가입자로 가입됨으로써 건강보험의 재정부실을 심화시키고 있는 불합리한 점을 개선하여 보험재정의 안정화를 도모하고자 함.■ 주요골자1. 직장가입자는 모든 사업장에 고용된 근로자와 그 사용자 등으로 하되, 사업장의 특성, 고용형태 및 사업의종류 등을 고려하여 대통령령로 정하는 근로자 및 사용자 등은 제외하도록 하며, 이 경우에도 소속 사업장의 근로자 및 사용자는 대통령령이 정하는 방법과 절차에 따라 직장가입자가 될 수 있도록 함(안 제6조제2항 및 제4항).2. 5인 미만 사업장 가입자에 대한 형평성있는 보험료 부과를 위해 보수관련 자료가 없거나 불명확한 경우 등대통령령이 정하는 사유에 해당하는 경우에는 보건복지부장관이 정하여 고시하는 금액을 보수로 봄(안 제63조제3항).']",보건복지위원회,[]
160509,  국민연금법중개정법률안(대안),2000-12-08,위원장,2000-12-08,원안가결,제16대 (2000~2004) 제215회,"[""■ 제안경위1. 2000년 6월 16일 김명섭의원외 19인이 발의한 국민연금법중개정법률안, 동년 8월 28일 최영희의원외 19인이발의한 국민연금법중개정법률안, 동년 11월 23일 정부가 제출한 국민연금법중개정법률안이 2000년 6월17일, 동년 8월 29일, 동년 11월 24일 각각 우리 위원회에 회부되어 이를 각각 제213회국회(임시회) 제2차보건복지위원회('00.7.11) 및 제215회국회(정기회) 제7차 보건복지위원회('00.12.4)에 상정하여 제안설명과전문위원의 검토보고를 듣고 대체토론을 거친 후 법안심사소위원회에 회부하였음.2. 법안심사소위원회에서는 3건의 법률안에 대하여 정부관계관 등을 참석시킨 가운데 2차에 걸쳐 심사한 결과3건의 법률안에 대하여 단일안을 마련하여 이를 제215회국회(정기회) 제8차 보건복지위원회('00.12.5)에서위원회 대안으로 제안하기로 하고 3건의 법률안은 본회의에 부의하지 아니하기로 가결하였음.■ 제안이유국민연금법중개정법률안 3건을 통합하여 우리위원회의 단일안으로 마련한 이유는 경기변동에 따른 국민연금 급여액의 급격한 변동을 완화하고 연금재정의 장기적인 안정을 도모하기 위하여 기본연금액 산정방식을 일부 조정하고, 변화하는 금융시장환경에 적합한 기금운용 방안을 마련하는 등 현행 제도의 운영상 나타난 일부 미비점을 개선·보완하려는 것임.■ 주요골자1. 종전에는 23세 미만의 무소득자를 국민연금의 지역가입 대상에서 제외하였으나 앞으로는 납부예외자로 관리하던 27세 미만의 무소득자를 제외하도록 하여 납부예외 신청에 따른 가입자의 불편을 해소하고 국민연금운영의 효율을 도모함(안 제10조제3호).2. 국민연금에 임의계속가입할 수 있는 가입자의 상한연령(65세)을 폐지하여 반환일시금 대신 연금을 수급할수 있는 기회를 확대함(안 제13조).3. 기본연금액 산정기준을 종전의 연금수급전년도의 평균소득월액에서 소비자물가상승률에 의하여 현재 가치화한 연금수급직 전 3년간의 평균소득월액의 평균액으로 하여 경기변동에 따른 연금액의 급격한 변동을 완화하고 연금재정의 장기적 안정을 기하도록 함(안 제47조제1항제1호).4. 가급연금액 계산대상을 종전에는 수급권자가 연금수급권 취득당시 그에 의하여 생계를 유지하고 있던 자로하였으나, 앞으로는 그외에 수급권자가 연금수급권을 취득한 이후 그에 의하여 생계를 유지하고 있는 자도포함시킴으로써 가급연금을 지급받을 수 있는 자의 범위를 확대함(안 제48조).5. 연금을 매달 말일에 그 달의 금액을 지급하도록 함(안 제50조제2항).6. 연금보험료 납부고지서의 송달지연 등의 사유에 해당되는 경우 보험료 납부기한을 1월 이내에서 연장할 수있도록 함으로써 보험료 납부편의를 증진함(안 제76조제5항 및 제6항 신설).7. 국민연금기금의 증가에 따른 위험분산을 위하여 외부위탁투자, 해외투자 등 투자대상을 다변화하고, 채권시가평가제의 도입 등 변화된 금융시장 환경에 적합하도록 기금운용기준을 조정함(안 제83조).8. 사업장의 사용자가 근로자의 임금에서 기여금을 공제함에 있어 기여금을 초과하는 금액을 공제하는 경우처벌할 수 있는 규정을 신설하여 사업장 근로자의 권리를 보호함(안 제104조제2항제4호 신설).""]",보건복지위원회,[]
160508,  제8회부산아시아·태평양장애인경기대회지원법안(대안),2000-12-08,위원장,2000-12-08,원안가결,제16대 (2000~2004) 제215회,"[""■ 제안경위1. 2000년 6월 15일 유재건, 천정배, 오세훈, 이용삼 의원이 발의(대표발의 : 유재건, 찬성자 16인)한 제8회부산아시아·태평양장애인경기대회지원법안이 2000년 6월 16일 우리 위원회에 회부되어 왔음.2. 우리 위원회에 회부된 제8회부산아시아·태평양장애인경기대회지원법안에 대해서는 제215회 국회(정기회)제7차 보건복지위원회('00.12.4)에서 제안설명과 전문위원의 검토보고를 듣고 대체토론을 거쳐 법안심사소위원회에 회부하여 심사·보고토록 하였음.3. 법안심사소위원회에서는 동 법률안에 대하여 정부 관계관 등을 참석시킨 가운데 진지하게 심사한 결과 이를제215회 국회(정기회) 제8차 보건복지위원회('00.12.5)에서 위원회 대안으로 제안하기로 하고 동 법률안은본회의에 부의하지 아니하기로 의결하였음.■ 제안이유제8회부산아시아·태평양장애인경기대회지원법안의 내용중 관계부처간 협의절차의 미비 및 관계법과의 상충문제로 인하여 상당내용이 삭제 또는 수정되는 관계로 이에 대한 대안을 마련하였음. 그리하여 2002년에 개최하는 제8회부산아시아·태평양장애인경기대회의 준비와 운영을 위하여 설립된 부산아·태장애인경기대회조직위원회와 동대회 관련사업을 지원하여 대회를 성공적으로 개최함으로써 장애인체육을 활성화하고 국위선양과 장애인복지발전을 도모하려는 것임.■ 주요골자1. 조직위원회는 국가 또는 지방자치단체, 정부투자기관, 법인, 단체등으로부터 필요한 편의와 행정적·재정적인 협조 및 지원을 받을 수 있도록 함(안 제2조).2. 조직위원회는 보건복지부장관의 승인을 얻어 자금을 차입하거나 물자를 도입할 수 있음(안 제4조).3. 조직위원회는 기념주화의 발행을 한국은행에 요청하고, 발행된 주화를 독점적으로 인수할 수 있음(안 제6조).4. 조직위원회는 옥외광고물관리법의 규정에 따른 옥외광고를 통한 수익사업을 할 수 있도록 함(안 제7조).5. 조직위원회는 행정기관에 대하여 공무원을, 부산아·태장애인경기대회에 관련된 법인 또는 단체에 대하여임원 및 직원의 파견을 요청할 수 있도록 함(안 제9조).6. 부산광역시장은 부산아·태장애인경기대회의 성공적인 개최를 위하여 경기대회 관련시설의 설치 및 그 밖의대회관련분야에 관한 지원을 위하여 기본계획을 수립·시행함(안 제14조).""]",보건복지위원회,[]
160507,  병역법중개정법률안(대안),2000-12-08,위원장,2000-12-08,원안가결,제16대 (2000~2004) 제215회,"['■ 제안경위1. 2000년도 7월 24일 조웅규의원이 대표발의한 병역법중개정법률안, 동년 10월 21일 정부로부터 제출된 병역법중개정법률안, 동년 11월 17일 강삼재의원이 대표발의한 병역법중개정법률안이 각각 2000년 7월 24일, 동년 10월 23일, 동년 11월 20일 우리 위원회에 회부되어 이를 제215회 국회(정기회) 제8차 국방위원회(2000.12. 4)에 상정하여 제안설명과 전문위원의 검토보고를 듣고 대체토론을 거친 후 법률안심사소위원회에 회부하였음.2. 법률안심사소위원회에서는 3건의 법률안에 대하여 진지하게 심사한 결과 원안을 모두 수용하고 법체계상 일부 미비점을 보완한 단일안을 마련하였으며 제215회 국회(정기회) 제9차 국방위원회(2000. 12. 5)에서 이를위원회 대안으로 제안하기로 하고 3건의 법률안은 본회의에 부의하지 아니하기로 의결하였음.■ 제안이유병역비리를 근절하기 위하여 부정한 방법으로 병역을 감면받은 사람에 대한 입영의무 등 부과연령을 연장하고,공익근무요원 소집대상자중 잉여인원에 대한 제2국민역 편입제도를 신설하여 국민편익을 도모하며, 국제협력분야의 공익근무요원제도를 계속 존속시켜 국익에 기여하고, 의무장교의 편입대상에 한의사도 포함시켜 기회균등을 보장하며, 그밖에 현행 제도의 운영상 나타난 일부 미비점을 개선·보완하려는 것임.■ 주요골자1. 공익근무요원이 복무할 분야에 국제협력분야를 추가하고 그 업무는 개발도상국의 경제·사회·문화발전등의지원업무로 하며, 동 업무에 복무하여야 할 공익근무요원은 보충역 또는 현역입영대상자중에서 國際協力要員에관한法律에 의하여 외교통상부장관의 추천을 받은 자로 함(안 제2조제1항제9호 및 안 제26조 신설).2. 국가기관·지방자치단체등에서 경비·행정업무등의 지원업무를 하는 공익근무요원의 배정등에 관한 병무청장의 권한을 지방병무청장에게 이양함(안 제27조).3. 공중보건의사·징병전담의사 또는 국제협력의사가 국가공무원법에 의한 공무원임용 결격사유에 해당되는 경우에는 그 편입을 취소하도록 함(안 제35조제1항제6호 신설).4. 한의사도 의사·치과의사와 동등하게 한의사 면허의 취득만으로도 의무장교의 병적에 편입할 수 있도록 함(안 제58조제1항제1호).5. 학력이 낮아 보충역 또는 제2국민역 처분을 받은 사람이 학력이 높아져 현역 또는 공익근무요원 복무를 원하는 경우에는 병역처분을 변경할 수 있도록 함(안 제65조제6항).6. 지방병무청장은 공익근무요원 소집대상자가 공익근무요원 배정인원보다 많은 경우에는 소집대상자의 학력·보충역편입연도 등을 감안하여 그 중 일부를 제2국민역에 편입할 수 있도록 함(안 제65조제7항 신설).7. 부정한 방법으로 병역이 면제되거나 제2국민역 또는 보충역 처분을 받은 사람에 대한 입영의무 등 부과연령을 종전 30세까지에서 35세까지로 연장함(안 제71조제1항제10호 신설).']",국방위원회,[]
160491,  군인연금법중개정법률안,2000-12-07,정부,2000-12-23,수정가결,제16대 (2000~2004) 제215회,"['■ 제안이유연금제도의 성숙에 따른 연금수급자의 증가와 연금수급기간의 장기화 등으로 인하여 군인연금재정이 악화되고 있으므로 일부 불합리한 연금제도를 개선하면서 정부와 군인의 비용부담률을 상향조정하여 장기적으로 연금재정의 안정을 도모하고, 공무원연금법의 개정에 따라 관련사항을 정비하는 한편, 그밖에 현행 제도의 운영상나타난 일부 미비점을 개선·보완하려는 것임.■ 주요골자1. 퇴역연금 및 유족연금의 산정기준을 퇴직직전의 보수월액에서 최종 3년간 평균보수월액으로 변경함(안 제3조제1항제2호 및 제18조제2항).2. 군인의 임용전 군의무복무기간에 대하여 당연히 기여금을 납부하고 복무기간에 산입하게 하던 것을 본인이원하는 바에 따라 산입하도록 함(안 제16조제5항).3. 연금액의 조정을 재직자 보수기준으로 하던 것을 전국소비자물가변동률을 기준으로 하도록 조정하고, 군인보수변동률·전국소비자물가변동률 등을 고려하여 5년마다 조정할 수 있도록 함(안 제17조의2 신설).4. 연금수급자가 공공의 직에 재취업시에만 연금을 감액지급하던 것을 이자소득·배당소득·부동산임대소득 그밖에 대통령령이 정하는 소득 외의 소득이 있는 때에도 연금의 일부를 감액지급하되, 소득파악 등을 고려하여 5년의 범위내에서 대통령령이 정하는 날부터 시행하도록 함(안 제21조의2 및 부칙 제1조 단서).5. 재직기간이 5년 미만인 자의 퇴직일시금은 보수월액에 재직연수를 곱한 금액으로 하던 것을 보수월액에 재직연수를 곱한 금액의 100분의 120에 상당하는 금액으로 인상함(안 제22조제3항).6. 군인이 공무상 질병·부상으로 인하여 폐질상태 6급 및 7급으로 전역할 때 지급하는 상이연금의 지급률을상향조정함으로써 공무원연금 등 다른 공적 연금과의 형평을 도모하도록 함(안 제23조제1항제6호 및제7호).7. 공무상요양비의 지급범위를 확대하여 화상 등 특수한 치료가 필요한 경우에도 요양비를 지급할 수 있도록함(안 제30조의8).8. 기여금 및 국가부담금의 금액을 보수월액 및 보수예산의 1,000분의 75의 범위안에서 정하던 것을 각각1,000분의 90의 범위안에서 정할 수 있도록 상향조정함으로써 연금재정의 건전화를 도모하도록 함(안 제38조제1항 및 제39조제1항).9. 급여에 소요되는 비용을 기여금 및 부담금 등으로 충당할 수 없는 경우에는 그 부족한 금액을 국가에서 보전하도록 함(안 제39조의2).■ 위원회 수정사항□ 수정이유공무원연금법중개정법률안이 행정자치위원회에서 위원회대안으로 의결됨에 따라 같은 공적연금인 군인연금도 공무원연금과의 형평성을 유지하기 위하여 군인연금법중개정법률안중 동일 내용에 대하여는 공무원연금법중개정법률안과 같이 수정코자 하는 것임.□ 수정주요골자1. 국가 및 군인의 법정부담률을 개정안의 9%에서 8.7%로 수정함.2. 국가에서 군인연금재정의 안정을 위하여 책임준비금을 적립하도록 하는 근거규정의 신설3. 이 법 시행이후 최초의 연금액의 조정은 이 법 시행후 3년이 경과한 때 실시하도록 함.4. 퇴역후 고소득자에 대하여 연금액의 2분의 1의 범위내에서 지급을 정지할 수 있도록 함.']",국방위원회,[]
160490,  국회법중개정법률안(이연숙의원등 20인),2000-12-07,의원,2002-02-28,대안반영폐기,제16대 (2000~2004) 제215회,"['■ 제안이유여성의 복지와 권익향상을 위하여 1994년 상설의 여성특별위원회를 설치하였으나, 상임위원회와는 달리 소관이 없고 법률안 제안권 및 의결권, 예산결산 예비심사권, 국정감사권이 부여되지 않아 활동에 많은 제약이 있어 왔음.정부조직법의 개정에 의하여 행정부 내에 여성부가 신설될 경우 국회에 이를 소관으로 하는 상임위원회가 필요하므로 현행 여성특별위원회를 폐지하고 위원은 겸임하는 상임위원회로 여성위원회를 설치하여 이러한 문제점을 해결하려는 것임.■ 주요내용가. 현행 여성특별위원회를 폐지함(법 제46조의2 삭제).나. 여성위원회를 신설하고 그 소관은 여성부소관사항 및 ？여성발전기본법？ 제8조에 규정된 여성정책기본계획의 수립？시행업무에 관한 사항으로 함.(안 제37조제1항제17호 신설)']",정치개혁특별위원회,"['이연숙', '강숙자', '강신성일', '김경천', '김방림', '김정숙', '김희선', '박근혜', '손희정', '심재철', '유성근', '이미경', '이종걸', '전재희', '정몽준', '정문화', '정병국', '최영희', '한명숙', '허운나']"
160489,  하수도법중개정법률안(한명숙의원등 21인),2000-12-07,의원,2001-02-28,대안반영폐기,제16대 (2000~2004) 제215회,"['■ 제안이유1999년말 현재 전국의 하수관거 총연장은 64,741km로 하수관거 보급율은 62.7%임. 이는 외국의 하수도 보급율에 비해 낮은 수준으로 그나마 설치되어 있는 하수관거가 지극히 불량하여 하수의 차집이 제대로 되지 않고 있어 안정적인 하수처리에 어려움을 겪고 있음.우리나라의 하수관거는 이음부 불량이나 하수관의 파손·침하, 타관통과 등으로 불량한 곳이 17.6m 당 1곳으로 160만개소나 불량한 곳으로 나타나고 있고 이런 불량관거의 조사에만 1995년부터 ’99년말까지 무려 1,210억원의 국고가 투입되는 등 예산 낭비가 심각한 수준임.이러한 하수관거의 불량원인은 사용 중에 일어나는 결함이라기 보다는 시공단계에서의 불량이 더 많은 것으로 나타나고 있는데 현재 공공하수도관리청이 하수관거를 설치하고 있어 대규모 국고지원사업임에도 불구하고 소규모 분할발주로 시공업체가 난립하여 저가수주가 성행하고 있을 뿐만아니라 공사 시공자가 영세하고 감리제도가 미흡하여 하수관거가 시공 당시부터 불량하게 설치되고 있음.따라서 안정적인 하수처리를 위해 하수처리장의 설치와 함께 하수관거 등도 전문기관에서 공사할 수 있도록 개선하려는 것임.■ 주요내용이미 전문기관에 위탁하고 있는 하수종말처리시설 설치업무 외에 하수관거 설치업무 등도 전문기관에서 설치할 수 있도록 함(안 제8조).']",환경노동위원회,"['한명숙', '강현욱', '곽치영', '권철현', '김근태', '김문수', '김영환', '김원길', '김홍신', '박용호', '박인상', '신기남', '오세훈', '이미경', '이부영', '이재정', '이호웅', '전재희', '천정배', '추미애', '홍사덕']"
