의안번호,의안명,제안일자,제안자구분,의결일자,의결결과,제안회기,제안이유,소관위원회,제안자
160373,  범죄수익은닉의규제및처벌등에관한법률안,2000-11-23,정부,2001-09-03,수정가결,제16대 (2000~2004) 제215회,"[""■ 제안이유조직범죄·해외재산도피범죄 등 특정범죄에 의하여 발생한 범죄수익을 합법적인 수입으로 가장하거나 이를 은닉하는 행위(자금세탁행위)를 규제하는 한편, 당해 범죄수익의 몰수·추징에 관하여 형법 등에 대한 특례를 규정함으로써 반사회적인 범죄행위를 사전에 예방하고 범죄를 조장하는 경제적 요인을 근원적으로 제거하려는 것임.■ 주요골자1. 조직범죄, 공무원 뇌물범죄, 밀수범죄, 해외재산도피범죄 등 특정범죄로부터 얻은 범죄수익의 취득 또는 처분 사실을 가장하거나 범죄수익을 은닉한 자는 5년 이하의 징역 또는 3천만원 이하의 벌금에 처하도록 함(안 제3조).2. 정을 알면서 범죄수익을 수수한 자는 3년 이하의 징역 또는 2천만원 이하의 벌금에 처하되, 법령상의 의무이행으로서 제공된 자금을 수수하는 경우 등에는 예외를 인정함(안 제4조).3. 금융기관등의 종사자는 금융거래와 관련하여 수수한 재산이 범죄수익이라는 사실을 알게 된 때 또는 금융거래의 상대방이 범죄수익을 은닉하고 있다는 사실 등을 알게 된 때에는 지체없이 그 사실을 수사기관에 신고하도록 의무화하고, 이를 위반한 자는 2년 이하의 징역 또는 1천만원 이하의 벌금에 처하도록 함(안 제5조).4. 특정범죄에서 발생한 범죄수익 등은 몰수할 수 있도록 하고, 이를 몰수할 수 없거나 재산의 성질상 몰수함이 상당하지 아니한 경우에는 몰수할 가액을 추징할 수 있도록 함(안 제8조 내지 제10조).■ 위원회 수정사항□ 수정이유정치자금의 투명성 보장을 위하여 이 법의 규율대상이 되는 전제범죄의 종류에 정치자금에관한법률 위반행위를추가하고 조세포탈죄의 범위를 부정환급을 받은 경우로만 한정하도록 하려는 것임.□ 수정주요골자1. 범죄수익 은닉행위의 범위를 제한하여 특정범죄를 조장하거나 또는 적법하게 취득한 재산으로 가장할 목적으로 범죄수익을 은닉하는 경우에만 이를 은닉행위로 보도록 규정함(안 제1조 및 제3조).2. 정치자금에관한법률위반죄를 이 법의 규율대상이 되는 전제범죄에 추가함(안 별표 제15호).3. 전제범죄중 특정경제범죄가중처벌등에관한법률 제8조에 의한 2억원 이상의 조세포탈죄의 범위를 범죄수익이특정될 수 있는 '부정환급'의 경우만으로 한정하도록 함(안 별표 제20호).""]",법제사법위원회,[]
160372,  도로교통법중개정법률안(이연숙의원등 26인 외 9인),2000-11-23,의원,2000-12-22,대안반영폐기,제16대 (2000~2004) 제215회,['■ 제안이유 및 주요내용최근 어린이와 청소년들 사이에 급속히 보급되고 있는 킥보드 등은 방향전환이 쉽지 않고 제동에도 문제가 있어 안전사고의 위험성이 크므로 어린이의 보호자는 어린이가 도로에서 킥보드 등을 탈 때에는 헬멧을 착용하도록 하여야 하고 이의 위반시 그에게 벌칙을 부과하도록 함.'],행정자치위원회,"['이연숙', '강숙자', '고진부', '권기술', '김경천', '김근태', '김기배', '김영구', '김용학', '김원웅', '김정숙', '김호일', '박세환', '박승국', '손태인', '안상수', '유재건', '윤경식', '이인기', '이정일', '이주영', '전재희', '정병국', '정인봉', '한승수', '홍사덕']"
160371,  대도시권광역교통관리에관한특별법중개정법률안(이재창의원등 23인),2000-11-23,의원,2000-12-20,대안반영폐기,제16대 (2000~2004) 제215회,"['■ 제안이유현행 대규모 개발사업에 따른 광역교통개선대책의 수립을 의무화하고 택지개발사업 또는 대지조성사업의 시행자로부터 징수되는 부담금을 광역교통시설특별회계에 귀속하도록 함으로써 대도시권내의 광역교통문제를 해결하고자 하는 것임.■ 주요내용가. 대규모 개발사업시 광역교통개선대책을 의무적으로 수립토록 하고, 건설교통부 장관은 관계 시？도지사와 협의하도록 함(안 제7조).나. 징수된 부담금의 100분의 25는 교통시설특별회계중 광역교통시설계정에 귀속하고, 나머지 100분의 75는 시？도의 지방광역교통시설특별회계에 귀속하여 광역교통문제의 원활한 해소를 도모함(안 제11조의2제1항).다. 광역교통에 영향을 미치는 지방도 및 시？군？구도 등에 대하여 시？도지사가 필요하다고 인정하는 경우 부담금을 사용할 수 있도록 함(안 제11조의2제2항제3호).']",건설교통위원회,"['이재창', '고흥길', '권기술', '김기배', '김문수', '김용갑', '김원길', '김태호', '남경필', '목요상', '박세환', '손학규', '신현태', '안경률', '안택수', '오장섭', '이근진', '이성헌', '이원창', '이해봉', '정병국', '정장선', '조정무']"
160369,  사회복지사업법중개정법률안(김홍신의원등 21인),2000-11-22,의원,2003-06-30,대안반영폐기,제16대 (2000~2004) 제215회,"['■ 제안이유 및 주요골자97년 금융위기 이래로 노숙인의 인권보장이 우리 사회에 큰 문제가 되고 있음에도 불구하고 법률이 이에 관한사항을 규율하고 있지 못한 실정이어서 노숙인 대책이 임시방편에 그치고 있는바, 사회복지사업의 기본법인 사회복지사업법에 노숙인의 보호를 위한 정책을 실시하도록 그 근거를 마련하여 장기적 시각에서 노숙인의 인권문제를 해결하도록 함.']",보건복지위원회,"['김홍신', '고진부', '권오을', '김명섭', '김문수', '김부겸', '김성순', '김영춘', '김찬우', '박시균', '손희정', '송영길', '원희룡', '윤여준', '이부영', '이성헌', '이원형', '이재오', '전재희', '조정무', '최영희']"
160368,  자원의절약과재활용촉진에관한법률개정법률안,2000-11-21,정부,2001-12-21,대안반영폐기,제16대 (2000~2004) 제215회,"['제안이유？？？？폐기물의 발생을 생산단계에서부터 억제하고 발생된 폐기물의 재활용을 촉진하기 위하여 폐기물의 발생량이 많은 제품·포장재의 생산자에게 재활용의무를 부과하는 한편, 생산자와 소비자가 폐기물에 대한 책임을 합리적으로 분담할 수 있는 재활용체계를 수립하려는 것임.주요골자？？？？가. 제품의 포장재질(包裝材質) 및 포장방법에 관한 기준과 1회용품 사용억제 등의 실천사항을 위반한 자에 대하여 필요한 조치를 명한 후 과태료를 부과하도록 하던 것을 위반자에 대하여 바로 과태료를 부과할 수 있도록 함(안 제9조·제10조 및 제40조제1항제1호·제3호).나. 유해물질을 함유하고 있거나 재활용이 어려운 제품 등의 제조업자 또는 수입업자에 대하여 폐기물부담금을 납부하게 할 수 있도록 함(안 제12조).다. 재활용을 촉진하기 위하여 분리수거를 위한 표시가 필요한 제품에 대하여 그 제조업자 등으로 하여금 분리배출표시를 하도록 함(안 제14조).라. 폐기물의 회수·재활용을 위하여 회수·처리비용을 사전에 예치하는 폐기물예치금제도(廢棄物預置金制度)를 폐지하는 대신 재활용이 가능한 제품·포장재의 제조업자·수입업자 및 판매업자에게 그 폐기물의 재활용 의무를 부과하여 폐기물을 재활용하거나 재활용사업공제조합을 설립하여 그 의무를 이행할 수 있도록 하고, 그 의무를 이행하지 아니하는 경우에는 재활용부과금(再活用賦課金)을 징수하도록 함(안 제16조 내지 제19조).마. 빈 용기의 회수·재사용을 촉진하기 위하여 빈용기보증금을 제품가격에 포함시킬 수 있도록 하고, 소비자가 빈 용기를 반환하는 경우 제조업자·판매업자 등은 빈용기보증금을 돌려주도록 함(안 제22조).']",환경노동위원회,[]
160367,  정보통신망이용촉진등에관한법률개정법률안,2000-11-21,정부,2000-12-15,대안반영폐기,제16대 (2000~2004) 제215회,"['제안이유？？？？정보통신망의 이용을 촉진하기 위하여 인터넷서비스 품질 개선 및 인터넷주소자원의 확충을 위한 시책을 마련하고, 정보통신서비스이용자의 개인정보를 보호하기 위하여 정보통신서비스제공자에 대한 규제를 강화하며, 인터넷상의 음란·폭력물로부터 청소년을 보호하기 위하여 정보내용등급자율표시제를 도입하는 한편, 학교·도서관 등 청소년이용시설에 대하여 청소년유해정보를 선별·차단할 수 있는 소프트웨어의 설치를 권장하고 그밖의 현행 제도의 운영상 나타난 일부 미비점을 개선·보완하려는 것임.주요골자？？？？가. 정보통신망의 이용촉진 등에 관한 사항외에 정보통신서비스이용자의 개인정보의 보호제도에 관한 사항이 대폭 규정됨에 따라 법률의 명칭을 「정보통신망이용촉진및정보보호등에관한법률」로 변경함(안 제명).나. 정보통신부장관은 정보통신서비스이용자의 권익 보호를 위하여 인터넷서비스의 품질개선과 인터넷주소자원의 확충 및 적정한 활용을 위한 시책을 강구하도록 함(안 제15조 및 제16조).다. 정보통신서비스제공자가 개인정보의 수집·처리·관리 등을 타인에게 위탁하는 경우에 그 타인의 개인정보보호위반행위에 대하여 책임을 지도록 하고, 정보통신서비스제공자외의 자가 정보통신망을 이용하여 개인정보를 수집·저장·처리하는 경우에도 이 법에 의한 개인정보보호관련 의무를 부과함(안 제25조 및 제59조).라. 14세 미만의 아동으로부터 개인정보를 수집하는 경우 법정대리인의 동의를 받도록 하고, 법정대리인에게 아동의 개인정보에 대한 열람 및 정정 요구권을 부여함(안 제31조).마. 개인정보와 관련된 분쟁을 간편·신속하게 조정하기 위하여 개인정보분쟁조정위원회를 설립하고, 동위원회의 구성·운영 및 조정절차 등에 관한 사항을 정함(안 제33조 내지 제40조).바. 정보통신부장관은 일반에게 공개를 목적으로 정보를 제공하는 자에게 자율적으로 일정한 기준 및 표시방법에 따라 그가 제공하는 정보의 내용에 대하여 등급을 부여하고 이를 표시하도록 권장하고, 그 등급의 기준 및 표시방법은 정보통신윤리위원회가 청소년보호단체 등의 의견을 들어 정하여 공표하도록 함(안 제41조).사. 청소년보호법상의 청소년유해매체물인 정보를 정보통신망을 이용하여 제공하고자 하는 자는 청소년유해매체물임을 표시하도록 하고, 청소년유해매체물임을 표시하지 아니하고 영리를 목적으로 당해 정보를 제공하는 경우에는 과태료에 처하도록 함(안 제43조 및 제67조제1항제12호).아. 컴퓨터바이러스를 전달·유포하거나 타인의 정보통신망의 안정적 운영을 방해할 목적으로 대량의 정보를 전송하는 등의 행위에 대한 처벌근거를 마련함(안 제49조 및 제62조).']",과학기술정보통신위원회,[]
160366,  경비업법개정법률안,2000-11-21,정부,2001-03-08,수정가결,제16대 (2000~2004) 제215회,"['■ 제안이유국가중요시설에 대한 효율적인 경비체계의 구축을 위하여 경비업의 종류에 특수경비업무를 추가하고, 기계경비산업이 급속히 발전함에 따라 기계경비업무의 신고제를 허가제로 변경하는 한편, 기계경비업자의 신속대응조치의무에 관한 사항 등을 규정하는 등 현행 제도의 운영상 나타난 일부 미비점을 개선·보완하려는 것임.■ 주요골자1. 기계경비업무를 신고제에서 허가제로 변경하고, 국가중요시설의 경비를 담당하는 특수경비업무를 경비업의종류로 신설함(안 제2조제1호라목 및 마목).2. 경비업허가의 실효성을 확보하기 위하여 경비업 허가를 5년마다 갱신하도록 함(안 제6조).3. 국가중요시설을 경비하는 특수경비업자는 부득이한 사유로 경비업무를 계속할 수 없는 경우에 대비하여 경비대행업자를 지정하도록 함(안 제7조제6항 및 제7항).4. 기계경비업자는 경비대상시설에 대한 경보를 수신한 때에는 신속하게 대응조치를 취하도록 하고, 계약상대방에게 기기사용요령 등을 설명하도록 함(안 제8조 및 제9조제1항).5. 지방경찰청장은 국가중요시설의 경비업무 수행을 위하여 필요한 경우에 시설주로부터 신청이 있는 때에는시설주에게 무기를 대여할 수 있고, 시설주는 대여받은 무기를 특수경비업자에게 제공하여 특수경비원으로하여금 무기를 휴대·사용할 수 있도록 함(안 제14조제3항 내지 제5항).6. 특수경비원의 복종의무 및 경비구역이탈금지 의무를 명시하고, 국가중요시설의 정상적 운영을 해치는 장해를 일으킨 경우와 정당한 사유없이 무기를 소지하고 배치된 경비구역을 벗어나는 경우 등에 대한 벌칙을 규정하는 한편, 경비업무 수행중 권한을 남용하여 폭행·상해 등의 죄를 범한 경우 그 형을 가중하도록 함(안제15조·제28조 및 제29조).■ 위원회 수정사항□ 수정이유경비업자가 경비업무외 제조업, 근로자파견업 등 다른 업무를 병행할 경우 무자격자 유입, 총기유출의 위험성이 높으므로 이를 차단하기 위해 경비업자는 경비업 이외의 영업을 할 수 없도록 하고, 무기관리 사용의 안전을 위하여 시설주·관할 경찰서장의 무기관리책임 및 관할 경찰서장의 지도 감독책임과 무기의 개념을 명확히규정하고, 무기관리의무 위반자에 대한 형사처벌 및 과태료 규정을 두었으며, 특수경비원의 무기 오남용을 막기 위해 안전사용수칙을 법률에 구체적으로 규정하고, 무기를 휴대한 특수경비원 쟁의행위시 국가중요시설 방호에 중대한 차질을 초래할 수 있으므로 단체행동권을 금지함.□ 수정주요골자1. 무기의 개념을 명확히 규정함. (안 제2조제4호)2. 경비업자의 경비업 이외의 영업금지 규정을 신설함. (안 제7조제8항)3. 특수경비원에 대한 정기교육 및 경찰의 감독의무규정을 신설함. (안 제13조제2항 및 제3항)4. 무기관리·지도감독책임의 구체화 및 위반시 처벌규정을 신설함. (안 제14조제5항 내지 제7항, 안 제28조제 4항제1호, 안 제30조, 안 제31조제1항제5호)5. 특수경비원의 쟁의행위 금지규정 및 형사처벌규정을 신설함. (안 제15조제3항, 안 제28조제4항제2호)6. 특수경비원의 무기사용 안전수칙 규정 신설 및 가중처벌 구성요건을 구체화함. (안 제15조제4항, 안 제29조)7. 시행일을 6월에서 3월로 단축함. (안 부칙 제1조)']",행정자치위원회,[]
160365,  고엽제후유의증환자지원등에관한법률중개정법률안(장태완의원 외 34인),2000-11-21,의원,2003-04-30,대안반영폐기,제16대 (2000~2004) 제215회,"['■ 제안이유고엽제후유증 2세환자는 유전에 의한 동일한 고엽제후유증환자임에도 불구하고 현행법상 고엽제로 인한 질병으로 추정되고 있는 고엽제후유의증환자와 마찬가지로 장애정도를 고도장애, 중등도장애 및 경도장애로 구분하여수당지급 및 진료체계를 유지하고 있는 바, 고엽제후유증 2세환자를 고엽제후유의증환자와 구분하여, 별도의장애등급을 1급에서 6급으로 세분화해서 이들에 대한 실질적인 보상 및 진료가 행해질 수 있도록 하고자 함.■ 주요골자1. 고엽제후유증 2세환자에 대해서는 고엽제 후유증환자와 동일한 의료보호를 받을 수 있도록 함(안 제7조의2제1항).2. 고엽제후유증 2세환자에 대해서는 고엽제후유의증 환자에 대한 수당과 구분하여 보상금을 장애정도에 따라차별적으로 지급할 수 있도록 함(안 제7조의2제2항 및 제4항).3. 고엽제후유증 2세환자의 장애등급을 1급에서 6급으로 세분화 함(안 제7조의2제3항)']",정무위원회,"['장태완', '김민석', '김성순', '김영진', '김영환', '김원길', '김화중', '김희선', '박병석', '박병윤', '배기선', '설훈', '송석찬', '송영길', '신기남', '원유철', '유삼남', '유재건', '유재규', '윤철상', '이근진', '이상수', '이인제', '임종석', '임채정', '정균환', '정동영', '정동채', '정범구', '정세균', '조성준', '천정배', '최선영', '한화갑']"
160364,  공중위생관리법중개정법률안(심재철의원등 14인 외 119인),2000-11-21,의원,2002-07-31,대안반영폐기,제16대 (2000~2004) 제215회,"['■ 제안이유현행 공중위생관리법은 규제완화 및 보건위생 관련 부패방지 차원에서 공중위생영업을 자유업종으로 규정하고있으나 법의 취지와는 달리 사회풍속을 저해하고 향락산업의 과도한 발전등 청소년 교육 등에 지대한 악영향을끼칠수 있는바, 이의 개선을 위해 대통령령이 정하는 업소에 대해서는 자유업에서 허가업종으로 전환코자 함.■ 주요골자공중위생영업중 대통령령이 정하는 업소에 대해서는 영업소 개설 및 영업장 소재지 변경시 시·군·구청장에게통보하던 것을 허가사항으로 전환함(안 제3조 제2항).']",보건복지위원회,"['심재철', '강재섭', '김기춘', '김정숙', '김찬우', '목요상', '박시균', '박원홍', '손희정', '원희룡', '윤여준', '윤한도', '이부영', '이원형', '김만제', '김무성', '김문수', '김부겸', '김성조', '김영구', '김영일', '김영춘', '김용갑', '김용균', '김용학', '김원웅', '김일윤', '김종하', '김진재', '김태호', '김학송', '김형오', '김호일', '김홍신', '나오연', '남경필', '도종이', '맹형규', '민봉기', '박관용', '박근혜', '박명환', '박세환', '박승국', '박재욱', '박종근', '박종웅', '박종희', '박주천', '박창달', '박헌기', '박혁규', '박희태', '백승홍', '서상섭', '서정화', '서청원', '손태인', '손학규', '신경식', '신영국', '신영균', '신현태', '심규철', '안경률', '안상수', '안영근', '안택수', '엄호성', '오세훈', '유성근', '유흥수', '윤경식', '윤두환', '윤영탁', '이강두', '이규택', '이방호', '이병석', '이상득', '이상배', '이상희', '이성헌', '이연숙', '이원창', '이윤성', '이인기', '이재오', '이재창', '이주영', '이한구', '이해봉', '이회창', '임인배', '임진출', '임태희', '전용원', '전재희', '정문화', '정병국', '정의화', '정인봉', '정재문', '정창화', '정형근', '조웅규', '조정무', '주진우', '최돈웅', '최병국', '최병렬', '최연희', '하순봉', '허태열', '현경대', '현승일', '홍사덕', '황승민', '황우여']"
160363,  지방세법중개정법률안(전갑길의원등2인 외 48인),2000-11-21,의원,2004-05-29,임기만료폐기,제16대 (2000~2004) 제215회,"['■ 제안이유특별시·광역시세와 구세간의 세목배분을 살펴 볼 때 특별시·광역시에 조세수입이 편중되어 있는 실정임. 이로 말미암아 자치구는 그 세입의 상당부분을 의존재원에서 충당하고 있음. 따라서 조세수입의 편중구조를 시정하고 자치구의 재정자립도를 제고하고자 함.■ 주요골자특별시·광역시세인 자동차세와 구세인 면허세를 서로 교환하고자 함(안 제6조제1항제1호마목, 동조제3항제1호가목, 제170조).']",행정자치위원회,"['전갑길', '고진부', '권태망', '김경천', '김근태', '김락기', '김무성', '김성순', '김영진', '김옥두', '김용균', '김운용', '김태홍', '김희선', '민봉기', '박상규', '박종희', '서상섭', '설훈', '송석찬', '송훈석', '신현태', '안영근', '원유철', '원희룡', '윤두환', '윤철상', '이강두', '이강래', '이낙연', '이병석', '이원창', '이인기', '이호웅', '이훈평', '임종석', '장영신', '장정언', '장태완', '정대철', '정동채', '정문화', '정창화', '주진우', '최병국', '최용규', '하순봉', '허태열']"
160362,  예금자보호법중개정법률안(홍재형의원등 30인 외 1인),2000-11-21,의원,2000-12-22,대안반영폐기,제16대 (2000~2004) 제215회,"['■ 제안이유금융부실을 사전예방하기 위하여 예금보험공사의 기능을 강화할 필요성에 따라 이를 위한 제도적 장치를 마련하려는 것임.■ 주요내용가. 공사가 보험사고의 예방을 위하여 부보금융기관(附保金融機關) 및 그 지주회사 등에 대하여 업무 및 재산상황에 관한 자료제출요구 및 조사를 할 수 있도록 하고, 조사결과 보험사고의 위험이 있다고 판단되는 경우 금융감독위원회에 적절한 조치를 취하여 줄 것을 요청할 수 있도록 함(안 제21조).나. 공사가 부보금융기관이 되고자 하는 자의 보험가입자격을 심사하여 그 결과에 따라 승인여부를 결정할 수 있도록 하고 부보금융기관이 특별보험료를 납부하지 않을 경우 보험관계를 해지할 수 있도록 함(안 제29조 및 제29조의3).']",재정경제위원회,"['홍재형', '강숙자', '김근태', '김동욱', '김만제', '김원길', '김태식', '김효석', '문석호', '박병윤', '박종근', '서상섭', '송광호', '신경식', '신기남', '심규섭', '안대륜', '윤경식', '이근진', '이원성', '이원형', '이정일', '이훈평', '임진출', '임태희', '장영신', '장태완', '전용학', '정세균', '추미애']"
160361,  지방세법중개정법률안(엄호성의원 외 19인),2000-11-20,의원,2000-12-21,폐기,제16대 (2000~2004) 제215회,"['■ 제안이유현행법상 승용자동차에 대한 자동차세는 차량의 사용연수에 따른 재산적 가치 감소를 고려하지 않고 배기량을기준으로 일괄적인 과세가 되고 있어서 조세형평에 어긋난다는 문제점이 제기되고 있는 바, 5년이상 경과된 비영업용 승용자동차에 대하여는 보유기간에 따라 차등적으로 자동차세를 부과하도록 함으로써 자동차의 장기보유나 중고차의 거래를 활성화하고 조세의 형평성을 도모하려는 것임.■ 주요골자1. 비영업용 승용자동차에 대하여 신규등록일부터 납기가 있는 달의 1일 현재까지의 기간이 5년이 지난 때부터매년 10%씩 최고 50%까지 단계적으로 자동차세를 감액함(안 제196조의5제1항).2. 자동차세의 사용연수별 차등과세에 따라 지방세수입이 감소하는 것을 보전하기 위하여 주행세의 세율을1,000분의 32에서 1,000분의 90으로 상향조정함(안 제196조의17).']",행정자치위원회,"['엄호성', '강신성일', '권태망', '김무성', '김진재', '김학송', '김형오', '도종이', '박관용', '안경률', '원희룡', '윤경식', '윤한도', '이강두', '이부영', '이성헌', '정문화', '정재문', '최병렬']"
